Title,Article
Pakistan consign India to horror defeat in Champions Trophy final,"A fearsome burst of pace bowling from Mohammad Amir consigned India to a horror 180-run defeat at The Oval on Sunday as Pakistan won their maiden ICC Champions Trophy title with plenty to spare. (HIGHLIGHTS | SCORECARD)

Chasing Pakistan’s 338 for four, India went down without a fight as the defending champions lost three in-form batsmen in the first nine overs. Hasan ‘bomber’ Ali took three wickets for 19 to polish off the Indian tail. Pakistan won with 117 balls to spare.

Hardik Pandya’s 43-ball 76 was the lone bright spot in India’s batting, but his run out gave Pakistan an easy passage to victory.

Mohammad Amir, who reported fit just in time for the mouth-watering final, wiped out the top order with clever use of the seam and length as Pakistan attacked like a pack of hungry dogs.

Pakistan's Fakhar Zaman scored 114 in the ICC Champions Trophy final against India. (PA Images via Getty Images)

On Saturday morning, the Indians were practising ‘banana’ freekicks. On Sunday, Mohammad Amir literally bent the ball like Beckham to catch Rohit Sharma plumb in front of the wicket and then got the better of an indiscreet Virat Kohli.

Kohli had been preaching the message of composure throughout the Champions Trophy but on a big day, the captain lost control even after enjoying a life the previous ball.

When Azhar Ali spilled a regulation catch after Kohli edged Amir to first slip, Pakistan’s heart sank. Did Pakistan drop their first ICC Champions Trophy?

Kohli did not learn from his mistake. To Amir’s credit, he bowled the next ball cross-seam and pitched just back of length. Kohli’s mistimed flick went to backward point.

If Kohli’s wicket gave Pakistan resolve, Amir found the edge of Shikhar Dhawan’s tentative bat to add extra belief. The wicket also exposed India’s untested middle order.

India lost Yuvraj Singh and MS Dhoni in the space of four balls. Yuvraj looked good for his 31-ball 22 but leg-spinner Shahdab Khan won an LBW decision via the TV umpire. Dhoni too lost composure, pulling Hasan Ali to deep square leg.

India captain Virat Kohli after his team lost to Pakistan by 180 runs in the ICC Champions Trophy final. (AP)

Imad Wasim’s diving catch at deep square leg reflected Pakistan’s eagerness to play good cricket. They never lost control even after Pandya launched into their spinners. After Junaid Khan got rid of Ravindra Jadeja, it was just a matter of time.

Earlier, Fakhar Zaman’s maiden ODI hundred (114) and his 128-run opening wicket stand with Azhar Ali helped Pakistan pile on a formidable 338 for four wickets.

A classy fifty by Azhar Ali (59), Babar Azam’s 46 and Mohammad Hafeez’s cavalier 57 not out off 37 balls added muscle to the Pakistan innings.

Fakhar Zaman stood out with his cavalier knock after enjoying a huge slice of luck when on 3. He had edged an expansive drive to the keeper, but Jasprit Bumrah had bowled a no ball. That came to hurt India in a game where the margin of error was virtually nil.

THE ‘LIFE’ THAT HURT

That ‘life’ emboldened the 27-year-old left-hander to launch into the Indian attack that was far less impressive with its line and length on an all-important day. Fakhar made India pay through their nose.

India chose to field after Virat Kohli called correctly. It looked the right decision considering the fact that the pitch was a new one with a tinge of green and India’s quick bowlers – Bumrah and Bhuvneshwar – had delivered in the previous matches against South Africa and Bangladesh.

India conceded 56 runs in the first 10 overs. This was the first time in this ICC Champions Trophy that India’s bowlers gave away so many runs in the first powerplay. India conceded 91 runs (five fours and four sixes) in the last 10 overs, taking just one wicket.

ERR IN LINE

Bumrah and Bhuvneshwar erred in line and length. Full toss on the pads, width outside off and short balls with no venom were punished easily by the Pakistan batsmen. The pulls and cuts were used liberally.

Pakistan paced their innings well. With wickets in hand, their middle order was in full cry.

Mohammad Hafeez used his experience and footwork to score runs at a rapid clip. Having smashed three fours off the first seven balls he faced, Hafeez raced to his 32nd ODI 50 off 34 balls. He produced an invaluable 71 runs for the unbroken fifth wicket with Imad Wasim, who remained undefeated on 25."
Rafael Nadal to skip Queen’s tournament to be fit for Wimbledon 2017,"Rafael Nadal confirmed he has pulled out of next week’s Aegon Championships at Queen’s in order to rest and prepare for Wimbledon.

The 31-year-old Spaniard has had a hugely successful clay season, claiming a record 10th French Open crown on Sunday to earn a 15th Grand Slam title.

The world number two said on his Facebook page that he was sad to skip the tournament as he loved Queen’s and a good performance in this tournament allowed him to perform well in Wimbledon.

Nadal won clay titles this season in Monte Carlo, Barcelona and Madrid in addition to Roland Garros.

He won Queen’s in 2008 before going on to lift his first Wimbledon title, again taking the Grand Slam trophy at the All England Club in 2010. Wimbledon begins on July 3.

Organisers confirmed Nadal’s withdrawal on their Twitter account.

Unfortunately, Rafael Nadal has withdrawn from the Aegon Championships at Queen’s.



More - https://t.co/ruYvi9VfRv — Aegon Championships (@QueensTennis) June 13, 2017

The Queen’s tournament will be headlined by world number one and defending champion Andy Murray, with US Open champion Stan Wawrinka, runner-up to Nadal in Paris, also competing as the second seed."
UK election result 2017: Why a hung parliament is good news from Britain,"There are no visible winners from the British election. Except the British people.

For the voters, the election was about Britain’s future in the European Union, about its embrace of the free market, about pensions and housing, health and affordable education. It was also a measure of how far down right the country would go in the face of repeated terrorist attacks and growing anti-immigrant chatter from the ruling Conservatives.

Insofar as returning a divided mandate Britain has shown it was unwilling – just like France a month ago – to give up on its reputation for optimism, fairness and the spirit of enlightenment for a dark, pessimistic, xenophobic nation with a diminished relationship with the world.

For that alone the British people deserve the global applause Americans could have earned had they been more discerning when it came to electing Donald Trump as president.

In the run up to the election, it was easy for Britain to slip into a society closing in on itself rather than staying open.

It was a society torn over the referendum to leave the European Union. The economy looked uncertain, business confidence was hit, the pound traded 15% lower to the US dollar since the referendum and the wage-inflation gap was narrowing, signalling an income squeeze.

Then came the terrorist attacks, three deadly strikes over as many months that led Prime Minister Theresa May to speak of “far too much tolerance of extremism in our country”.

All this was the perfect grist for the mill for the narrative of fear-mongering, persecution and xenophobia that was used to fuel the rise of the far-right in many other parts of the world.

If it doesn’t descend into a coalition of chaos over complex policy decisions such as Brexit, a multi-party government can ensure against Britain pandering to any erratic and unhelpful global order.

Should May continue as prime minister in such a coalition, her political partners would be loath to support her idea of a special relationship with the United States or undermine any policy of social coherence focused on upholding human rights.

As for Labour Party leader Jeremy Corbyn, a lifelong anti-war campaigner who is May’s rival for the top job, he is known for calls to end “unilateral aggressive wars of intervention” and refusal to “scapegoat” migrants.

In politics, a landslide victory often triggers the tyranny of totalitarianism. That’s why the British election mandate may not be all that bad."
"Champions Trophy 2017: The men who have propelled India, Pakistan so far","Defending champions India and Pakistan cricket team have had contrasting routes to the ICC Champions Trophy final. While the Indian cricket team, who started the tournament as one of the favourites, have been clinical (even in the loss against Sri Lanka), Pakistan have been riding their luck among other things to reach the summit clash. But, both the teams have enjoyed some stellar performances from key players.

We list out five starts from both the teams who have propelled the teams so far.

INDIA

Rohit Sharma: The stylish batsman is enjoying a superb run of form and has been instrumental to India’s success in the Champions Trophy. With 304 runs in his kitty, he will be expected to again provide a perfect start with partner-in-crime Shikhar Dhawan.

Shikhar Dhawan: Since the start of the IPL, Dhawan has been in a belligerent mood with the bat and has maintained his form in the Champions Trophy. While he’s held back his shots and started slowly, when he accelerates, he ensures the match turns on its head. Barring the first game against Pakistan, Dhawan has hit at least a half-century in every match, including a century against Sri Lanka at the Oval.

Virat Kohli: Cometh the hour, cometh the man. There were questions raised about his form as he was going through a rare lean patch before the start of the Champions Trophy but the Indian captain has struck form in style with three half-centuries in the tournament, staying unbeaten in each of those knocks.

Bhuvneshwar Kumar: Alongside Umesh Yadav, Mohammed Shami and Jasprit Bumrah, he has completed the famed Indian pace quartet that has been in superb form over the past few months. However, it’s the variations coupled with his ability to swing the ball both ways that has helped Bhuvi at the Champions Trophy. Thus, although Bumrah has been India’s most economical bowler, Bhuvi has been the strike bowler with six wickets.

Jasprit Bumrah has been Indian cricket team’s trump card during the death overs and the pacer, with his consistent and accurate yorkers, have always delivered when called into action by skipper Virat Kohli. (Getty Images)

Jasprit Bumrah: Sharing the dressing room with Lasith Malinga during the IPL season, Bumrah’s yorkers have become as effective as the former’s in his heyday. He’s fast, has a good slower-one up his sleeve and can mix his deliveries well in the course of an innings. Thus, while batsmen usually stick to their ultra-defensive game to see off his overs, runs dry up quickly.

PAKISTAN

Hasan Ali: He is the tournament’s highest wicket-taker (10 wickets) and will be crucial if Pakistan are to stop the Sharma-Dhawan-Kohli juggernaut on Sunday. Ali usually clocks over 140 kph but what makes him effective is the way he gets the ball to dart back in, gain movement in the air and bowl variations.

Hasan Ali of Pakistan cricket team is the top wicket-taker in the ICC Champions Trophy so far. (Getty Images)

Junaid Khan: It’s often said fast bowlers hunt in pairs. For Pakistan, it’s the Hasan-Junaid pair that the entire country will pin their hopes on. Although Hasan leads the tally, Junaid isn’t far behind, with seven wickets and shares the role with Hasan. The two will be instrumental if Pakistan are to take early wickets and bring pressure on the Indian middle-order.

Azhar Ali: He’s the leading run-getter for Pakistan in the tournament and has already hit two half-centuries (50, 9, 34, 76). He has been consistent, but hasn’t been able to consolidate on those starts by scoring big. With opening partner Fakhar Zaman, they can upset India’s plans on Sunday.

Fakhar Zaman: Fakhar Zaman made his international debut against South Africa in the second group game and impressed before heading back on 31. The loss against India had called for changes in the side and he grabbed the opportunity, hitting half-centuries in the next two matches to help Pakistan come out on top in the crunch games.

Fakhar Zaman is the find of the ICC Champions Trophy for Pakistan cricket team. He made his debut in the tournament and has scored two half centuries, both for a victorious cause, and will be a key player in the final against Indian cricket team. (Getty Images)

Mohammed Hafeez: With just 91 runs in the tournament, he may not have made a big impression so far but is still the third highest run-getter for his side. His scores of 33, 26 and 31* indicate he has lost his wicket after settling down. His part-time spin has fetched him just one wicket so far."
MP: Fugitive ‘king of Dewas’ surrenders over farmer’s murder in 2015,"Vikram Singh Puar, the 27-year-old son of the deceased “king” of the former Dewas royals in Madhya Pradesh, surrendered on Wednesday after being on the run for more than a year for his suspected role in a murder.

He has been accused of leading a fatal clash with 12 armed supporters over a land dispute in Raghogarh village, about 40km from Dewas.

Puar and his gang allegedly tried to take away the wheat harvest of a farmer, Pratap Lodhi, on March 19, 2015. Lodhi and his family members resisted and, in the ensuing clash with firearms and lathis, the farmer was gravely wounded. He died on March 22.

The young former royal was on the run since then and a special court granted him anticipatory bail for 15 days in June 2016 as his father, former BJP minister Tukojirao Puar, was in his death bed.

His bail application was approved so that he could perform last rites of his father who died of brain haemorrhage on June 19. A day later, Puar was crowned “King of Dewas” at a private ceremony in the family’s palace.

Madhya Pradesh chief minister Shivraj Singh Chouhan, home minister Babulal Gaur and Congress leader Digvijaya Singh had attended the senior Puar’s funeral.

The new “king”, however, escaped and remained in hiding until he surrendered before a judicial magistrate on Wednesday.

Dewas police arrested Puar at a local hospital where he was admitted earlier in the day. The magistrate sent him to judicial custody till January 7.

Superintendent of police Shashikant Shukla said Puar’s police remand was not sought because “there was nothing to recover from him”.

But several questions remained unanswered: Where was the fugitive hiding? What was he doing? Who was he with? Who all helped him helped him during the period?

A murder charge has been registered at Barotha police station in Dewas after the farmer’s death. But a court acquitted 12 of the 13 accused last December, making the case weak against Puar, legal experts said.

Read | The curious case of hostile witnesses, acquittals and Dewas ‘king’ on the run"
"HC orders CBI inquiry into theft of machine from RRCAT, Indore in 2004","Bhopal/Jabalpur: High court Jabalpur bench ordered a CBI inquiry on Friday into theft of a machine from Raja Ramanna Centre for Advanced Technology, Department of Atomic Energy, government of India at Indore that took place in 2004. The machine was worth Rs 5 lakh.

The HC bench of Sanjay Yadav passed the order on a petition filed by Krishna Kumar Mishra, who was employed with the Centre as a scientific assistant/D. Mishra alleged in the petition he had to resign from his job in July 2004 as a result of victimisation.

The court observed, “In view of the correspondence entered into between the concerned authorities and the affidavit sworn in by Gopalkrishnan Venkatesan, administrative officer-III, RRCAT, gravity and seriousness of the crime which is subject matter of investigation cannot be ruled out and since the local Police is unable to investigate the crime effectively, this court is of the considered opinion that the same deserves to be investigated by the Central Bureau of Investigation.”

Levelling various irregularities in the institute in his petition the petitioner demanded a CBI inquiry into the matters raised by him especially ‘in case of mysterious theft/ disappearance of petitioner’s lock-in-amplifier, interception of telephones/e-mails/postal letters/ bugging of domestic conversation of the petitioner, suicide of Lt Thirumal, suicide of Lt Attar Singh, suicide of Rajesh Topno and other financial irregularities prevailing in the RRCAT, Indore’.

The court, however, didn’t entertain the petitioner’s prayer to remove the head of the institute and order a CBI inquiry into all the issues raised by him. The court ordered the CBI inquiry in context of the FIR lodged with Rajendra Nagar police station in Indore vide crime no. 36/2005. The FIR was lodged against unknown persons in respect with the theft of lock-in-amplifier that had taken place in the year 2004.

Police had filed a closure report before additional chief judicial magistrate, Indore on April 28, 2005 in connection with the FIR but the court didn’t accept the closure report as the statements of the petitioner and one Shailja had not been recorded."
Who will win the US presidential election?,"Predicting the outcome of the US presidential election is hard. There are dozens of polls, none of which seem to agree with the others. Even betting markets, which are at least as predictive as scientific polls, list different prices.

To get around this problem, election forecasters combine poll results, betting market prices, as well as economic and historical factors to produce predictions about who will win the presidency. But even the forecasters don’t always agree. Often, they assign different odds to the candidates; sometimes, they even predict different winners. So how do you know which forecast to trust?

One approach is to trust none of them individually, but to trust all of them collectively. I’ve selected some of the leading election forecasters — the Upshot, FiveThirtyEight, Daily Kos, and PredictWise — and put their predictions all on one chart that shows you where the race stands and where it is heading.

Which forecasts are we tracking?

Daily Kos — The Daily Kos presidential forecast combines public opinion polls and three other variables which appear to have had an affect on previous presidential election outcomes. Those are (1) the incumbent president’s net approval or disapproval rating in June of the election year, (2) the percent change in America’s gross domestic product from the first to the second quarter of the election year, and (3) whether the incumbent party has held the presidency for two or more terms. Read more about the Daily Kos’s methodology.

FiveThiryEight — FiveThirtyEight (the name comes from the number of electors in the Electoral College) produces three general election forecasts: one based only on the polls, another based on the polls and other factors, and a “now-cast” showing what would happen if the election were held today. I have shown only the polls-based forecast here. FiveThirtyEight rounds its predictions to the nearest one-tenth of a one percent. For the sake of simplicity, I have furthered rounded it to the nearest percent. FiveThirtyEight also includes a prediction for Libertarian candidate Gary Johnson, whose chances are negligible and who has been removed from this page. Read more about FiveThirtyEight’s methodology.

PredictWise — PredictWise’s general election forecast is based not only on public opinion polls, but also on betting markets, where “investors” can buy and sell “futures” in candidates, the prices of which are determined by market activity. Such betting markets have been shown to be at least as predictive as polls. Read more about PredictWise’s methodology.

The Upshot — The Upshot is the New York Times’s data blog. Its general election forecast is mostly based on hundreds of state and national polls. It also incorporates, to a lesser extent, the voting history of every state. Read more about the Upshot’s methodology."
ICC Champions Trophy: Virat Kohli-led India face test of survival vs South Africa,"Jharkhand board JAC inter arts result 2017 at around 2.30pm on June 20: Know how to check

Jun 19, 2017 15:12 IST"
ICC Champions Trophy: India beat Bangladesh to set up final against Pakistan,"The Taj Mahal: An expression of a tapestry that is India

Jun 18, 2017 09:36 IST"
India vs Pakistan ICC Champions Trophy final: Confidence vs resurgence,"Sunday will be a unique day in the sports history of India and Pakistan. While the cricket teams will battle in the final of the 2017 ICC Champions Trophy at The Oval, the arch-rivals will also clash at the Olympic Park in a match of the FIH World Hockey League semi-finals.

But both cricket and hockey will be in their respective realms as focus and composure will be the key factors on Sunday as Pakistan eye their maiden Champions Trophy win and India their third.

This year’s Champions Trophy has seen several twists and turns. Three Asian teams making the last four of the tournament that brings the best eight ODI teams in the world is a huge statement of the sub-continent’s domination.

If defending champions India were one of the fancied sides, Pakistan’s amazing turnaround in the tournament has been an eye-opener. This is the first time India and Pakistan will clash in the Champions Trophy final, and in the circumstances, there will be no favourites.

Pakistan, who have never been in the final of a Champions Trophy, came in as the lowest ranked side. No one gave them a chance after India walloped them by 124 runs in their opening group B fixture in Birmingham on June 4.

But then calculations went haywire in both groups.

South Africa, the world’s No. 1 ODI team, former champions Australia and dark horses New Zealand failed to cross the group stage. Pakistan stunned favourites England by eight wickets in the semi-final at Cardiff and India blew away Bangladesh by nine wickets at Edgbaston to set up a dream final that is sending the ICC and the host broadcasters laughing all the way to the bank.

Intense India

After being on the road to London from Birmingham on Friday, India were back at the nets on Saturday morning. Under a blazing sun, Virat Kohli’s men spent an intense three hours breaking sweat. A lot of that training was dominated by fitness drills.

Football plays a big role in training these days. In David Beckham’s country, the likes of Kohli, Ravindra Jadeja and Hardik Pandya were practising set-pieces – banana kicks and putting the ball between two wickets (read goalposts).

The set-pieces will be significant in terms of the match on Sunday. Irrespective of the teams, both batsmen and bowlers will have to eschew flamboyance and build a pace that will be ensuring solidity throughout the 100 overs.

Mohammad Amir missed the semi-final clash against England due to a back injury in the ICC Champions Trophy 2017. (Getty Images)

Amir fit to play

Pakistan’s bowlers, particularly left-arm pacer Mohammad Amir is fit to play the Champions Trophy final. He is perfectly capable of the banana swing, although the white ball hasn’t swung much in UK.

But the reverse swing and cutters will come into play and Hasan Ali, Pakistan’s ‘bombshell’ seamer, will be the man that India’s top order needs to play well.

India are unlikely to change the playing XI that hammered South Africa and Bangladesh in back-to-back matches. With a taped right knee, there is slight doubt on Ravichandran Ashwin’s full fitness but India will need him against a team that has specialist left-handed batsmen. If Ashwin misses the final, pacer Umesh Yadav should be back.

Pakistan will be targeting India’s top three batsmen for sure. Although Rohit Sharma, Shikhar Dhawan and Kohli have scored buckets of runs they will treat the Pakistan attack with respect. Early wickets will expose the middle order which has not been tested.

But Virat Kohli is nonchalant. “The middle order is waiting for an opportunity to strike and guys like Hardik Pandya can produce that match-winning performance on a big day,” said the skipper.

The IPL factor

On hindsight, the IPL seems to have done a world of good to the Indian players. The entire team is used to playing pressure games and the squad looked in a comfort zone of another world final.

Pakistan coach Mickey Arthur said his players were “excited” for the final match and the mood in the dressing room is upbeat.

“The loss against India in Birmingham was an aberration. We have trained hard for this tournament and if we have beaten England, I am not surprised. The young team has no fear of losing and we are backing ourselves in the final,” said the South African with vast coaching experience.

India may be the form team but this Pakistan team is a galvanised lot under an intelligent captain Sarfraz Ahmed. The wicket-keeper batsman is unlike a boisterous Shahid Afridi and wants his team to do all the talking with its batting, bowling and fielding."
"Rafael Nadal cruises past Dominic Thiem, enters 1st French Open final since 2014","about the video

Nine-time French Open champion Rafael Nadal beat Dominic Thiem 6-3 6-4 6-0 on Friday to reach the final at Roland Garros for the first time since 2014. Thiem went into this match against Nadal fresh from his shock upset of defending champion Novak Djokovic of Serbia. (Video credit: SNTV) (Hindustan Times)"
