Title,Article
PCB chief manhandled after India vs Pakistan ICC Champions Trophy final,"Pakistan Cricket Board (PCB) chairman Najam Sethi said he was manhandled, pushed and shoved by a small group of Pakistan Tehreek-e-Insaf (PTI) supporters at The Oval after the India vs Pakistan ICC Champions Trophy final. (Ind vs Pak highlights| Scorecard |Video Highlights)

“I was manhandled pushed and shoved by a small group of PTI supporters. Police pulled me to safety. Overwhelming love and affection though,” Sethi tweeted.

“Several journalists & eyewitnesses confirm a group chanting pro-PTI slogans was involvd in manhandling @najamsethi outside Oval #PakVsIndia (sic),” said a Twitterati, to which Sethi replied, “That is correct.”

No one even touched Najam Sethi but he's claiming he was attacked beaten and hustled. See the video & judge yourself pic.twitter.com/fuGpWn3j8o — Farhan K Virk (@FarhanKVirk) June 18, 2017

Pakistan came out with a splendid all-round performance as they defeated arch-rival India by 180 runs to lift their maiden Champions Trophy title.

Chasing a challenging total of 339 runs, India bowed down before the Pakistani bowlers and got all out for mere 158 runs in 33.3 overs.

Chasing such a big target, that too in the finals was never going to be easy and India had pinned all its hopes on Virat Kohli, one of the best chasers in the world as he had done so many times for the Men in Blue in the past."
"‘Virat Kohli’s positive vibe rubbed on India, AB De Villiers couldn’t do that’","It was perfect Sunday for Team India. We got things right from the start by winning the toss and electing to bowl. It was important to put South Africa under pressure. The manner in which India’s bowlers operated in the first 10 overs was the perfect example of how not to give away cheap runs.

It was a game in which the desire to win mattered a lot, and South Africa simply did not turn up. Their approach and intent wasn’t positive and that essentially played a very crucial role in the way it lost. They needed to rise to the occasion and South Africa just didn’t do that.

Watch | India vs South Africa, ICC Champions Trophy 2017, match video highlights

At the international level, the margin for error is always minimal, and South Africa did not play the big moments well. Not only did their batting unit suffer a collective failure, but also made silly mistakes, thereby, allowing India to control the game.

You don’t see three run-outs in an innings that often. Dismissing AB de Villiers and David Miller with their brilliant fielding, Team India enjoyed a huge boost in confidence.

Read | Jasprit Bumrah, Bhuvneshwar Kumar - Virat Kohli’s pace twins in Champions Trophy

I did not expect South Africa, the world’s top-ranked ODI side team, to choke yet again. I thought they had shed the choker tag, but I was clearly wrong. I just don’t understand why South Africa fall short of expectations at the global tournaments year after year.

It was always going to be an easy chase for India, considering they had dismissed a world-class team for a paltry total of 191 runs. This was a very commendable feat and special credit must go to the likes of Jasprit Bumrah, who was just fantastic. Bhuvneshwar Kumar and the spinners also chipped in when it mattered.

Read | India vs South Africa: Soft dismissals cost us the match, says AB de Villiers

It was a fantastic bowling effort from India. The pacers did a great job by bowling dot balls in the first 10 overs. It surely must have made South Africa go on the back foot. That effort went a long way in helping India dominate South Africa on the day.

Talking about the batting department, Shikhar Dhawan just keeps getting better with every outing in this tournament. You can expect the likes of Virat Kohli to come and keep things steady right till the end, especially when the team is chasing. Just like last Sunday, this was a 10-on-10 performance.

Read | Champions Trophy: You have to sometimes say things that hurt, says Virat Kohli

Kohli and de Villiers are teammates in the Indian Premier League, playing for Royal Challengers Bangalore, but you can tell how apart they are right from the manner in which they approach games.

Kohli’s intent has always been so positive. It shows when he steps on to the field. On the other hand, you just don’t see that from de Villiers. This is where Kohli beats him. And such things do matter, even more so when you’re the captain of the side. The team catches on to such vibes and that’s what separates a winning team from the rest.

Read | ICC Champions Trophy: South Africa missing spark in game, says Graeme Smith

Despite the defeat, South Africa is still a very good, quality side. All they need to do is get together and believe in themselves. South Africa need to change the approach like how England did after the ICC Cricket World Cup 2015. You can see how expressive its game has become since then.

South Africa needs to come up with a plan and figure out why it doesn’t perform well in major tournaments. It is a quality side, but sadly it doesn’t play as well as India and the other big guns. That needs to change if it is to win anything major in the future.

Courtesy: www.icc.cricket.com"
Feed The Future Now: movement to serve 5 billion mid-day meals by 2020,"The initiative to serve 5 billion mid-day meals by 2020 is just what India needs as it has the world’s highest malnourished, stunted kids. Recent data shows that almost two in five Indian children under five years of age are stunted, or too short for their age.

India was rated as a country with “serious” hunger levels in the 2016 Global Hunger Index (GHI), with fifth highest GHI score in Asia— better than only Afghanistan, Timor-Leste, Pakistan, and North Korea.

On the occasion of World Hunger Day that is on Sunday, May 28, The Akshaya Patra Foundation along with nine leading corporates and Government of India flagged off a movement to raise awareness about importance of nourishment amongst children and its impetus to education.

Christened as ‘Feed The Future Now’, this movement aims to serve 5 billion meals to children across India by 2020 with a view to create a ‘Poshit Bharat, Shikshit Bharat.’

Maneka Gandhi, minister for women and child development, flagged off the movement.

“Malnutrition is one of those issues that require urgent attention. The focus should not be on feeding just food, but providing a nutritious meal,” said Gandhi.

“I believe children should be provided packets that contain 600-1000 calories and nutrients and urge The Akshaya Patra Foundation to take up this initiative. I congratulate all the corporates for partnering with this cause and I am sure you will achieve great results through this movement.”

There is a growing need to ensure children are well nourished at the age of 0 – 12 years.

“Food is not charity. Food is life. Setting a child on a proper course with good daily nutrition and the ability to attend and succeed in school is our collective social responsibility and one which reaps unlimited rewards as new generations grow and thrive,” said Shridhar Venkat, CEO- The Akshaya Patra Foundation.

The movement envisions a public-private partnership and engages the civil society at large, so that reducing malnutrition becomes a common mission for everyone.

The corporates that have partnered with The Akshaya Patra Foundation are GSK Consumer Healthcare, Reliance Fresh, Nestlé India, PepsiCo India, Viacom18, Reliance Broadcast Networks Ltd, PVR Ltd, Facebook and The LaLiT."
ICC Champions Trophy 2017: Sarfraz Ahmed-led Pakistan erupt in joy after historic win,"Bankers to meet from Monday to decide on large loan defaulters

Jun 18, 2017 19:32 IST"
Binge on these five super TV shows to escape the disaster that has been 2016,"Demonetisation. The US election outcome. Pollution. Leonard Cohen no more. Kashmir. Kanpur train derailing… And these are events that have occurred only over the last few weeks. The list gets longer and longer as you go back month-on-month to the disaster that has been 2016. So if you, like us, are feeling overwhelmed and need a different world to flee to – even if figuratively – here are five fantastic TV shows to binge-watch that promise an escape, alright. So get streaming and wake up (to a better reality, hopefully) when December ends.

Stranger Things

This Netflix-original that debuted in July this year, and which is possibly one of the best shows of 2016, is a sci-fi thriller with a liberal dose of mystery, drama and jumpy horror moments thrown in. But what makes Stranger Things so special – apart from the nail-biting plot and stellar cast – is the possibility it offers of an alternate universe where everything is just the same as yours, yet quite not so. The ‘Upside Down’ may not exactly be the kind of world you were hoping to escape to, but it is exciting no less.

Black Mirror

The third season of this highly acclaimed satirical sci-fi series released last month and the ratings have already been through the roof. Unlike the first two seasons that had three episodes each, this has six marvels, each with a different plot and cast. And each is a terrifying study into our world today – obsessed with technology, social media and keeping up appearances online – and the world we might be living in if we aren’t careful enough. As series creator Charlie Brooker said in a 2011 The Guardian interview when the show first premiered, “They’re all about the way we live now – and the way we might be living in 10 minutes’ time if we’re clumsy”.

The 100

Another science fiction, this one is a post-Apocalyptic action drama that rolls both utopia and dystopia into one action-packed, heart-thumping show. Ninety-seven years after a nuclear war wipes out civilisation on earth, a spaceship housing the last lone survivors starts running critically low on life support. So it sends back 100 juvenile lawbreakers back to earth in the hope of repopulating the planet. You’ll be making a mistake if you plan to leave the rest to imagination.

The Returned

Adapted from the 2012 French series Les Revenants, this supernatural thriller that released last year will give you all the creeps, and then some feels. A sleepy little mountain town is suddenly thrown into complete chaos when several locals come back from the dead. No, literally! As if resurrecting from their other worlds wasn’t enough, they also haven’t aged and are unaware of their own deaths. The shock of their families is only understandable, but what is difficult to comprehend are the strange happenings that begin to occur in the town following their arrival. [PS: You might want to watch the French original, as the English one was called off air abruptly. Talk of strange happenings!]

The Night Of

This crime thriller that premiered in August this year had even Shah Rukh Khan hooked, reportedly. Don’t be discouraged by the fact that there is not even a hint of any other world in this – it’s simply set in present-day New York. Sometimes, a different world can exist in your own mind, where the sequence of events is vastly different from what is presumed by others to have occurred – especially when there’s alcohol and a cocktail of drugs involved. This is what happens when after a night of partying with a female stranger, a man wakes up to find her stabbed to death and is charged with her murder. Add prevailing racial tensions in the mix, and you’ve a total mind-bender.

From HT Brunch, November 27

Follow us on twitter.com/HTBrunch

Connect with us on facebook.com/hindustantimesbrunch"
