Title,Article
"India vs Pakistan, ICC Champions Trophy 2017 final: Where to get live streaming, live cricket score","Live streaming and live cricket score of the ICC Champions Trophy 2017 final between India and Pakistan at The Oval on Sunday was available online. PAK thrashed IND by 180 runs to become the fourth team to complete the ICC treble. (PREVIEW) (HIGHLIGHTS | SCORECARD)

Live matches and live streaming in India

In the Indian sub-continent, the ICC Champions Trophy 2017 will be broadcast on STAR Sports India while the event will be live streamed online on Hotstar (both on mobile and internet).

Live matches and live digital streaming (For international viewers)

Following is a list of channels, where ICC Champions Trophy 2017 will be broadcast live in foreign countries:

Australia: Channel 9, Fox Sports

Afghanistan: Lemar TV, Star Sports India

Bangladesh: GTV, Star Sports India

India: DD National (Only India matches), STAR Sports 1, STAR Sports HD 1, STAR Sports 2, STAR Sports HD 2, STAR Sports 3, STAR Sports HD 3

New Zealand: Sky Sports, Sky Sports NZ

United Kingdom: ITV 1 & 4, SkySports

USA: ESPN3, Willow TV

Sri Lanka: SLRC Channel Eye, Star Sports India

Pakistan: PTV Sports, Ten Sports, Star Sports India

Carribbeans, South America, Central America: ESPN

South Africa: SuperSports

Middle East: OSN Sports

Canada: SportsNet, WillowTV

Pacific Islands, Papua New Guinea: Fiji TV, SKY Pacific

Singapore: Star Cricket Starhub & Singtel

Hong Kong: Star Cricket - PCCW

Netherlands: Fox Sports

Wales, Scotland and Republic of Ireland: Sky Sports 2

Rest of the World: Hotstar"
"Top ten rank holders in AIIMS MBBS entrance test our students, say rival schools","India’s coaching centres sell dreams to millions of young students, often claiming sureshot formulas to crack the country’s tough medical or engineering exams. Many of them also deliver on their promise.

But the cut-throat nature of the business played out in a bizarre manner on Thursday with two institutes laying claim to the top ten rank holders in the MBBS entrance exams conducted by the All India Institute of Medical Sciences (AIIMS).

The results were declared at around 2 am on Thursday. AIIMS does not declare a list of toppers.

One of the institutes is based in Kota, a city in Rajasthan which is known as the coaching centre of the country with 40-odd institutes that admit 1.5 lakh students annually.

A few hours after the results were declared, the Kota-based Allen Career Institute said the top ten were its students, led by all-India topper Nishita Purohit from Surat in Gujarat.

Institute director Naveen Maheshwari gave out the names and positions of the others as well — Archit Gupta (2) followed by Tamoghna Ghosh, Nipun Chandra, Harsh Agarwal, Rishav Raj, Harshit Anand, Rinku Sarmah, Abhishek Dogra and Manish Moolchandani.

Later in the day, another coaching institute, Aakash Educational Services Pvt Ltd (AESPL), came out with its own list of 11 students who were placed in the top twelve position. These students included several on Allen’s list.

“Out of the top 12 ranks, from our classroom programme, Tamoghna Ghosh secured 3rd AIR, Nipun Chandra secured 4th AIR, Harsh Aggarwal secured 5th AIR (classroom+distance), Abhishek Dogra secured 9th AIR,” an AESPL statement said.

AESPL also laid claim to the first and second toppers, Nishita Purohit and Archit Gupta, saying they were pursuing distance learning programmes. It said Harshit Anand (AIR 7), Rinku Sarmah (AIR 8) and Manish Mulchandani (AIR 10) were took distance cources.

At a press conference in Kota, Purohit, Gupta and Moolchandani (spelt Mulchandani by AESPL) said they were regular classroom students with Allen.

A relative who answered an HT call to Tamoghna Ghosh said he was a distance learning student of Allen and a regular with AESPL. Nipun Chandra’s family also said he was a regular with AESPL and had pursued two to three online tests with Allen.

Harshit Anand said he was a regular with Allen, as were Harsh Agarwal and Rishav Raj. Abhishek Dogra had done part of his coaching with Allen and part of it with AESPL.

The business of coaching in India is said to run into crores of rupees with lakhs of students seeking help to crack the competitive exams to secure a seat in one of the prestigious colleges, which in turn could land them a well-paying job. Experts, however, say the competition puts students under pressure, driving many to suicide."
Hasan Ali wants to ‘bomb’ Indian cricket team in Champions Trophy final,"Not Mohammad Amir, not Junaid Khan, Pakistan are looking up to rookie right-arm pacer Hasan Ali to finish India off in the ICC Champions Trophy final at The Oval on Sunday.

The 23-year-old has grabbed headlines with his wicket-taking ability and in conditions that have generally favoured batsmen, Hasan Ali has 10 scalps at an average of just 17.2, the best in ICC Champions Trophy 2017.

It is not Hasan Ali’s wicket-taking ability that is making headlines, but his celebration style has taken Pakistan fans by storm.

The spectacular celebration is a mix of Brett Lee’s clenched fist pitch punch that ends with those Shahid Afridi-like arms fully stretched in delight.

Hasan Ali explains his style resembles the ‘bursting of a bomb’ and he wants to do this “at least three-four-five times” against the fancied Indians, who are chasing their third Champions trophy title.

He picked three wickets each against South Africa, Sri Lanka and England (in the semis) and Hasan Ali is being seen as the man who can hit India hard.

“You can say that it is a dream, but I had set a goal after the West Indies series to become the top bowler while in England.

“I am close to my goal and will try to maintain my title of top wicket-taker till the end of final,” Hasan Ali said, adding that he was “not under pressure” against India in the Champions Trophy final.

Who is Hasan Ali?

Armed with medium pace, Hasan Ali started his first class career at the age of 19. His success at club cricket and the National T20 Cup won him a Pakistan cap in 2016. He made his ODI debut against Ireland in Dublin on August 18, 2016, and went wicketless in five overs.

Cardiff, where he broke England’s back in the Champions Trophy semis on Wednesday with figures of 3 for 35, is a happy hunting ground for the Peshawar Zalmi quickie. He took 4 for 60 in September 2016 to help Pakistan win by four wickets.

That Hasan Ali has big-match temperament is proven by the fact his two five-wicket hauls have come against Australia (5 for 52) in Sydney (Jan 22, 2017) and more recently against the Windies (5 for 38) in Providence (April 9, 2017.

He came into the Champions Trophy with 29 wickets and has been the tournament’s most striking pacer. Hasan Ali said tips from bowling coach Azhar Mahmood has worked wonders.

Earlier in the tournament, when India handed Paksitan a sound 124-run thrashing (June 4), Hasain Ali made little impact. He leaked 70 runs off his 10 overs and took Yuvraj Singh’s wicket.

If Pakistan are dreaming to change the course of history, Hasan Ali will have to disintegrate an Indian top order that has toyed with most bowling attacks in the tournament so far."
Virat Kohli-led India eye historic third ICC Champions Trophy title vs Pakistan,"The Taj Mahal: An expression of a tapestry that is India

Jun 18, 2017 09:36 IST"
ICC Champions Trophy: India gear up for mega semi-final against Bangladesh,"Jharkhand board JAC inter arts result 2017 at around 2.30pm on June 20: Know how to check

Jun 19, 2017 15:12 IST"
"Two India vs Pakistan matches, Kidambi Srikanth’s final: It’s a super Sunday!","Indian sports fans have to lot to look forward to on what promises to an action-filled Sunday, as three major sports events involving India are lined up throughout the day.

First up in action will be Kidambi Srikanth, who had knocked out world no. 1 Son Wan-Ho in the semi-finals of the Indonesia Super Series Premier on Saturday. He will face Japan’s Sakai Kazumasa in Sunday’s title clash.

The ICC Champions Trophy final between arch-rivals India and Pakistan will then commence shortly after, with the match set to be eagerly followed by millions of cricket fans across the Indian subcontinent.

However, it won’t be the only India vs Pakistan sporting encounter taking place in England.

The Indian men’s hockey team will be squaring off against their Pakistani counterparts in London in a Hockey World League (HWL) semi-final round match, with the Indian side having already qualified for the quarter-finals of the event.

Kidambi Srikanth and the two Indian teams will all go in as favourites to win the three big events, but it remains to be seen how successful a Sunday it turns out to be for India in sports.

Kidambi Srikanth vs Sakai Kazumasa: 2.10 pm IST on Star Sports 2 & HD2.

India vs Pakistan, ICC Champions Trophy: 3 pm IST on Star Sports 1, HD1, Hindi 1, Hindi HD1 & Tamil.

India vs Pakistan, Hockey World League: 6.30 pm IST on Star Sports 2 & HD2."
Oprah Winfrey on defeating Donald Trump in 2020: Will never run for public office,"Talk show queen Oprah Winfrey says she will never think about a presidential run.

“I will never run for public office. That’s a pretty definitive thing,” Winfrey said during the Awards Chatter podcast for Hollywood Reporter.

Oprah Winfrey speaks at Skidmore College's 106th Commencement, Saturday, May 20, 2017. (AP)

Asked whether she thought she could pull off a victory over President Donald Trump if he sought a second term, Winfrey said it didn’t matter.

“I don’t know. I don’t (have) the answer to that. But I will never have to know the answer to that, because I will never run for public office,” she said.

Follow @htshowbiz for more"
"India vs Pakistan: Sports has no boundaries, proves MS Dhoni, holding Sarfraz Ahmed’s son","The war of words had always been there, but the curses, trolls, and uncalled for verbal volleys on social media have made an India-Pakistan tie into a very ugly affair in the recent past and it isn’t much different in the build up to the ICC Champions Trophy final.

Not many treat an India vs Pakistan match as a game, it’s more like war where you can’t lose. While 22 players battle it out on the pitch, there’s hardly anything that helps calm the fans; both raring to go at each other at every instant.

However, when a picture surfaced of former India skipper MS Dhoni holding the baby of Pakistan skipper Sarfraz Ahmed in his arms on Saturday, the moment was more than an adorable one and it took social media by storm. It not only helped fanatics tone down their aggression but also ensured that a sport has no boundaries whatsoever.

Fans from both the nations took to social media to celebrate the moments with a user who goes by the handle @HumayounAK stating: “This picture captures the soul of Ind-Pak matches. Enemies on the field. BFFs off the field. Dhoni with Sarfaraz’s son, Abdullah.”

This picture captures the soul of Ind-Pak matches. Enemies on the field. BFFs off the field. Dhoni with Sarfaraz's son, Abdullah. pic.twitter.com/O6p3CPpIUn — Humayoun Khan (@HumayounAK) June 17, 2017

Indian cricket team will take on Pakistan cricket team at The Oval on Sunday, trying to lift the Champions Trophy for a third time and all eyes will be on veterans such as MS Dhoni and Yuvraj Singh, who could be taking part in the tournament for the final time.

Dhoni has been a vital cog in the batting line-up for the past few years but wasn’t required to bat against South Africa and Bangladesh. He, however, scored a fantastic 52-ball 63 against Sri Lanka; albeit for a losing cause.

A nice pic ahead of the Champions Trophy finals. @msdhoni with Sarfraz Ahmed baby: sports beyond boundaries!! #IndVsPak pic.twitter.com/8WNAlHzf4B — Rajdeep Sardesai (@sardesairajdeep) June 17, 2017

India are the favourites going into Sunday’s game but face a formidable opposition in Pakistan who, despite losing their first game to India by 124 runs made a strong comeback to reach the final despite being the lowest-ranked side to enter the tournament. And against India, they’ll ensure they give their best shot."
Stephen Constantine: India have one foot in 2019 Asian Cup finals,"Sunil Chhetri has been India’s highest goalscorer for a while. Somewhere in the process, he also has taken over the mantle of being the team’s elder statesman in a manner that his predecessor Bhaichung Bhutia would be pleased.

More proof of that came on Tuesday night soon after a moment of brilliance from him had sealed the deal for India against Kyrzgyz Republic in this 2019 Asian Cup qualifier at the Kanteraava stadium. One that India coach Stephen Constantine said had got them one foot into the finals. “We will need another six points I think,” he said.

The claps were still ringing in their ears when Chettri took the podium with Constantine. Both got an ovation from the media before taking the interaction. And through it all, Chhetri spoke about what a stellar team effort this was.

Was fortunate: Chhetri

“I was just fortunate. If Jeje doesn’t pass, I don’t score; if Udanta didn’t pass I wouldn’t have scored (against Myanmar). My father had said ‘if you want to make money, become a striker’ but really this is a whole team effort and I include the guys who work tirelessly behind the scenes to make us look good on the pitch,” said Chhetri.

It was a thought he repeated through the interaction. “In 12 years that I am with the national team, this was one of the best performances. We were battered by the gaffer at half-time. This was our home game and he tore into us using language I can’t repeat here for giving them so much respect. But what I am particularly proud of is how the team showed character. From the goalkeeper to those in front. And what a performance it was, man!,” said Chhetri.

‘Don’t tumble’

The skipper said his only thoughts as he ran with the ball for that 69th minute goal was “don’t fall, don’t tumble… Then, when I passed to Jeje, I told myself keep running. After the goal, the first thing I did was look at the clock and told the team we have to score another and defend well.”

Chhetri, who turns 33 in August, said he is fortunate that he gets asked to rate his goals people think are memorable. “These three points are massive and that’s what sets this goal apart even though it was just one part of what we did.”

Constantine thanked the medical staff for getting Chettri ready to make that “unbelievable run, as he did against Myanmar. And I am glad I didn’t play him against Nepal because then he may not have made this run.”

“As he touched the ball, I understood what this means to football in India. For us to be six points, top of the table… Let’s not make mistake as we did against Guam (in the World Cup qualifier in 2015) but let’s also enjoy this moment.”

Asked if thought India could have won by more, Constantine said: “Let’s not get greedy.” But when it was pointed out that India have now won eight successive matches, he said: “Now, I want nine.”"
Antoine Griezmann extends Atletico Madrid deal until 2022,"French star Antoine Griezmann has extended his contract with Atletico Madrid by a year, the Spanish club announced on Tuesday.

Griezmann’s contract now runs until June 30, 2022, and ends rumours linking him with a move away from Atletico.

READ | Iran celebrates as national football team earns 2018 World Cup spot

“The first thing that I want to do is apologise to the people who misunderstood my statements,” the 26-year-old said.

“Maybe I expressed myself badly or someone wanted to make news where there wasn’t any, but since I came, I have given my all for my club, my teammates and my coaching staff, and I’m very happy to live one more season with all of you.”

#Griezmann2022 🔴⚪🔴

🎙 @AntoGriezmann: ""After the holidays, I’ll return with my teammates and the coaching staff to prepare the season"" pic.twitter.com/OPTUiWbN7L — Atlético de Madrid (@atletienglish) June 13, 2017

Griezmann arrived in Atletico in 2014 for 30 million euros from Real Sociedad, where he started his career in 2009.

He has scored 83 goals in 160 games for Atletico, with whom he reached the Champions League final in 2016.

READ | Cristiano Ronaldo ‘father to twins with surrogate mother’

Atletico’s sporting director Jose Luis Perez Caminero dubbed the contract extension “great news because he is one of the best players in the world”.

“Antoine is a different football player, capable of changing a match, with spectacular qualities, a very complete player.”"
"Internet users in India to double to 829 million by 2021, says report","Internet users in India will double by 2021 to 829 million users from 373 million users in 2016, driven by digital transformation, according to a report.

This means roughly 59% of the Indian population will use the internet. Also, there would be two billion networked devices in 2021 up from 1.4 billion in 2016.

Overall IP traffic is expected to grow four-fold during the same period of five years at a compounded annual growth rate of 30%, the Cisco Visual Networking Index (VNI) Complete Forecast said.

“Combining device capabilities with faster, higher bandwidth and more intelligent networks is leading to wide doption of high bandwidth data, video and advanced multimedia applications that contribute to increased mobile and Wi-Fi traffic,” said Sanjay Kaul, managing director for service provider business at Cisco India SAARC.

“The need for optimised bandwidth management, network automation, end to end security and ultimately network monetisation through cost efficient data production is fuelling the growth of network automation, mass market 4G deployments and adoption, soon to be followed with 4.5G and 5G,” Kaul added.

The report further explained that mobile to mobile (M2M) connections will represent 22% of the total two billion devices and connections and will account for 5% of IP traffic by 2021.

Advancements in IoT applications such as smart meters, package tracking, digital health monitors and a host of other next-generation M2M services is driving this incremental growth.

Video will continue to dominate IP traffic and overall Internet traffic growth -- representing 76% of all Internet traffic in 2021, up from 57% in 2016, the report noted.

India will reach 84 billion Internet video minutes per month by 2021, which is 160,000 years of video per month, or about 32,000 video minutes every second, it explained."
SBI PO Mains Result 2017: Know where to check,"The State Bank of India (SBI) is likely to declare the results of main examination for the recruitment of probationary officers (PO) in the state-run bank on its official website on Monday, June 19. The examination was held on June 4.

Candidates can check their SBI PO Main exam results by clicking on the highlighted part in this line after they are declared. Go to the latest announcement section and click on the dot for recruitment of probationary officers.

Candidates who had clear the preliminary exam, the results for which were declared on May 18. were called for the online main examination held on June 4.

Group exercises and interview will be conducted for those who clear the main examination.

The group exercises and interview will be held July 10, 2017 onwards, and the results will be declared on August 5, 2017.

The recruitment notification for 2,313 probationary officers in the state-run bank was issued on February 6, 2017. The online registration process for the exam began on February 7 and continued until March 6, 2017.

Note: Candidates are advised to regularly keep in touch with the SBI website www.sbi.co.in/careers for details and latest updates."
What's it like to get trolled all day long? Take a look.,"What’s it like to get trolled all day long?

Being an outspoken woman on Twitter is hard. To find out how hard, we gathered a day’s worth of tweets sent to four prominent Indian women — Barkha Dutt, Rana Ayyub, Tavleen Singh, and Madhu Kishwar. We then filtered those tweets for profane or abusive words, categorized them, and sped them up by a thousand times. Now you, too, can experience the vitriol unleashed upon these women over the course of a day. Warning: The following contains coarse language and may not be suitable for children.

Barkha Dutt @BDUTT Barkha Rani Jamke Barasti Hai. Emmy Nominated Reporter. Author.Contributing Columnist @WashingtonPost Contributing Ed @TheWeekLive . Argumentative!Yaaron Ka Yaar : : Pause Count of categories (some tweets have more than one), per half hour

Twitter users who are unable or unwilling to engage with the content of Dutt’s reporting often resort, as a child might, to name calling. Dutt frequently endures sexist and racist slurs and violent threats. Trolls also accuse her of being a shill for political causes, typically left-wing ones. As you can see, some of the terms we’ve highlighted are not always used abusively. Sometimes they are even used supportively. Other terms are not abusive in and of themselves — Pakistani, for example, is just a nationality — but are used so frequently in abusive ways that we’ve included them here.

Rana Ayyub @RanaAyyub Journalist, writer, film buff. Rooted in Indian politics and social justice. Free, fair, fearless. Author of Gujarat Files-anatomy of a cover up. : : Pause Count of categories (some tweets have more than one), per half hour

For Ayyub, a Muslim, hateful tweets are often coloured by Islamophobia. Trolls like to pretend Ayyub is an agent of Pakistan’s Inter-Services Intelligence (ISI) and to demand she “return” to Pakistan. Any criticism of India or its government, however reasonable or constructive, may be deemed traitorous. The trolls are about as vicious to Ayyub as they are to Dutt — during the week beginning Monday, April 10 and ending Sunday, April 16, we tagged 2,582 abusive tweets mentioning Ayyub and 3,020 mentioning Dutt.

Tavleen Singh @tavleen_singh columnist, author : : Pause Count of categories (some tweets have more than one), per half hour

Trolls spare no one. Even Singh, who has been generally supportive of the Modi government and is perceived as being more “right-wing” than Dutt or Ayyub, has been accused of being a Pakistani propagandist and an anti-national. Yet even a cursory glance through her tweets reveals that the harassment directed at Singh pales in comparison to that received by her more “left-wing” counterparts. Singh received 195 tweets we tagged as being potentially abusive during the entire week that began Monday, April 10 and ended Sunday, April 16 — that’s fewer than Dutt or Ayyub received on any given day throughout the week. Moreover, the hateful tweets sent in reply to Singh are often directed at people other than Singh herself.

Madhu Kishwar @madhukishwar Factarian, Averse to all Isms. Maulana Azad National Professor, ICSSR. Founder human rights organisation MANUSHI : : Pause Count of categories (some tweets have more than one), per half hour

Like Singh, Kishwar has been generally supportive of the Modi government; and, like Singh, the hateful tweets she receives are generally directed at people other than her. Rather, trolls try to dissuade her from even engaging people with whom they disagree. Unlike the other women here, Kishwar occasionally resorts to ad hominem attacks herself, calling her opponents names like libtard and Aaptard.

A note on our methodology These tweets were collected on the evening of April 17, 2017, using Twitter’s free REST API. We collected as many tweet mentions as possible for all four women, and then selected the day with the highest minimum tagged tweets among the four. That day was April 14, when Dutt was mentioned in 520 tagged tweets, Ayyub was mentioned in 433, Kiswhar was mentioned in 117, and Singh was mentioned in 56 tagged tweets. We chose the terms used to tag the tweets by reading through hundreds of tweets and noting which words seemed to be most often used in abusive contexts. This is not an exhaustive list — some abusive tweets were missed, while other non-abusive ones were included."
