Title,Article
GST glitches only to be expected,"The GST Council has done well to revise rates on 19 services that include job work rate on textiles and also clear rules for e-way bill to remove border checkposts. Confusion over tax rates on goods was not unexpected, given that there are over 50,000 products that have come under the new levy. But ambiguity leads to classification disputes and provides the scope for buying favourable administrative discretion. That’s wholly avoidable. The remedy is to have a clutter-free GST. Goods and services have been classified as per the harmonised system of nomenclature, a globally standardised system of names and numbers.

This is welcome as identification of goods becomes easy through specific HSN codes, and also enables exporters to claim refunds on the tax paid on inputs used to make the final product. It would raise business efficiency if all products with the same four-digit HSN code were to have the same rate of GST.

Kota stone, for example, attracts the lowest 5% GST, compared to marble that attracts the highest rate. But kota stone makers want clarity on the classification to ensure that revenue authorities do not come calling on them. Recently, the government clarified that sarees, designer or embroidered, will be treated as fabric and not garment, and hence attract the lowest GST of 5%. Differential tax rates on the same kind of product should go.

The pricier products consumed by the well-off, will bear a higher tax burden, even if the rate of tax is the same as on a cheap alternative. A clean GST will ease administrative compliance. It would be useful to start an online forum for industry, especially small and medium enterprises, to raise their grievances, throw them open for public discussion, leading to resolution.

The rates for most products will go down now that excise duties and value-added tax have been subsumed in GST. Manufacturers and retailers must ensure that they stamp new prices on their pre-GST stock, instead of levying GST on top of the old maximum retail price. Surely, there is scope to converge GST rates once the tax base widens."
Existential Threat? Artificial intelligence won’t replace all human skills,"Today a great deal of debate is taking place regarding the fast pace at which Artificial Intelligence (AI) is developing and the merits and demerits of the same. People like Tesla founder Elon Musk have called for proactive rules governing the development of AI. Apart from dangerous, autonomous killer robots, there are fears that AI will displace human jobs by the billions. Already many skilled human tasks have been replaced by automated platforms. And the thing about AI is that once it is out there, the genie can’t be put back into the bottle.

So the question is not so much whether robots can replace human jobs, but should they replace human jobs. Recently, I had to do something about a broken furniture in my house. But instead of throwing the thing out, I decided to get it repaired. The carpenter who showed up was an affable fellow from Bihar. And he was quite skilled. He quickly got down to the job at hand while engaging us in pleasant conversation. And as he worked, I couldn’t help admire his craftsmanship. There’s something beautiful about human hands creating things.

This got me thinking – in a futuristic scenario, if a robot had repaired the furniture for me, I wouldn’t have had this pleasurable experience. This wasn’t just a carpenter at work; this was a man who was leaving behind a piece of his skill and knowledge, acquired through years of training, in my home. A robot or furniture made in an automated factory simply couldn’t replace this. I accept the reality that increasingly we will have more and more automated factories churning out mass-produced goods. This is something that cannot be changed. However, this doesn’t mean that human craftsmanship will end.

In fact, I believe products made by humans will be even more valuable in the future. They will have a higher premium and people will take more pride in them. Sure, AI could produce paintings akin to Picasso. But an original composition stemming from the human mind will still hold more value precisely because it is human. For, such a creation won’t stem from perfect AI data-crunching, but imperfect, unpredictable human inspiration. So yes, the development of AI will replace many human jobs. But it won’t end human creation and creativity – the latter might even get sharper. In that sense, human limitations, unpredictability and imperfections are humanity’s greatest assets as we step into an AI-driven world."
Vaghela’s exit an opportunity for Cong to take a stand in Gujarat,"Shankarsinh Vaghela has quit the Congress party. As a Gujarati, I thank whatever gods may be. There is a larger point to be made and I’ll come to that in a bit.

Vaghela was a dedicated Rashtriya Swayamsevak Sangh man who should never have been made head of the Gujarat Congress in the first instance. Hindutva has brutalised the state and permanently divided its people and ghettoised its minorities (an act of extreme anti-nationalism).

Congress should have stepped in to recover the truth in Gujarat’s culture of pacifism and mercantilism and pragmatism and progress. Instead, in appointing the Hindutvawadi Vaghela, the party continued the political lie that Hindus and Muslims are permanently at war and communal politics is inevitable. Rubbish.

There are those who say that with Vaghela’s exit the Congress will lose the assembly elections coming in that state in the next six months.

However, it should be pointed out to such geniuses that in his 20 years (he joined hands with the Congress in 1997) the party anyway saw defeat in every single assembly and Lok Sabha election. What great victories was this compromise with first principles bringing the Congress? Not one.

For my parents in Surat, all these years, the option inside the polling booth was always between endorsing an RSS Congress leader or an RSS BJP leader. That’s not really a choice.

If the Congress says it stands for Nehruvian secularism, then the first place that must show is in the people who speak for it and the second in what they say. The same rule applies to my friend Sanjay Nirupam, who heads the Congress in Mumbai. A pleasant fellow but a former Shiv Sainik. I believe in redemption and the idea of reformation, but such people as Vaghela and Nirupam, who jump from leadership position to leadership position without demonstrating their devotion to first principles are unfit.

To the larger point now. What will the 2019 general election be fought on? Given the damage Hindutva is doing to India and Indians, it is clear that it must be fought on an uncompromising anti-Hindutva platform. This should be accompanied by specific things, like the opposition to genius strokes like demonetisation. But the underlying narrative must be carried on the back of an Indian inclusivism that is natural to us and that we can see all around us.

The fact is that the image of India that Hindutva’s supporters hold is not apparent. We are a unified culture being deliberately and mischievously divided. How tough can it then be for the Congress to sell reality? My slogan: ‘Indians are one people. Stop dividing us through Hindutva’.

My colleague Salil Shetty has observed that we are living in a time of democratic authoritarianism, when the sort of mischief that only dictators pursued is today practised by elected despots.

His other observation is that among such ‘strongmen’ type leaders, there are those who use violent and unhinged language, like the Philippines president Rodrigo Duterte and American president Donald Trump. And then there are people like Narendra Modi who speak softly but who have others do the speaking for them.

VP Singh said that to know what Hindutva stood for, do not listen to its leaders, but the people below. The poison that is being spread by Hindutva cannot be gleaned from the Prime Minister’s Twitter feed.

It can be understood by what is being done under him. Gujarat has already passed a law punishing cattle slaughter with life imprisonment, while Chhattisgarh’s CM has pushed for the death penalty. Modi’s criticism of vigilantes should start with attacking or sacking his party’s leaders who encourage the lynchings. But he won’t and that is the plan.

I am told often that many Indians conflate Hindutva with Hinduism. That is dangerous nonsense. Hindutva, a word of recent coinage, is a set of three specific political demands.

First, Musims must surrender their mosque (‘Ram Janmabhoomi’). Second, Muslims must surrender their personal law (‘Uniform Civil Code’). Third, Muslims must surrender their constitutional autonomy in Jammu and Kashmir (‘Article 370’).

After taking power, a fourth political demand has been pushed: Muslims must surrender their dietary habits (‘cattle slaughter ban’). Hindutva is negative, sullen, passive-aggressive (observe the joyless faces of those who peddle it).

What links any of its demands with Hinduism the faith? Not a thing. It is anti-India in the worst way possible: it pushes an idiot nationalism that is ranged not at some enemy but against other Indians. Because of this, in my opinion, it borders on treason. It has to be resisted. Civil society will do what it can but the domain of this resistance is primarily politics.

The saying goes: if you don’t stand for something, you’ll fall for anything. For two decades the Congress has fallen for soft communalism in Gujarat. The opportunity has come for it to stand."
Hindi TV Serial and Episode News Online Times of India,"IANS | 7 Aug 2017, 10:18 hrs IST

Actress Soni Singh, who was seen alongside Upen Patel in popular reality show ""Bigg Boss 8"" in 2014, says she has since been in touch with the actor and he is always available to her as a brother whenever she ..."
This Hard-Hitting Poem On Equal Rights For Men Just Like Women Is Going Viral & Rightly So!,"On July 23rd, Simar Singh performed a piece on ""How To Be A Man"" at The Habitat, Khar.

Screengrab

We've been hearing a lot about how feminism is important and how oppression has taken over womanhood, but people, oppression is the only thing that's not gender neutral and it has hurt men and woman equally.

Screengrab

Just how women don't make good engineers, men don't make good chefs. Just how women can't pursue a career in basketball, men can't pursue a career in tailoring.

Screengrab

This guy's poem on manning up takes us on a touching ride of bygones, that is too close to reality. He forces us to reminisce about how our fathers, brothers, and sons have been asked to man up because some things are just not for them.

The poet has put down his emotions and years of struggle in this beautiful composition. Check it out.

We don't need feminism as much as we need equality. All of us should be an egalitarian, period.

Don't Miss 7.6 K SHARES 1.8 K SHARES 28.3 K SHARES 13.9 K SHARES 54 K SHARES 27.8 K SHARES 17.6 K SHARES 29.9 K SHARES 21.7 K SHARES 12.7 K SHARES"
"‘Khel Ratna a big honour but 12 years late … should have got this after Athens, what I did in Rio was nothing new’","Devendra Jhajharia, winner of two Paralympic gold medals (at Athens 2004 and Rio 2016) and holder of the world record in the men’s javelin throw F46 category, is the first para-athlete to be awarded India’s highest sporting honour: the Rajiv Gandhi Khel Ratna award. Jhajharia, who also won The Times of India Sports Award 2016, spoke to Jamie Alter about his career and what the award means for Indian para-athletes:

Last year you were on the panel to pick the Khel Ratna. Now you are a Khel Ratna. How does it feel?

I’m very happy. But to be honest, I feel I should have got this award in 2004-05 after I returned home from Athens with my first Paralympic gold medal, which was for a world record. This achievement stood in my absence from the Paralympic stage from 2004 to 2016 [the F46 category was not part of the Games in 2008 and 2012], so today I see it as a reward which has come 12 years late. Its a big honour, no doubt, and to be the first differently-abled athlete to be named for the Khel Ratna makes me feel very happy.

Do you feel you’ve received the respect and recognition that is due to an athlete of your stature?

Yes, I do. In 2004 no one knew me. I was a new entrant. I was young, naive. In 2016, however, people knew who I was. In Rio, at the athletes’ village, when I would enter for lunch and dinner, many world athletes who say ‘that is the Indian who is the world record holder”. That felt good. Also, I was the Indian team flag bearer, and PM Modi had spoken so kindly about us before we left the country. Kahin na kahin aap ke andar ek responsibility si jaag jaati hai, ki bas ab kuch aur karna hai desh ke liye. Holding the Indian flag in Rio was a different feeling altogether.

Has the perception of para-athletes changed post the rich haul of medals from Rio last year?

Yes, definitely. The government has recognised us in a very different way, we have been felicitated and honoured. We are recognised now. I would like to thank the media for covering us after the Rio Paralympics, but I urge you all to not stop after the Games. Look beyond that at the national level and state level, and cover what our para-athletes are doing at home and not just overseas.

What are your views on the state of para-athletics in India?

It has improved significantly, from where it was in 2004. A sea change, in fact. When I went to Athens it was very different to how we went to Rio last year. There was so much support for us, and Prime Minister Modi mentioned us on his ‘Mann Ki Baat’ programme. To hear him say that so much has changed in 12 years, but that Devendra has remained the same, that he has not changed or wavered in focus, was inspiring.

But a lot of work is needed, from the school level upwards. We need special training sessions and facilities. The infrastructure in India has to change. By change, I mean that the best para-athletes in the world should want to come here and train. We need former players to help promote para-athletics. We need more clinics, schemes and academies. We need to include a lot more youth. Work is on, I know it. The government has taken a much bigger interest.

There should be more special academies … javelin specific academies, for example. And kids need to be brought there and trained and given the freedom to express themselves. To win an Olympic medal you have to be special. And special talent needs special nurturing.

Can you elaborate on what needs to be done to improve the standard?

See, while the support from the government is obviously massive, I feel there needs to be more done at the state level. For example, we need more grounds for para-athletes. We face a lot of wheelchair problems at venues. Access is not always easy. There has been good work done so far, but more needs to happen to support para-athletes and make things simple. Most of this has to come from the state government, because they responsible for infrastructure. Start locally. Bring differently-abled people to the ground, make it easier for them to get there. Only then can their interest build.

Some states are better equipped than others and are doing well to support us. Haryana, Rajasthan and Delhi, mainly. There are special jobs created, cash awards given, schemes created for para-athletes. All that is good, but it is very important for para-athletes to come to Delhi. I cannot stress enough on how important that is. When I started out, getting to Delhi was tough. It should not be tough today.

Are you satisfied with the support of the government and the Sports Authority of India?

Yes. I have benefited hugely from the TOP (Target Olympic Podium) scheme. From this, I was able to travel overseas, I was given access to better training at home and abroad, I got a personal trainer, learned more about dietary planning. My entire planning for Rio was enhanced because of the TOP scheme. I am grateful to the government for that.

Is there a disproportion between funding which Olympians and Paralympians receive from the TOP scheme?

Not that I have seen. I have nothing to complain about.

Is there para-athletic talent coming through?

I think there is plenty of potential, if the youth is encouraged and supported. Look at Mariyappan Thangavelu, who created history by winning gold in the high jump in Rio. He is 22, a long-term prospect. There’s something different about him. There’s a fire burning inside him. He doesn’t know anything else about from his sport. We cannot lose a talent like that. I hope the system supports such athletes.

In those early years, primarily leading up to 2004, how did you raise funding? Who helped you?

Dekhiye, ek junoon sa tha khud mein. I had a goal. I wanted to chase excellence. But I was from a humble farming background. My father was a farmer, but in Rajasthan there are not many returns for a farmer. It was tough to gather funding. I got a little bit of state support, and the Paralympic Committee of India (PCI) helped too. Others helped out, but overall it was not easy. I used what little savings I had too. That time was very different, right from the media to the government. There was no social media either. Bilkul alag maahaul tha. How I got to Athens, and how I performed, only I know. It was extremely uplifting to win my first gold back then.

The category in which you won gold in 2004 (F46) was not part of the 2008 and 2012 Paralympics. Did that ever deter you from pursuing it?

Absolutely, yes. It was a very difficult time for me, from a sporting perspective. It is like preparing yourself for a big exam and then seeing that no one is ready to let you take that exam. To keep training so hard and then seeing that you’re not getting a chance to go to the Olympics left me considering whether it was worth pursuing sport. I did contemplate giving it all up. In 2010, preparations were on for the 2012 London Paralympics when it was announced which events were to be included. When I saw that my name was not there, because the F46 was not included for the second Games in a row, I was stunned.

This was the same time as when your wife Manju gave up playing kabaddi so you could pursue throwing the javelin?

Yes. I owe her everything. We sat down as a couple and talked it over. She told me she wanted to do everything she possibly could to keep my sporting career alive. “You chase your dream, you do well in sports, you make your name. My sport is not an Olympic one. You have so much ability,” she told me. I asked her what good my capability was when my event was not part of the Paralympics, after I had set a world record in Athens.

She told me forget about 2012, it will return in 2016. My response to her was that I cannot look that far ahead, and once again she told me to be positive and that’s when she told me that she would help me. She was a state level kabaddi player, and gave it up because only one of us could have pursue a career in sports. Along the way, we had a daughter too, so she had to raise her.

When I found out that my event was listed for the 2013 IPL Athletics World Championships, I immediately began training. My wife just said to not look back, only focus on getting ready for 2013. So I gave it my all and the result was a gold medal. When you consider all this, it was indeed a very long wait for Rio 2016.

And then, at 35, you broke the record you had set as a 23-year-old. Was that a prouder feeling?

Definitely. To do so at that age, and after that long absence from the international stage, was extremely satisfying. It was justification of all my hard work, of my wife’s sacrifice, of my coach’s conviction. I showed that nothing is impossible.

What was your training like for the Rio Paralympics? How do you stay so fit?

It all hard work and focus. I just immersed myself in training. Three hours at a stretch, sometimes four. I didn’t see what time it was, it was just about getting up and heading to the ground, giving my best. I had a strict schedule which my coach Sunil Tanwarji chalked out. No phones were allowed. Once, after the practice ground closed, I asked him what time it was. He said it was 8pm and that we should have go have dinner. I asked where, and he said in his hotel room, just as we were, with our kit bags, so that I didn’t waste time in the morning getting from where I was staying to the ground. Sabar ka phal meetha zaroor hota hai, magar uske liye bahut mehnat karni padti hai.

There is no official word yet on whether the F46 will be included at the 2020 Tokyo Games. You will be 39 then, but age is no bar for you, is it?

Not at all. Its all in the head. Its about fighting from your mind. Age didn’t get in my way when I was training for Rio, and having won a second gold medal at the age of 35, I am even more determined to win one at 39."
