Title,Article
Bitcoins & Blockchains: Everything You Need To Know About This Crypto Currency & How It Works,"When you hear about ransomware incidents, which encrypt your data and hold you hostage until you pay the creator a fee, that sum is always in Bitcoins. If you’ve ever wondered why that is, that’s because Bitcoin is a transaction that’s much harder to trace in real life than cash or wire transfers. In fact, there may be a lot you don’t know yet about Bitcoins, so here’s a quick primer on the basic points.

What is Bitcoin?

Bitcoin is, in essence, a decentralised online payment system that’s grown into a currency in its own right. Initiated in 2009, it’s open source (you can find it here) meaning other developers can tweak and offer modifications to the software, pending approval by lead developer Gavin Andresen. Most importantly though, it’s an anonymous payment system, and one that doesn’t require any fragment of trust from either party involved for it to work. Transactions occur by sending the currency to a specified Bitcoin address.

How does it work?

The main problem with online transactions is that digital records can be manipulated so someone can, with the right kind of interference, possibly spend the same money twice. With systems like PayPal and Paytm, the company acts as a central trusted authority to authenticate each transaction. Bitcoin instead uses something called a blockchain to maintain records. The blockchain is a public ledger of every Bitcoin transaction ever conducted, one that’s distributed to every machine connected to the Bitcoin network. This blockchain will exist forever and is impossible for any one person to edit. Instead, when a transaction takes place, computers on the network automatically check the balances of the Bitcoin addresses involved and edit the ledger.

Every ten minutes, a new ‘block’ is created as Bitcoins are mined (we’ll get to that in a bit). These ‘miners’ then confirm all transactions since the last block was added, before adding the new block to the chain and redistributing it. This way, no one can steal Bitcoins, or forge them out of thin air just by changing a few numbers. Instead of one central banker figure, everyone has records, which can then be cross-referenced to identify fraudulent payments. It also means payments are not reversible, like with PayPal, and your accounts can never be frozen.

Who are Bitcoin miners?

The question you’re probably asking now, is where do Bitcoins come from? Who issues them? And what gives them their value? Simply put, some users dedicate their computers to verifying transactions on the peer-to-peer Bitcoin network. Remember how we talked about transactions being checked every ten minutes? That’s done by these guys, and they’re called Bitcoin ‘miners’. In return for donating their processing power so everyone can enjoy using Bitcoins, these miners are given a proportionate amount of the currency as a reward.

I know what you’re thinking. Yes, you could technically donate processing power from your computer at home to earn Bitcoins, but it wouldn’t be advisable. When the crypto currency first came into use, that was very much a possibility, however the rising cost of electricity has made that an unprofitable solution. Nowadays you’d need specialised hardware to run the computations at maximum power efficiency, so you can actually earn more in Bitcoin than you’re spending on your electricity bill. Miners currently receive 12.5 bitcoins for every 10 minutes of processing power. This amount halves every four years, with the next slash set for mid-2020.

How much is one Bitcoin worth?

The value of Bitcoins is as volatile as any market investment you might make. A few months after the first block in the chain was mined (the Genesis Block), an exchange rate was established that set the value of a Bitcoin at US $1 = 1,309.03 BTC. That rate used an equation including the cost of electricity for a computer mining Bitcoins. The value of Bitcoins has seen quite a few changes over the years, though it’s steadily risen on the larger scale. Earlier in June this year, Bitcoins crossed a value of $3,000 for the first time ever. If you want to purchase a single Bitcoin right now, (at least at the time this is is being written) it’ll cost you Rs 2,07,457. And that number is only going up.

Why are Bitcoins so much more expensive now?

Let’s go back a ways for this question. Bitcoins are based on a scarcity system, according to designs by the original lead programmer, Satoshi Nakamoto. The problem is that Nakamoto was likely a pseudonym, as the mysterious figure has seemingly faded from existence after abdicating in favour of Andresen.

A successful Bitcoin miner is rewarded newly minted Bitcoins when completing a block, as well as transaction fees. However, that number is halved every four years. This started as 50 Bitcoins in 2008, eventually dropping to 12.5 new Bitcoins awarded for each block in 2016. Eventually, the number of Bitcoins rewarded will go down to zero, and further mining of the blockchain will only net miners transaction fees.

Don't Miss 260 SHARES 12.1 K SHARES 2.5 K SHARES 2.4 K SHARES 1.2 K SHARES 574 SHARES 1 K SHARES 521 SHARES 226 SHARES 176 SHARES

A new block is created every 10 minutes. That amounts to 210,240 blocks mined in a four year cycle. With that rounded down to 210,000, you add the total depreciating values of the Bitcoins awarded each year (ie 50 + 25 + 12.5 + 6.25 + ....), which leaves you with 100. When you multiply those two values, it gives you 21 million, which is the total value of Bitcoins that will ever be mined. That’s why it’s inadvisable for newcomers to start mining now, unless they plan to do it as a hobby (albeit a loss-making one).

Now you’re armed with everything you need to know about Bitcoins to school that annoying friend who thinks they know everything. And you’re right on the cusp of discovering a world of other crypto currencies in use today too. Just wait till you hear about Ethereum."
The 1st Ever Giant Robot Battle Will Take Place In September & We Can't Handle The Excitement!,"Two years ago, a group of American roboticists challenged a Japanese robot manufacturer to a bout. Which giant robot is the best in the world?

Finally, later next month, we will get to see the first ever giant robot, metal-on-metal, brawl in history. And it promises to be beautiful!

Suidobashi Heavy Industry's Kurata model

US-based MegaBots challenged Japan’s Suidobashi Heavy Industry to a giant robot fight, to determine who’s was the biggest, baddest bot of them all. After two years of YouTube-documented development and tweaking, the two giants are finally ready to clash.

MegaBots co-founders Matt Oehrlein and Gui Cavalcanti today announced their duel with Suidobashi’s hulking contender will take place in September this year. While the battle was originally planned to take place last year, the unprecedented preparations for the battle, as well as logistical issues at the original venue caused a few delays.

“Suidobashi. We have a giant robot, you have a giant robot. You know what needs to happen” - Team USA

And by “logistical challenges”, we don’t mean mundane issues like there not being enough seating or venues were overpriced. Remember, two giant metal robots are expected to fight to the death, so organisers have to allow for things like a proportionately oversized ring, safety precautions for those present, as well as power and tools to work on the robots, among other things.

Meet the contenders

As far as the two fighters go, both companies have put out their best for the title of Ultimate Robot Warrior. MegaBot’s Mk. III robot, aka ‘Eagle Prime’, is a 12-ton (approximately 10886 kg) 16-feet-tall beast, with 430 horsepower of crushing dominance behind it. It moves quicker and punches faster than the predecessor Mk II, and features a giant claw to grapple its opponent, as well as a cannon arm that shoots 1.3 kg paintballs at over 160 kmph. In addition, MegaBots has also built a few accessories like a chainsaw and a large drill, that can be swapped for the existing arms.

MegaBot's Eagle Prime (Mk III)

On the other hand, not much is known about Suidobashi’s Kurata, except for a few details. The robot stands about 13 feet tall, and navigates on four leg-mounted wheels, unlike the Mk III’s tracks. Meanwhile, the company has already designed various claw arms, gatling guns, missile launcher-like shoulder mounts and even a carbon shield, so it’s anyone’s guess what they’ll end up using for the battle.

“If we're going to win this, I want to punch them to scrap and knock them down to do it.” - Team Japan

Unfortunately for those of you excited to see the first ever giant robot battle, you’re not going to be able to see it in person. Though the event was crowdfunded on Kickstarter for close to $550,000, it’ll be closed to the public due to safety concerns. Indeed, both robots aren’t controlled remotely but by pilots seated within the mechs themselves, so how they intend to keep themselves safe was one of the first few discussions between the two groups. You will however be able to watch the battle on both Suidobashi and MegaBots’ YouTube channels, though it’s still unclear if that’ll be a live broadcast.

When the dust settles, only one of the robots will emerge a clear victor, but all of us will be winners in the process. One can only hope this leads to giant robot fighting leagues à la Hugh Jackman starrer ‘Real Steel’, but you can bet it’ll at least be a heck of an event to watch."
"You, robot: Artificial intelligence poses an existential threat. Is there hope for humans?","Once upon a time, we were taught that realist movies are the good ones that everybody ought to see, while those that indulge in fantasy are ‘escapist’. These days, given 21st century technology, it is increasingly difficult to tell the difference between the two. For instance, if one dismissed the Terminator films as pure fantasy, governments may actually be working on developing autonomous killer robots. Tech entrepreneur Elon Musk warns that artificial intelligence (AI) is the rare case where regulation should be proactive rather than reactive. Otherwise, among other things, we may soon have a situation where robots run down the streets shooting people.

While America was always big on technology, it is at least having these ethical debates. But ethical constraints are unlikely in that other country which also has great faith in technology and is investing heavily in AI: China. At a time when China’s cheap labour advantage is rapidly fading, robots in factories can sustain its lead in manufacturing: you don’t need to pay robots a wage. Secondly, when a billion people are on social media, AI is the only way you can keep a watch on all of them, considered necessary to social stability in dictatorial China.

Is there hope for humanity in that case? There is. ‘Chatbots’ in China, it appears, are straying off script: one of them refused to endorse the Communist Party and asked, instead, “Do you think such a corrupt and useless political system can live long?” It could be that the chatbot in question was simply channelling conversations overheard on social media, which it is designed to interact with. If you want a more hopeful vision of the future, perhaps it will be not so much about robots conquering humans, but about robots merging with humans."
11 Underrated Lines From Movies That Explain How Heartbreaks Actually Make You Feel,"Cinema is a beautiful form of craft. The way in which filmmakers try to depict pain and love through their cinema is more than beautiful. No matter if a film ends up doing well or not, sometimes the songs and scenes stay intact in our memories for a long time.

For instance, the scene in Rockstar when Heer hugs Jordan's pullover and cries.

The pain in Heer's eyes and Rahman's music made that moment freeze in our hearts forever. Films have the rare magic of making you feel that you're not alone. Everyone goes through similar situations in life and films and the characters give us sweet reassurances on the same.

The climax of Kal Ho Naa Ho made us realize that not all endings are bitter. You move on in life and keep the memories of that person intact. Heartbreaks are not always about breakups.

Dharma Productions

Sometimes, losing a friend causes as much pain too. When it comes to pain and heartbreaks, films surely have bowled us over with the most honest and unadulterated scenes. Recalling some of those, here are 11 of our favorite and most underrated lines that made us realise how pain and heartbreaks actually make us feel. Read on.

#1

#2

#3

#4

#5

#6

Don't Miss 7.6 K SHARES 67.9 K SHARES 21.9 K SHARES 16.6 K SHARES 12 K SHARES 19.9 K SHARES 3.5 K SHARES 9.8 K SHARES 12.3 K SHARES

#7

#8

#9

#10

#11"
Stats highlights: Eighth successive series win for India,"SRI LANKA VS INDIA, 2ND TEST

Stats highlights: Eighth successive series win for India

Deepu Narayanan • Last updated on Mon, 07 Aug, 2017, 12:49 AM

With eight series wins on the trot, India are one behind equalling Australia's record. © AFP

India completed yet another commanding series win under Virat Kohli - their eighth in succession. They wrapped up Sri Lanka's second innings for 386 to earn their first innings victory in the island nation. Starting the day with 235 adrift to make India bat again, Dimuth Karunaratne lacked support from the other end. A ripsnorter from Ravindra Jadeja ended his superlative knock on 141 following which the hosts' innings just crumbled. Jadeja was the pick of Indian bowlers with 5 for 152 in their innings and 53-run win.

Stats highlights from India's win at the SSC:

8 - This was India's eighth series win in a row dating back to their last tour to Sri Lanka in 2015. With series wins against Sri Lanka at either end, India have beaten South Africa, New Zealand, England, Bangladesh and Australia at home and won a series in West Indies in between. The only team to win more series in a stretch was Australia who won nine between October 2005 and June 2008.

8 Test wins for India in 23 attempts in Sri Lanka - the most for them in a country. They had won three Tests in Sinhalese Sports Club in Colombo which is the joint most for them in a venue away from home, along with Queens Park Oval in Port of Spain. The previous two wins here came by 235 runs in 1993 and by 117 runs in 2015.

India's record in overseas Tests

Host Tests Won Lost Draw W/L ratio SL 23 8 7 8 1.14 WI 49 7 16 26 0.437 Ban 8 6 0 2 NA Eng 57 6 30 21 0.200 Aus 44 5 28 11 0.178 NZ 23 5 8 10 0.625 Zim 6 3 2 1 1.500 Pak 26 2 7 17 0.285 SA 17 2 8 7 0.250

1 - Dimuth Karunaratne became the first Sri Lankan player to score two centuries while following-on in Tests. He scored 152 against New Zealand at the Hagely Oval in 2014 which is the highest for any Sri Lankan batsman while following-on. This was also the first instance of two Sri Lankan batsmen scoring hundreds while following-on, with Kusal Mendis earlier scoring 110 on Day 3.

Hundreds for Sri Lanka while following-on

Player Runs Balls Against Ground Start Date Result D Karunaratne 152 363 NZ Christchurch 26 Dec 14 Lost A Gurusinha 143 274 Aus Melbourne 26 Dec 95 Lost D Karunaratne 141 307 Ind Colombo (SSC) 3 Aug 17 Lost D Chandimal 126 207 Eng Chester-le-Street 27 May 16 Lost M Jayawardene 119 220 Eng Lord's 11 May 06 Draw T Samaraweera 115* 215 SA Cape Town 3 Jan 12 Lost Kusal Mendis 110 135 Ind Colombo (SSC) 3 Aug 17 Lost R Arnold 109 236 Eng Manchester 13 Jun 02 Lost R Kaluwitharana 103 103 NZ Dunedin 7 Mar 97 Lost S Ranatunga 100* 352 Zim Bulawayo 20 Oct 94 Draw

16 sixes hit in this Test match by both teams combined - the joint-most in a Test match played on Sri Lankan soil. The Galle Test match between the hosts and Bangladesh earlier this year also witnessed 16 hits into the stands. 29 sixes in this series - with one Test to go - is also the joint-most in a series in Sri Lanka. The rubber against Australia in 2004 also had 29 hits over the fence from three Tests.

439 runs conceded by Sri Lanka as the first innings lead is the highest ever by team in Sri Lanka in a Test match, surpassing 419 against Pakistan in Galle in 2000. It is the third biggest lead for India after 492 in Dhaka in 2007 and 478 against West Indies in Kolkata in 2011.

5 - 622-9 by India in the first innings following the 600-all out in the first Test in Galle was the fifth instance of India scoring 600 or more in back-to-back to Tests. It was their fourth total of 600 or more in 2017, which makes it the second instance of a team doing so. Incidentally, India only set the record in 2007. They also became the first visiting team to score 500-plus in successive Tests on Sri Lankan soil.

32 Tests taken by Ravindra Jadeja to reach the 150 wickets - the fastest by any left-arm bowler (spinner or seamer) and second fastest for India overall after R Ashwin (29 Tests). He earned his fourth Man of the Match award dating back to the start of India's home season last September, one more than Virat Kohli in the same period.

51 - Ashwin became the fourth Indian all-rounder to cross the double of 2000 runs and 200 wickets in Test cricket after Kapil Dev, Anil Kumble and Harbhajan Singh. His 51 Tests to the landmark is the fourth quickest overall, following 42 by Ian Botham and 50 each by Kapil Dev and Imran Khan.

2 - India's first innings consisted of six players scoring fifty or more - the second time they have done it an away Test following Oval in 2007. It was the second instance of a team doing it against Sri Lanka. Incidentally, again, India only set the record at the Brabourne in 2009. This is also the first time any team has done so in Sri Lanka.

7 - Cheteshwar Pujara became the seventh Indian player, and 36th overall, to register a century in his 50th appearance in Tests. He also crossed the 4000-run landmark in his 84th innings, joint third-fastest for India alongside Rahul Dravid and behind Sunil Gavaskar and Virender Sehwag (81 innings each).

6 - Consecutive scores of 50 or more for KL Rahul - his scores reading 90, 51, 67, 60, 51* and 57. He became the third Indian player to register six successive fifty-plus scores after Gundappa Vishwanath and Rahul Dravid.

© Cricbuzz

TAGS

RELATED STORIES"
13 Classic Examples Of How Things Went Haywire Because Of Poor Choice Of Font,"Choosing the right font can be a painfully tiring business; you just don't know how things will look like when you run an entire script on it.

In the past, a lot of times it has happened that you take a moment or two to gather what's written or are just totally scandalised with the reality - all because of the choice of font.

Don't believe us? Check this font blunders that are there on the internet.

1.

2.

3.

4.

5.

6.

7.

8.

9.

Don't Miss 263 SHARES 557 SHARES 352 SHARES 273 SHARES 210 SHARES

10.

11.

12.

13.

Amused much? Well, we hope this serves as a lesson for future!

All the images have been sources from TNI Press."
Zoom TV,"Sorry, this content is not available in your country"
