Title,Article
Healthcare: Public-private partnership-the missing Qs,"It is not an uncommon mistake, to mistake public-private partnership (3Ps) as halfway down the street in healthcare. It is but a common phenomenon for financing for setting up the infrastructure (resource power, plus manpower) to start the job. The bane today is of the haunt of the Qs–Are the directions and services, in which these projects laudably started, changed course due to lack of scrutiny, regulation, or an inability of the two parties to facilitate each other to remove the roadblocks that came in the way? The second “Q” is, are the consumers (patients) happy with the outcomes, both in terms of the payments and medical reprieve?

I would not label patients’ responses as “subjective”, more so after having heard so many praises for my colleagues, and the hospitals for having given their kin a second chance to live, as the common phrase of appreciation goes in India.

That brings the third “Q”, which is, whereas public-private partnership is never the question in any other industry, what processes is lacking that when it comes to evaluation and rating on a 1-10 scale, it appears unjust to exceed the figure of 5, as the highest performance.

No harm keeping high standards for human health!

The aspects of healthcare are many, right from childbirth, maternity care, nutrition, prevention from epidemic and endemic diseases. I presume various government departments, NGOs deal with them, and may have their own paradigms in correction and upscaling.

I would take up India’s valued “corporate hospitals” that indeed are the last stop for the poor as well as the rich, when it comes to cardiac interventions, neuro-surgical, kidney failures, interventions, organ transplant, and where the patients send posts to pillars for an undiagnosed ailment.

Some of these set-ups are also listed on the stock-exchange, and that brings answerability to the investors, and corporate practices (at least in terms of financial regulations), that need to be enforced to ensure more value for money spent. That goes in the favour of the hospital, patient, as well as the partners.

One may have certain deviations, or omissions in the strict corporate rules due to the universal imponderables in healthcare, but there is always a method to serve well and professionally, and yet keep the bottom lines higher than the hemlines to prevent a vulgar see for all.

One has to give concessions, that these enterprises were earlier to start, adopted corporate components, but, perhaps in the melee of politico-economic changes, were hesitant of taking the best foot forward, to work at containing bills through better processes, enforcing optimum professionalism in their specialists, and changing rules such that they may continue to grow in goodwill as in profitability, to keep ahead in the financial race.

Unfortunately, we have a group of such 3P setups, that more or less run on the same procedural cycles, complication as well as success rates, but no one came with a formula that would catch an expanse of 1.2 bn, with every possible disease, and raise the bar, by increasing internal patient flow. Huge turnovers bring costs down. Charity begins at home, but need not necessarily continue to prosper on the same paradigm.

It may sound jarring, but the spirit of “entrepreneurship and healthcare” are actually subordinate. The leaks and losses (finally to be recovered from the patient or the third party) actually occur down the line of say, middle management, where targets are to be met, but due diligence is lacking. A ripe apple rots between the time it leaves the stem and drops in one’s lap!

It is an unworthy rumour, and unworthy and rumour-us it ought to be, when one picks up conversations, that doctors are given “targets” to raise so much either as procedure or investigations to retain jobs, or to bag extra incentives. A rumour has its place, though it be a rumour, but transparent ethical actions need to be highlighted to keep people’s confidence up.

Hospitals can cut down on bills, by quick evaluations, relevant but instant investigations, elite professionals ascertaining a diagnosis without unnecessary referrals, and check out a healthy patient. Prolonged stays, waiting time for multiple referrals, which may be tackled in the outdoors, shortens stays. The fact is that sizeable margins are realized in the first few days, through whatever be the margins in emergency medicines, investigations, and relevant consults to diagnose and discharge a patient. The cost of services for a hygienic bed, nursing on the dot to dispense medicine as per each patient’s timing, room services, are what bleed hospital capital. Cutting down in-hospital time through scientifically co-ordinated medical management, can save hospital expenditures, and these expenses are absolutely ethical. Rapid turnover through professionalism is the key.

It’s a farce, but an absolute truth, that “complications” bloat up the bills. Besides, what may be preventable as procedural lapses, hospital acquired infections can lead to sub-optimal results, and has quite significant impact on expenses, that are of no good to the patient, and makes third party payers a bit unrelenting for a cashless policy.

The 3P model is an acceptable, at times irreplaceable financial model. Corporate hospitals with better regulatory policies shall see them in profits, which is necessary to keep up-grading their infrastructure, as well take care of their personnel. If through recognized management techniques, the hospital turnover and also the market prices rise, it shall attract more private money to the health sector.

Hospitals have started packages, for defined procedures. Un-imaginatively these are a summation of the total costs for stay. Any further stay on account of slow recovery, may add up few more lacs. Hospitals can, based on their success rate, charge an amount for stat insurance that may cover an extra five- day stay. If the success rate is as claimed, there would be a reason for a quick non- complicated rehabilitation, less financial uncertainty to the patient, and in- house insurance earnings to the hospital!

There is a case to accommodate more profits from the in-house dispensing, investigating departments in the balance sheets. Even if hospital stocks are a percent more in returns than fixed deposits, tax-free bonds shall see billions flow into healthcare!

Just to remind you, robotic surgery (to begin with prosthetic) in the US was started by a single department of urology (Sanjay Gandhi PGI), and half the robotic urologists there are Indians!

The moral: the 3Ps need to be mutually answerable to the 3Qs!

Rakhi signifies protection. India can start promoting it as “Patient’s Day”!

“Of all forms of inequality, injustice in health care is the most shocking and inhuman”

— Martin Luther King"
PC And Her Little Neice Wore 'Kaala Chashmas' Proving Their Swag Is On Fleek. Always!,"Priyanka Chopra’s instagram account is a treat for her fans, for sure. The actress keeps giving her fans insights into her life, and how she is leading it. Now that she is New York, that is one of the ways how she keep in touch.

AFP

And almost every other day, she keeps updating about her day to day life. Just recently, she posted about how she is spending her weekend relaxing with her pet and babies.

PTI

And now again, she posted an adorable picture with her niece wearing sunglasses flaunting their Kaala Chashma swag.

Lol masi ki beti.. @shireen_shiva_rose 😍 @sunshinemathur beaming! ❤️❤️❤️ A post shared by Priyanka Chopra (@priyankachopra) on Aug 6, 2017 at 3:13pm PDT

Don’t they look adorable together!

On the work front, she is shooting for her next film and also Quantico. Furthermore, she is also producing a comedy series based on the life of Madhuri Dixit in the US. PC, we love it how you manage to strike a balance between you work and professional life.

Don't Miss 2.8 K SHARES 160 SHARES 67.9 K SHARES 21.8 K SHARES 16.6 K SHARES 24.3 K SHARES 12 K SHARES 19.9 K SHARES 3.5 K SHARES 9.8 K SHARES"
Those who sow Hindu terror will reap Muslim terror,"Prime Minister Modi and his partymen wax eloquent about the need to tackle and end terrorism. But what exactly is terrorism? The dictionary definition is “the unlawful use of violence and intimidation, especially against civilians, in the pursuit of political aims”.

Going by this definition, the lynch mobs that beat up and kill people suspected of carrying beef are terrorists. So too are Muslim lynch mobs killing policemen in Kashmir. All these lynch mobs are unlawful, use violence against civilians, and have religio-political goals. They fit the definition of “terrorist” like a glove.

Many in the BJP will not agree: they would like to say that Hindu sentiments have been hurt and anti-beef violence is an understandable though not entirely warranted reaction. The Hurriyat in Kashmir will also shed crocodile tears for the killed policemen but say the mob violence must be seen in the context of Indian military repression. Such excuses are as hollow and cruel as those given by al-Qaida or ISIS for their misdeeds.

The murder of 15-year-old Junaid Khan, for the crime of simply being a Muslim, has been condemned — after a typical long pause that will not discourage mobs — by Modi. Many of his ministers have also issued condemnations. Yet the lynch mobs have not appeared out of a vacuum: they have grown in a socio-political climate created by three years of BJP rule.

A deadly mix of communalism and ultra-nationalism has stirred communal passions despite an absence of major riots. One more Muslim was killed by gau rakshaks in Jharkhand after Modi’s call for peace, showing how difficult it is to put the genie back into the bottle.

My fear is that, unless checked quickly, Hindu terror will be met with Muslim terror, and the country will go up in flames. If the state cannot protect Muslims, there is a high risk that they will devise their own armed squads for protection. Hindu-Muslim terror can escalate with the state a helpless spectator.

Modi wants to sell India to the world as a global manufacturing hub. That will not be possible if India’s fastest growing industry is lynch mobs. Economist Dani Rodrik has shown that the ability to manage internal conflicts is an important determinant of economic growth and prosperity. Since Independence, despite a thousand flaws, India has succeeded in managing its internal conflicts reasonably well, and reaped the corresponding social and economic dividends. That achievement is now in jeopardy.

Fifteen years ago, President Bush of the US congratulated India on having 150 million Muslims but no terrorists. That plaudit was an exaggeration, yet it was not unearned. Given the strident rise of militant Islam across the world since 2001, the moderation of India’s Muslims stood out. That moderation owed a lot to strenuous political efforts to check majoritarian violence and persuade minorities that India was their land too. Alas, the rise of lynch mobs could signal the coming end of that phase.

Across the West, small Muslim terrorist groups (mostly homegrown) are wreaking havoc. They do not need financing or encouragement from ISIS or other foreign agencies: the expertise and knowledge for making bombs are on the internet. Militancy is not typical of Islam: the vast majority of Muslims in the West, as in India, are law-abiding citizens who condemn terrorism. Nevertheless, militants have become a menace in countries with just a few million Muslims.

India now has a Muslim population of 180 million. Even if 0.01% of these Muslims turn militant, that will guarantee havoc. And if 0.01% of Hindus interpret the violence of 0.01% of Muslims as a reason to bash all Muslims, communal terror can ratchet up. Even if 99.99% of both communities are against hate crimes, that will not save the situation, unless the sternest action is taken to halt vigilante groups.

Dawood Ibrahim’s bomb blasts in Mumbai did not occur in a vacuum.

They were a reaction to the anti-Muslim riots that followed the destruction of the Babri Masjid in 1992 and the Shiv Sena’s maha-aarti riots of January 1993. Thirteen bomb blasts hit prominent locations including the Shiv Sena’s headquarters. Fortunately, violence did not ratchet up further, and communal tempers gradually eased.

If Hindu-Muslim terror escalates today, it will not easily be doused. I fear that those who sow Hindu violence will reap Muslim violence and vice versa, in a vicious spiral."
Baba Ramdev Wanted Patanjali Employees To Work For 'Free' Claims Former CEO,"Yoga Guru Baba Ramdev's Patanjali is one of the biggest brands in India now and has shown signs of growing even bigger.

BCCL/ File

But it appears that the benefits of the sales worth Rs 10,561 crore in the last financial year is not reaching the people who made it possible.

According to former CEO of Patanjali, SK Patra, the company believes its employees are doing a 'seva' (voluntary service) and can work without being paid.

""Patanjali pay very little to the people who work for them. Babaji (Baba Ramdev) calls it ‘seva’. For instance, I was doing two jobs there — at Patanjali Ayurved and Patanjali Food Park. They had promised to pay for both. But he would announce to everyone that 'Patraji has come to do seva. Right now he is drawing salary, but soon, he won’t even take that…"" Patra told Mint.

Reuters/ File

Patra, an IT and IIM alumnus said he did not want to do 'seva' as Ramdev claimed and demanded money for the work he was doing.

""I used to respond, “No, I want my money.”... I said I don’t need it for myself. I have a family. I need money for my family, to support them and my relatives. Then Babaji relented and gave me a salary for one of the two jobs that I was performing. But basically his argument was — I have to offer free seva to his host of companies.""

Patra said he left the company due to the differences in their words and actions.

""I was also seeing the distance between their words and their actions and it troubled me. Eventually, it became too much. So I left.""

Don't Miss 2.9 K SHARES 275 SHARES 28.2 K SHARES 13.9 K SHARES 53.7 K SHARES 17.4 K SHARES 29.8 K SHARES 21.6 K SHARES 12.7 K SHARES 18.6 K SHARES"
"Death registration: forget Aadhaar, improve the data collection","The government’s decision to make Aadhaar a requirement for death registration was met with incredulity and derision. Initial reports suggested that this was mandatory but the government quickly scotched this speculation. However, social media went ahead with new Aadhaar memes mocking the government and private sector’s growing propensity to enforce Aadhaar in every field of human activity. But lost in this chorus was another critical aspect of death registration.

What does death registration tell us? Though death registration is mandatory, and the cause of death must be accurately specified, lax regard is being paid to the latter aspect. Death registration has been compulsory since 1969. But it is only after the Millennium Development Goals emphasised the importance of birth and death registration in monitoring the effectiveness and impact of health and development interventions that developing countries focussed on this aspect. In 2014, death registration had improved to 74.3 per cent from 70.9 per cent in 2013. In other words, three out of four deaths were being registered. The Chief Registrar is forced to estimate the number of deaths to arrive at the registration rate.

But here is the nub. The two states which possibly account for the most number of deaths — Uttar Pradesh and Bihar — reported only death registration rates of 46.1% and 24.1% respectively. If the official numbers can be believed most other states are doing well in terms of numbers. But the other challenge is to ascertain the cause of death. It is estimated that over 75 per cent of deaths occurs at home and the cause of death remains unknown. Without this data, it becomes difficult for government, economists and policy makers to understand disease incidence, mortality and other health indicators.

However, in contrast to the Census Office claims that India has achieved almost 75% death registration, a recent WHO report World Health Statistics 2017 claims that India registers only 10% of deaths and the quality of data from death registration is “very poor”. There is a rider that this data could be from a period prior to 2010. If this is global perception about death registration, it needs to be corrected by the government urgently. If it is reflective of the situation on the ground — authorities recently had a tough time collective deaths caused by dengue from registration data — all the effort put into registration is ending up merely as a bookkeeping effort. Recently, there were even deaths attributed to small pox and polio in Delhi creating a minor scare. There are also allegations that people desiring to register births and deaths have to deal with corruption.

The Registration of Births and Deaths Act 1969 envisages penalties on registrars who fail to report registrations to higher authorities in a timely manner. Recently Haryana, Bihar, Jarkhand, and Goa failed to provide data to the union ministry of home affairs (MHA) about registration of birth and deaths while UP provided a part of the data. Haryana blamed it on “lack of computerization and governance issues”. The inaction of these states raise questions about the completeness and integrity of the birth and death data and justify the low score granted by the WHO to India.

These are weighty issues that must be dealt with. The government is spending considerable money in registering births and deaths and employing personnel to record the data. The joke is on those lampooning Aadhaar as a mandatory passport to death. There are much greater failings that they must hold the government accountable for."
English TV Serial and Episode News Online Times of India,"TNN | 6 Aug 2017, 12:14 hrs IST

Every friend has a unique quality which makes them so special for us. This Friendship Day we dedicate these special characters of the famous TV shows to our friends, who are somewhat similar."
Make what you share together worthy,"I was standing by the conveyor belt when i saw an elderly Indian couple walking out together. She was dressed in a traditional sari and he in a high waisted pant and shirt. Both had grey hair and must have been in their 70’s. What made this moment stand out was the way he had affectionately put his arm around her shoulders and the way this traditional middle-class couple were Smiling, chatting and holding each other while slowly walking out of the airport. I’ve seen a lot of public displays of affection abroad… but to see it happen in India, especially with elderly folks, is a rare sight. Often, I am asked what I miss the most being a single woman. A moment like this sums it up so beautifully. Growing old with someone who cares and shows it… being a couple who are interested in each other, aren’t hesitant to be affectionate with each other and are lovingly there for each other.

There’s no point in having or choosing a life partner just for the sake of it either because you’re scared to be alone, or because u need financial or emotional security. So many couples just exist together as a formality. I feel there is nothing lonelier than being married and feeling alone. It’s saddening when couples grow apart rather than work at creating strong bonds to keep their relationship vibrant and fulfilling. If you’re single… remind yourself that its worth waiting for a worthy life partner. We should all want the arms of our life partners around us… . and also be the ones embracing our loved ones. Especially when we are old and bent and grey. Let’s remind ourselves every day that it is worth working towards keeping each other feeling worthy and loved. Wish u all many of those airport moments.

My husband recently told me that he would want to separate from me because he has been involved with a colleague of his for the past few months. We have been married for a year. When I asked him for a divorce, he said he wouldn’t want to go down that lane and would prefer to just live apart. I really don’t know what to do and cannot understand this behaviour of his. Please help.

Classic case of wanting the best of both worlds. I suggest you record your conversations and then use the evidence get your divorce. Make it known to him that adultery is an offence that could land him in serious trouble and that you’re not in the mood to be negotiated with or bullied into a lifetime of compromise.

My wife is extremely hard-working, ambitious types and I end up doing most of the work at home. We don’t have kids as yet but I try to keep the home in order so that she can dedicate all her time to work. We have a perfect balance in that sense but these days I have noticed that she seems to be taking undue advantage of all this and has been staying out of home unnecessarily. She goes out with her colleagues on week days and spends time with her friends on weekends and I get to know of her plans only later. I have tried to talk to her gently once or twice but she has always brushed away the topic. How do I ask her what is on her mind and since I sincerely miss her how do I tell her what I am going through?

They say the work done at home is never appreciated until it’s not done. So just stop doing all the housework. If she complains bring up your list of grievances, and say both have a right and need to be heard. Explain that in a marriage you can either grow together or grow apart. It’s really that simple. So which direction would she like it to go in?

I am a 22-year-old woman and in love with a guy who is two years younger to me. When we started dating, he did not have any problems with the difference in age but he now says that his parents will not agree to this relationship of ours. I have tried speaking to him but he is not willing to hear me out. What should I do?

It seems the relationship is “numbered”. Pun intended!!! It’s a blessing in disguise. Do you really want a man who cannot even stand up for such a trivial issue?"
Sushant’s Father Is Proud Of His Success But Wants Him To Complete His Graduation First,"Nobody better than aspiring actors understand how big a challenge it is to convince their family when they want to pursue a career in film, television, music or theatre. And considering the industry has been boasting of nepotism, it definitely scares off a lot of people.

But there are several actors who made it through with their sheer talent and are at par with those who already belong to the industry. One such actor is Sushant Singh Rajput, who is giving brilliant performances on the big screen one after the other.

PTI

But were his parents reluctant when he opened up to them about his career choice? The actor says they still ask him to complete his graduation at the least.

PTI

For the uninitiated, Sushant Singh Rajput, who ventured into the world of films with Kai Po Che, dropped out of an engineering college. The actor was a bright student. So much so that he secured 7th rank in All India Engineering Entrance Exam and got admission in Delhi Technological University, but dropped out after three years.

He started out as a background dancer and eventually became a hero in the world of films. His parents were shocked when he dropped the bomb and told them about the choice he has made. Not that they are not proud of him now, but he says, even today all conversations revolve around his graduation at the end.

PTI

“My dad loves it when, on his walks, people call out to him, show him some recent clipping on me…he is really proud of me. But even today, almost all our conversations end with “beta, degree le leta…” Pinkvilla quoted him as saying.

And that’s how all parents are, aren’t they!

Don't Miss 574 SHARES 12.7 K SHARES 67.9 K SHARES 21.9 K SHARES 24.3 K SHARES 12 K SHARES 19.9 K SHARES 3.5 K SHARES 9.8 K SHARES 12.3 K SHARES"
