Title,Article
"Death registration: forget Aadhaar, improve the data collection","The government’s decision to make Aadhaar a requirement for death registration was met with incredulity and derision. Initial reports suggested that this was mandatory but the government quickly scotched this speculation. However, social media went ahead with new Aadhaar memes mocking the government and private sector’s growing propensity to enforce Aadhaar in every field of human activity. But lost in this chorus was another critical aspect of death registration.

What does death registration tell us? Though death registration is mandatory, and the cause of death must be accurately specified, lax regard is being paid to the latter aspect. Death registration has been compulsory since 1969. But it is only after the Millennium Development Goals emphasised the importance of birth and death registration in monitoring the effectiveness and impact of health and development interventions that developing countries focussed on this aspect. In 2014, death registration had improved to 74.3 per cent from 70.9 per cent in 2013. In other words, three out of four deaths were being registered. The Chief Registrar is forced to estimate the number of deaths to arrive at the registration rate.

But here is the nub. The two states which possibly account for the most number of deaths — Uttar Pradesh and Bihar — reported only death registration rates of 46.1% and 24.1% respectively. If the official numbers can be believed most other states are doing well in terms of numbers. But the other challenge is to ascertain the cause of death. It is estimated that over 75 per cent of deaths occurs at home and the cause of death remains unknown. Without this data, it becomes difficult for government, economists and policy makers to understand disease incidence, mortality and other health indicators.

However, in contrast to the Census Office claims that India has achieved almost 75% death registration, a recent WHO report World Health Statistics 2017 claims that India registers only 10% of deaths and the quality of data from death registration is “very poor”. There is a rider that this data could be from a period prior to 2010. If this is global perception about death registration, it needs to be corrected by the government urgently. If it is reflective of the situation on the ground — authorities recently had a tough time collective deaths caused by dengue from registration data — all the effort put into registration is ending up merely as a bookkeeping effort. Recently, there were even deaths attributed to small pox and polio in Delhi creating a minor scare. There are also allegations that people desiring to register births and deaths have to deal with corruption.

The Registration of Births and Deaths Act 1969 envisages penalties on registrars who fail to report registrations to higher authorities in a timely manner. Recently Haryana, Bihar, Jarkhand, and Goa failed to provide data to the union ministry of home affairs (MHA) about registration of birth and deaths while UP provided a part of the data. Haryana blamed it on “lack of computerization and governance issues”. The inaction of these states raise questions about the completeness and integrity of the birth and death data and justify the low score granted by the WHO to India.

These are weighty issues that must be dealt with. The government is spending considerable money in registering births and deaths and employing personnel to record the data. The joke is on those lampooning Aadhaar as a mandatory passport to death. There are much greater failings that they must hold the government accountable for."
Diving Into The Spirit World,"Many great 20th century scientists have been drawn to the spirit world, writes MUKUL SHARMA



The end of the nineteenth century and the beginning of the twentieth saw some extremely radical and revolutionary developments in modern science in the form of electromagnetism, relativity and quantum mechanics. In the light of this, one would imagine that the age of superstition, irrationality and old wives’ tales — not to mention ghosts — would technically come to an end. But nothing of the kind actually happened.On the contrary, a lot of well-known scientists (including a few Nobel laureates), rational thinkers and eminent statesmen almost immediately dived deeply into the spirit world. From both sides of the Atlantic, from recognisably advanced nations of the time like England, France and the United States, reports started steadily streaming in that some ‘gifted’ people were being able to go into a trance and summon up or even speak directly to the spirits of the dead.Others were apparently able to enter into an altered state of consciousness and write things dictated by remote entities in what was then fashionably known as ‘automatic writing’ or as it’s still called today, ‘channelling’.



Some of these outpourings were touted to be the latest works of deceased writers and musicians describing new works of theirs such as unknown plays of Shakespeare and Bacon or new compositions by Mozart and Beethoven. In India too in the early 1900s, a Sanskrit manuscript surfaced called Vaimanika Shastra or ‘Science of Aeronautics’ which was purportedly dictated to a ‘seer’ by the name of Pandit Subbaraya Shastry who claimed it was psychically delivered to him by the ancient Hindu sage Bhardwaj and contained mention of advanced aerodynamic flying vehicles in use in Vedic times. Bizarre as it may sound though, a lot of men of science and other research streams began flocking in droves to these séances apparently to study their veridicality, thinking it might be the next great breakthrough in their respective fields. Parapsychologists came to check out instances of telepathy and clairvoyance, reincarnation researchers wanted to see if disincarnate souls could exist and people who believed in flying saucers and ancient alien astronauts thought they might find evidence for their theories. Everything ultimately came to nothing. Either the mediums were exposed as hoaxes who cleverly fooled the gullible — including J J Thompson, the discoverer of the electron,physicist Oliver Lodge, and Balfour, the later prime minister of England — or they themselves admitted their chicanery.



For instance, the famous Fox sister mediums publicly acknowledged they were faking the whole thing while Leonora Piper was exposed by a professional magician. In which connection, the so-called Vaimanika Shastra manuscript along with the various sketches in it was also investigated by the aeronautical and mechanical engineering researchers at the Indian Institute of Science,Bangalore in 1974. Their conclusion was simple: it was nonsense. They said that the aircrafts described in the text were ‘poor concoctions’ and that the author showed a complete lack of understanding of aeronautics. Of one particular flying machine, the Rukma Vimana, the study noted: “If the craft is taken to mean what the drawing and the text say,it can be stated that the craft is a decided impossibility.” However, having said that and, hopefully, in the process defrocking the occult ilk, let’s skip a few decades to 1930.That was the year the Pulitzer Prize winning American author Upton Sinclair wrote Mental Radio: Does it work, and how? It documents Sinclair’s test of the psychic abilities of Mary Craig, his second wife, while she was in a state of profound depression with a heightened interest in the occult. She attempted to duplicate 290 pictures which were drawn by her brother. Sinclair claimed Mary successfully duplicated 65 of them, with 155 ‘partial successes’ and 70 failures. Yet what’s the bet most of us would never guess — Albert Einstein wrote the preface to this book. ¦"
"Congrats, Vice-President M Venkaiah Naidu","Venkaiah Naidu’s election as the next vice-president had been a foregone conclusion, but not his victory margin. As it transpired, Opposition candidate Gopalkrishna Gandhi got 19 votes less than he was supposed to, that many members of the two Houses of Parliament who had pledged their support to him ending up not voting for him. Of equal concern, if of a different kind, is the inability of 11Members of Parliament to vote right, resulting in their votes being invalid. It is time the Election Commission introduced electronic voting machines in gubernatorial elections as well.

For the Opposition, how big a setback is their candidate’s loss and does it offer a foretaste of how things will pan out in 2019? By other indications, such as the successful and aggressive politics of the BJP that has allowed it to add state after major state to its kitty and instal its partymen and pliant fellow-travellers as chief ministers, it is well on its way to secure another mandate in the next general elections.

But to draw the same conclusion from the vice-presidential election would be wrong. For one, the votes Gandhi got overstates the Opposition’s ability to oppose the BJP in 2019. A united front at the level of MPs does not mean that they would be able to contain their natural inclination to fight one another, apart from the BJP, in the general elections. For another, the Naidu tally overstates the BJP’s support. Opportunist MPs who want to be in the ruling party’s good books and resort to cross-voting are not necessarily expert poll forecasters who modulate their voting according to which way the electoral wind blows.

Naidu has done well to declare his intention to be non-partisan as vice-chairman of the Upper House. Appearances matter, too, in a democracy."
Concerns remain with England's batting lineup,"SOUTH AFRICA TOUR OF ENGLAND 2017

Concerns remain with England's batting lineup

Rob Johnston • Last updated on Sun, 06 Aug, 2017, 11:29 PM

Apart from Jennings, England will be concerned with Malan's inability to deliver at this level as well. © Getty

Provided nothing remarkable happens tomorrow, England should wrap up a 3-1 series victory over South Africa. A win against the second best-ranked team in the world is a decent achievement given England have a new captain in Joe Root and have not won a Test series for over a year. But in truth, despite four entertaining matches, the quality of the cricket on show has been mixed and England still have their demons, notably at the top of the order.

Keaton Jennings, the latest pretender, finished the series with 127 runs at an average of 15.84, passing 20 just twice. Overall, he averages less than 25 in his six Tests to date. As troublesome as those stats are, it is the manner of his innings and dismissals which suggest he should be withdrawn from the firing line for England's three match series with the West Indies.

Of his eight dismissals in this series, six have been caught behind the wicket. He has also been dropped in the slips on a number of occasions and has rarely exuded an air of permanency. Jennings' habit of pushing at deliveries in a rather stiff, upright manner rather than fully getting his weight and head towards the ball have caused him issues. According to CricViz, the stats engine, Jennings has edged more balls than he has middled in this series.

He has tried to work on his shortcomings - at the Oval, he was consciously trying to get further forward - but doing so during the intensity and packed schedule of four Tests in five weeks is not easy. Paul Farbrace, England's assistant coach, admitted earlier in this match that Jennings is aware of the things he needs to work on but has not had the time to do so.

Of course, Jennings' struggles should be put into context. Conditions for batting have been difficult for much of the series and the combined average of the top three batsmen in both teams is just 27.47. Jennings has had to face Vernon Philander, Morne Morkel and Kasigo Rabada which is a fine seam bowling attack, often operating in helpful conditions. Things have not been easy. But then, Test cricket isn't easy.

Farbrace thinks Jennings, given some work, has the potential for a good international career and England's management rate him highly despite a first-class average of less than 36. They admire his character and temperament - as does former Yorkshire coach Jason Gillespie - and Jennings captained the England Lions in Sri Lanka over the winter as well as against South Africa 'A' and the senior South African team this summer.

But given his lack of runs and the need for England to settle on an opener for the Ashes, a change is likely to be made for the West Indies series which begins with a day-night Test at Edgbaston. That will give the new man just three matches against one of the weaker Test bowling attacks before the winter tour. It is far from ideal preparation.

The choice is likely to be a shoot out between Surrey's Mark Stoneman and Lancashire's Haseeb Hameed although Essex's Nick Browne and Middlesex's Nick Gubbins are also highly thought of. Stoneman has not yet played for England - he would be Alastair Cook's twelfth opening partner since the retirement of Andrew Strauss in 2012 - but is perhaps the likely starter given Hameed's lack of runs for Lancashire this season.

Hameed, so impressive in his two Test appearances in India over the winter, has been in awful form for his county. He is without a half-century in 13 Championship innings this season and has begun to play at balls well outside his off-stump which previously he would have left. It would be a difficult call to bring him back in Edgbaston on that form.

In contrast, Stoneman has three Championship hundreds for Surrey and is averaging over 50. He scored more than a thousand runs for Durham in Division One in the previous two seasons too and is a fine player off the back foot which could be useful in Australia. Kumar Sangakkara, his county teammate, said earlier this season: ""He's an excellent player with a great all-round game."" There is no finer judge in the game than the great Sri Lankan.

Jennings is not the only England player struggling for form. Dawid Malan has scored just 35 runs in his four innings during this series which is the least any England player has managed from his first four innings since Uzman Afzaal in 2001. The Middlesex left-hander has failed to convince in any of his showings so far and his two dismissals at Old Trafford, driving loosely and then plopping a catch to short-leg, have been soft.

Not that England should discard him yet. At his best, Malan has a reputation for being a classy player and he scored an excellent hundred against a good Surrey attack earlier this season. But he will know that he has work to do against the West Indies to cement his spot for the Ashes. Should Malan fail to do that, England will have to consider their middle order options.

They could bring in another bowler and move their allrounders up the order - something that coach Trevor Bayliss is keen on - or they could bring back Gary Ballance, once recovered from his finger injury, or Lancashire's Liam Livingstone who was the most impressive batsman during the Lions' winter tour. There are certainly less candidates in the middle order than there are at the top.

At least Tom Westley's early composed forays in Test cricket during the last two matches have suggested they may have found a number three. He will, though, have to ensure his tendency to play across the line of the ball when driving, as he did in the first innings at the Oval and the second here at Old Trafford, is resolved.

With just three Tests before the Ashes, England still have to fully resolve positions two, three and five in their batting order. During the past four years, it has been ever thus.

© Cricbuzz

TAGS

RELATED STORIES"
Great News For Sreesanth As Kerala High Court Orders BCCI To End His Lifetime Ban,"The Kerala High Court on Monday ordered Board of Control for Cricket in India (BCCI) to lift the lifetime ban on cricketer S Sreesanth that was imposed on the basis of spot-fixing charges against him.

BCCL/Representational Image

The court issued the order after considering a petition filed by the cricketer in March challenging BCCI's decision not to lift the ban despite a Delhi court exonerating him in 2015. The ban was imposed by BCCI on the allegation of spot-fixing in the 2013 edition of the Indian Premier League.

Challenging the ban, Sreesanth had contended at the high court that not lifting the ban violated his constitutional rights. It was on the basis of information provided by Delhi Police that BCCI imposed a ban on him and it was the case registered on the basis of the same information that was considered by the court while exonerating him. BCCI's decision not to withdraw the ban amounts to violation of constitutional rights, the player had argued.

BCCL

BCCI suspended him from the team and ordered an enquiry following his arrest by Delhi police in May 2013, the petition had said. A preliminary report was submitted by the enquiry team led by BCCI president in Jun 2013 without giving him a chance of hearing. Though his version was obtained in writing later, a supplementary report was filed in July without considering it. He was then issued a show cause notice by BCCI and later imposed a ban from playing at international competitions and at games conducted by clubs and institutions affiliated to it, as per the petition.

Here's how Twitter reacted:

Kerala High Court lifted the ban on #Sreesanth imposed by @BCCI

he is 34 & has been out for 4yrs

Will he be even sold in an #IPLAuction? pic.twitter.com/cSJN14B6eQ — Freaky ~ DRaval (@_DRaval) August 7, 2017

Reaction of Sreesanth after ban imposed by BCCI upon him was lifted by Kerala High Court #SreesanthIsBack pic.twitter.com/hJSpVk6J8j — 🙏 (@Sachinspired) August 7, 2017

@sreesanth36 At last Kerala high court delivered justice...Congrats sree...Hope to see you soon in blue colors... @BCCI — bruh bruh (@Gautham786) August 7, 2017

That feeling of @BCCI right now. @sreesanth36 's best wicket I remember. That move from Kerala High Court. All in one Pic. #Sreesanth pic.twitter.com/3aPLKMQHRh — Razeen Nizar (@wazzaredraze) August 7, 2017

After the decision by Kerala High Court, waiting for @sreesanth36 to be back, to his very best! He is one beautiful seamer! — Ramu Mohan (@jaadaramu) August 7, 2017

Don't Miss 575 SHARES 69.2 K SHARES 18.2 K SHARES 17.9 K SHARES 29.1 K SHARES 6 K SHARES 5.2 K SHARES 1.6 K SHARES 4.3 K SHARES

It took 4 years for @sreesanth36 to get justice. 4 years lost from a Cricketers career. Cannot be compensated anyhow. Shame on BCCI — Abhishek 🇮🇳 #408 (@ImAbhishek7_) August 7, 2017

#JusticeDone Welcome back brother ❤ @sreesanth36 Best wishes!!! Hoping to see you soon in blues 👍 pic.twitter.com/s6tOyPx9q5 — Bibin BA (@ImBibin77) August 7, 2017"
It's 9-0! Vijender Singh Proves To Be Too Much For China's No. 1 Zulpikar Maimaitiali And Wins Double Title Bout,"Vijender Singh continued his unbeaten streak with a victory over Zulpikar Maimaitiali to make it 9-0.

He defeated China's No. 1 boxer to win the double title bout. He is now both the WBO Oriental super middleweight and Asia Pacific super middleweight champion.

AFP

There was a lot of build up to this fight, especially since there are border tensions going on between the two countries.

Zulpikar tried to trash talk Vijender in the previous days, but was shot down every time. In the ring, Vijender took the match after a close result.

Twitter

This was his first match this year, but the man did not look rusty at all.

So that's 9 wins in 9 fights. He is still yet to be conquered since turning pro in 2015.

Don't Miss 18.2 K SHARES 6 K SHARES 17.9 K SHARES 29.1 K SHARES 5.2 K SHARES 1.7 K SHARES 1.6 K SHARES 4.3 K SHARES 3.8 K SHARES 2.9 K SHARES"
How to wear the coolest cover-ups of the season,"Katrina Kaif paired a floral printed jacket with straight-fit denims and a lace cami. Picking from the colour of the jacket, she finished her look with red-strap platforms."
Here Is The First Ever Picture Of KJo's Kids Yash & Roohi And We Can’t Stop Gushing Over Them,"The celebrity kids are the new stars, who without even being on social media platforms, have a solid presence on the internet. Just one new picture of them online, and it makes people go crazy. Fans cannot stop gushing over their cuteness and it makes rounds like they are the new stars of B-town already.

#Carfie #sunday #gentlemonster A post shared by Karan Johar (@karanjohar) on Jul 30, 2017 at 12:39am PDT

After Shahid Kapoor’s daughter Misha and Kareena Kapoor’s son Taimur, joining the bandwagon are Yash and Roohi, Karan Johar’s twins, who in their first ever picture have surpassed all the levels of cuteness.

I miss my babies!!!! #roohiandyash A post shared by Karan Johar (@karanjohar) on Jul 17, 2017 at 9:58pm PDT

Here is the picture which is breaking the internet. Grandma Hiroo Johar is beaming with excitement as she hold them in her arms.

6 months old today....#roohiandyash #happyrakshabandhan #lovesofmylife❤️ A post shared by Karan Johar (@karanjohar) on Aug 7, 2017 at 2:56am PDT

It’s Rakhi, and we have to admit this is the perfect day to reveal the first ever picture of the brother-sister duo!

(Also Read: KJo Writes A Heartfelt Letter For His Kids Roohi & Yash And It's Too Cute To Miss)

Don't Miss 758 SHARES 67.9 K SHARES 21.8 K SHARES 16.6 K SHARES 24.3 K SHARES 12 K SHARES 19.9 K SHARES 9.8 K SHARES 12.3 K SHARES"
"These Test World Records Are Still Held By Rahul Dravid, India's Most Dependable Batsman","Rahul Dravid has been called The Wall for India. He was also India's most dependable batsman in a career that spanned 16 years.

AFP

The man even now still holds some major records in Test cricket. Let's take a look:

1. Most catches in Tests - 210

AFP

2. Most balls faced in Test cricket - 31,258

AFP

3. Bowled the maximum times in Tests - 54

AFP

4. Involved in most century stands in Tests - 88

AFP

Don't Miss 561 SHARES 1.7 K SHARES 69.2 K SHARES 18.2 K SHARES 17.9 K SHARES 29 K SHARES 6 K SHARES 1.6 K SHARES 4.3 K SHARES 3.8 K SHARES"
