Title,Article
"Pradhan meets Odisha CM Patnaik to resolve Paradip refinery tax issue, Energy News, ET EnergyWorld","New Delhi: Oil Minister Dharmendra Pradhan today met Odisha Chief Minister Naveen Patnaik here and discussed an ongoing tax issue between Indian Oil Corporation ( IOC ), the nation’s largest fuel retailer, and the state government over the latter withdrawing tax incentives provided for setting up the Paradip refinery project in 2004.“Discussion happened in positive environment and both sides displayed the willingness to come to a mutually benefitting and agreeable solution,” Pradhan said in a tweet following the meet.The Odisha government had in February this year sent a notice to IOC stating it is withdrawing the promised 11-year tax deferment on payment of sales tax on Paradip refinery products sold in the state.The state government had originally offered the tax incentives to IOC and its then partner Kuwait Petroleum Corp (KPC) in December 1998 to invest in setting up a refinery in the state. These investments were withdrawn in February 2000, leading to the company shelving the project.The state later restored the incentives and signed a Memorandum of Understanding (MoU) with IOC in February 2004 for providing a set of eight sops. The state government had reportedly withdrawn the tax incentives in ""public interest"", citing 6-year delay in commissioning of the project that was larger in capacity than originally planned 9 million tonne plant.IOC, however, pointed out the February 2004 MoU clearly allowed change in design, capacity and configuration of the project and that the Odisha government was informed about the change in capacity and the delay in construction caused by cyclone, land acquisition and law and order problems, according to a report.As per the MoU, IOC was to commission the refinery in 2009, but actually did it in November 2015 and the state government allowed IOC to avail of construction-related sops totalling Rs 550 crore all through the six years.The foundation stone of the Paradip refinery was originally laid by the then prime minister Atal Bihari Vajpayee in May 2000."
"Mission possible: A new India: PM is using India’s high-quality, low-cost technology to lift 400 million out of poverty by 2022","On 15 February this year, Isro placed 104 satellites into orbit using only a single launch of one vehicle, PSLV-C37. The video of the event, available easily enough on the net, shows the familiar zoom of a rocket entering space, and then little flicks chase one another into the deep distance until the mission is completed. Only three satellites were Indian; 96 were commissioned by two American companies, Planet Laks and Spire Global.

The acceleration in space, impressive as it is, might be less spectacular than the change taking place on the ground. Prime Minister Narendra Modi has initiated a transformation towards a new India in which historic burdens such as poverty and corruption have been eliminated, and inheritance ills like communalism and casteism are only bad memory. His mission has a calendar; the deadline is 2022, when India celebrates its 75th year of independence.

Transformative change needs radical thinking. The economic empowerment of women is being used as a principal cure for poverty. Under Mudra, the PM’s signature project for those at the base of the economic pyramid, loans worth Rs 3,55,590 crore have been disbursed. Remarkably, 78% of those taking these loans are women.

The PM’s housing plan, for the impoverished, is an equally big story in gender emancipation. A woman can take this home loan as sole owner; but a man needs a woman as co-owner unless he is a widower or bachelor. This is a fundamental shift in the balance of power within a family. Over 25 million women who thought that a gas cylinder was a privilege of the middle class or rich, are now in smokeless kitchens. Swachh Bharat is a means to dignity and better health for women. The list is long.

The objective is to lift about 400 million out of harsh poverty in five years by ensuring that the first fruits and largest share of economic growth go to those who need it most. In a complementary initiative, the PM is using India’s proven capability in high-quality, low-cost technology to create efficient, sustainable and corruption-free delivery systems for direct benefits to the poor on an unprecedented scale.

Jan Dhan was an essential first step. In 2015, within three months, banks opened 300 million accounts for those who had never crossed the doors of a bank before. Critics sneered that these were “cashless”. Unsurprisingly, they had missed the point: banks were now serving those without money, rather than those with.

Use of technology for transparency has also become mandatory in the bidding process for government contracts. In a country where, particularly during the long decade between 2004 and 2014, contracts became synonymous with corruption, the change is a virtual revolution, leaving sections of the old political-industrial complex frustrated, angry and desperate to restore the previous order.

New India is being fashioned from embers of the old. Sceptics who cannot fathom why Narendra Modi has become the most popular PM in memory need look no further than his comprehensive assault on poverty and corruption.

It surely cannot be anyone’s case that through some twirl of a magic wand, India should suddenly become free of all ills. Among our difficult legacies is the politics of Hindu-Muslim differences, a tragedy that has simmered and often bubbled into conflict. One long-standing dispute has been over the cow, held sacred in Hinduism. Mahatma Gandhi urged an end to cow slaughter; and the lead architect of our Constitution, Dr Babasaheb Ambedkar, included this as a guiding tenet of our Constitution. Beef was banned in most states by Congress governments.

Of late, cow vigilantes have attacked Muslims and Dalits on suspicion of eating or transporting beef. Two incidents attracted wide, and understandable, media coverage: of Pehlu Khan in Rajasthan and Junaid in Haryana.

No government can prevent crime. A government’s bona fides are tested by what it does in pursuit of the criminal. In Rajasthan, seven suspects have been charged with murder. The state’s chief minister Vasundhara Raje has dismissed as malicious the allegation that her administration was biased and argued the same in this newspaper, in an oped piece headlined ‘Mob violence is unacceptable’ (27 July). Comparisons are not an answer, but she pointed out that murders and mob violence took a higher tally in Rajasthan in 2012, when Congress was in power. In Haryana, five were arrested but the main suspect escaped. Police traced him to Sakri, in Maharashtra, where he thought he had found safety in obscurity. He has now confessed to stabbing Junaid.

On 29 June, PM Modi expressed his anguish during the centenary event of Mahatma Gandhi’s Sabarmati Ashram in Gujarat, wondering how much pain Gandhi himself would have felt. Gandhi had offered to die for the cow, but never advocated violence in its name. Finance minister Arun Jaitley has described the incidents as barbaric.

Both voters and politicians are increasingly dismissive of the motivated and fraying narrative of extended guilt. Nitish Kumar, for instance, refused to buy this false propaganda of Congress, whose only electoral crutch now is the alleged insecurity of minorities.

In 2013, there was an assassination attempt on Narendra Modi during a rally in Patna. At that critical, volatile moment, he said that Hindus and Muslims had a choice: they could either fight each other, or they could unite to fight the true enemy, poverty. Fraternity and prosperity of all Indians is the only creed of Narendra Modi."
"Bruised and battered, Windies stare at a steep learning curve","LONG WAY BACK UP

Bruised and battered, Windies stare at a steep learning curve

• Last updated on Sun, 20 Aug, 2017, 02:55 AM Rob Johnston in Birmingham

Jermaine Blackwood was the only bright spark in a forgettable batting display for WI. © Getty

It was a catastrophic third day at Edgbaston for the Windies. Ill-disciplined and lacking in both skill and fight, the tourists were outgunned by a far stronger England team. The visitors lost 19 wickets, a feeble batting display to go with their slapdash bowling in the first innings. It has not been good watching.

Nor has their capitulation been a surprise. The Windies are ranked eighth in the world in Test cricket and England are third. The men from the Caribbean have not won a Test series since 2014 and have won just five Tests away from home in the last ten years, three of which came against Bangladesh before the Asian side's recent improvement. It has been a long time - too long - since West Indies were a Test match force.

The current group to don the maroon caps are young and inexperienced. They have just one player, Kraigg Brathwaite, who has played more than 100 first-class games. In contrast, only one player, Toby Roland-Jones, has not reached the three-figure mark for England. Just two of this Windies team have played Test cricket in England before and six of them have played 12 Tests or less.

Which makes their performance in this match, as disappointing as it was, somewhat understandable. The players are learning the game at the highest level, trying to compete against seasoned internationals when they barely know their own games. An example: Alzzari Joseph, with just 21 first-class matches, has been pitted against Alastair Cook, England's highest ever Test run scorer and a man who may become the leading run scorer in Test history. Good luck with that, Alzzari.

Somehow, the most talented young West Indians have to play more tough first-class cricket before they get in the Test team. Only then can the batsmen learn more discipline and patience, knowing when to attack and when to defend. Only then can the bowlers develop more consistency of line and length. Only then will these players develop. At the moment, this is a team ill-equipped for Test cricket.

How they get more first-class exposure is the difficult question. The domestic competition in the Caribbean is lacking quality and depth and many of the region's better and more experienced players are plying their trade in T20 tournaments around the world. When Miguel Cummins goes back to play domestic cricket, he's not bowling to Chris Gayle, Dwayne Bravo or Keiron Pollard. He's bowling to lesser players and getting away with the type of loose balls that Cook and Joe Root gorged on in England's first innings.

Away from the Test team, West Indies 'A' have played just nine first-class matches since 2012, which has meant the likes of Joseph have been plucked straight from the Under-19 team in to Test cricket. It is not an impossible jump to make successfully but it happens rarely and a regular programme of 'A' team cricket would expose these cricketers to more intense first-class cricket. Cricket West Indies have recognized this and have scheduled three 'Tests' against Sri Lanka 'A' and three against England Lions in the next six months.

There is talent in this team. Kraigg Brathwaite, who already has a Test double hundred, has made a decent start to his career and coach Stuart Law, a good judge of a batsman, reckons Shai Hope has the talent to become one of the world's best. Jermaine Blackwood's fighting spirit, on show during his 79 not out today, has been evident many times before and Shannon Gabriel, when fit, is a real handful with the ball. Twenty-year-old Joseph has plenty of potential, too.

Cricket West Indies must do all it can to nurture this talent. Law's appointment is a good one for he will bring some hardnosed street smarts to this young team and he needs to address his players' technical flaws and make them more consistent. An increase in funding from the ICC should help the board do more with 'A' team cricket and the domestic structure and the in-fighting that has dogged West Indian cricket for a decade has to stop. The appointment of Johnny Grave as chief executive holds promise in that regard.

There will be short-term pain like here at Edgbaston while these players develop but Law will expect at least more application than his side showed in this match. Given some improvement, it is still unlikely that there are the raw materials in the Caribbean to develop a world beating side but they will hope to develop a more competitive team over the next 18 months or so. A good place to start would be at Headingley next week.

© Cricbuzz

TAGS

RELATED STORIES"
Indian Monetary and Trade Policy News,"10 things you cannot do without an Aadhaar Aadhaar is going to become the basis of most of your business and official transactions. In addition to many compulsory Aadhaar uses, the government may soon make it mandatory for buying shares and mutual funds too. Scroll down to see 10 important transactions where Aadhaar number is mandatory:

Load More..."
"Biocon: Biocon pulls application for EU approval of two drugs, Health News, ET HealthWorld","Biocon Ltd has withdrawn its application seeking European Union approval for two drugs after the EU drugs regulator sought re-inspection of their production facility, sending shares down more than 8 percent.

Biocon will re-submit the applications for breast cancer drug Trastuzumab and Pegfilgrastim, which cuts infection risk in patients undergoing chemotherapy, after the European Medicines Agency completes the inspection, it said in a stock exchange filing on Wednesday.

""The European regulatory authorities had informed us of the need for a re-inspection of our drug product facility for these products,"" Biocon said, without specifying when the regulator would carry out the inspection.

""We are on track to complete our corrective action and preventive actions by the end of this quarter, and it is our intent to seek re-inspection and re-submission thereafter.""

Biocon shares were down 6.8 percent as of 0823 GMT, in the NSE Nifty that was up 0.68 percent.

(Reporting by Jessica Kuruthukulangara in Bengaluru; Editing by Biju Dwarakanath)"
China moves its gears to Integrated Strategic Deterrence,"China getting frustrated at the Dokalm stand-off is moving its war propaganda machinery from “Three Warfares” to the next higher level in its “Integrated Strategic Deterrence” doctrine against India to achieve its objective of withdrawal of the Indian troops. It has opened other fronts at the border to project that it could raise the level of the present stand-off to a full-fledged war. Stone pelting incident at the Pangong Tso on the 15th August is a testimony of this stratagem.

In the above context, it is important to understand what the Chinese objective behind such acts is. Strategically speaking, China is in expansionist mode. Since 1949, China in accordance with its well-crafted strategy is expanding its territory. After consolidating itself through the demographic changes in Tibet and brutally crushing the Tibetan autonomy supporters resulting in the suicide of several monks, it has decided to annex more and more territory in the periphery.

Since the Xi’s coming into power, China has adopted an aggressive policy to acquire territories in its periphery in three areas- South China Sea, East China Sea and at the Sino-Indian border in accordance with its 18th Century expansionist mind-set. The Chinese strategy has several steps to achieve its objective of acquiring territories without firing a bullet in line with Sun Tzu’s advice that supreme art of war is to subdue enemy without fighting. Overall the strategy is “Integrated Strategic Deterrence”.

This has the aim of achieving strategic deterrence by non-fighting means or fighting a small war. Several military and non-military capabilities like nuclear, conventional, space and information warfare, economic, diplomatic, scientific and technological as also the collective will of the nation constitute the ‘Integrated Strategic Deterrence’. This demands the following three components-

1. Possession and projection of an adequate credible military force.

2. The will and determination to use that force.

3. Communication using different means to the adversary that such a force can be actually used.

For the above purpose, China has evolved the Three Warfares. This has three elements. The first is the psychological campaign aimed at building the psychological pressure to scare, demoralise and deter its adversaries. The second is media warfare aimed at projecting that it is an injured nation to build international opinion in its favour and to ‘expose’ the weaknesses of adversaries. This is also used for convincing its domestic audience of the righteousness of its stance. The main theme is project that it lost its territories to the forces of colonialism and imperialism and it must work to retrieve its lost territories and past greatness. This was projected as the ‘Chinese dream’ in 2014. The third is the fabricated legal arguments to justify its stand. The cartographic aggression forms an essential element of this process. The Three Warfares is based on use of its official media and exploitation of social media platforms. Its projections are based on disinformation and mendacity.

The aggressive behaviour is thus a function of its ‘rise’ and ‘dream’ aimed at changing the strategic environment in its favour in line with its expansionist policy. Since India has not been deterred by the use of means of Three Warfares, China has begun using other tactics to deter India. This suggests that China could launch an extensive cyber-attack and intrude at other points along the Sino-Indian border to deter India. To project its intentions of using force, the Chinese deployment of force may also be increased.

The problem is also partly domestic for China. Having raised the level of propaganda to this level Xi cannot withdraw without a loss of face. With Congress likely to meet in November, any withdrawal will project Xi in a weaker position. While second tern for him is not going to be a problem, the criticism against his policies is increasing. There are persons who think that Xi is incapable of handling the Chinese economic problems.

As far as India is concerned, it cannot accept unilateral changes at the border. The Chines arguments are hollow. China does not take into account the agreements reached in 1988 and 1998 with Bhutan and in 2012 with India. It also does not take into account that Bhutan was not a party to 1890 treaty. The Sikkim documents prove that the current position of tri-junction is in accordance with the treaty of 1890. China is also unhappy over India’s stand on the Belt Road Initiative and on the South China Sea. India has exposed the Chinese neo-colonial policy behind the Belt Road Initiative which has the objective of placing smaller nations into debt traps and controlling their policies to its advantage. India’s stand on the South China Sea is also being disliked by China. India has supported the implementation of the Permanent Court of Arbitration’s Ruling that has declared the Chinese claims of the region in the nine-dash lines as illegal, unacceptable and unjustified.

India’s calm reaction coupled with firmness at the Doklam is unnerving the Chinese authorities. As a reaction China has intensified its false propaganda. The more it indulges in falsehood the more it exposes its weaknesses in arguments. India without getting provoked has reflected that it is not going to be deterred by the escalation of level of deterrence by China.

The Chinese authorities should see that in the 21st Century it cannot deter nations like India. It should also realise that if India is further pushed, it can stop or reduce trade with China which will be disastrous for the latter. That would make Xi’s position very weak before the Congress meet of the Chinese Communist party. Xi should take advantage of India’s initiative to resolve the issue peacefully and through negotiations. Indian PM’s initiative to attend the BRICS meeting in the Chinese city of Xiamen ‘in the interest of all nations’ should be utilised by Xi to diffuse the tension at the border."
