Title,Article
Stats: India's towering presence against out-of-form Sri Lanka,"INDIA TOUR OF SRI LANKA, 2017

Stats: India's towering presence against out-of-form Sri Lanka

Deepu Narayanan • Last updated on Sat, 19 Aug, 2017, 12:15 PM

Shikhar Dhawan averages 69.44 with two hundreds and four fifties against Sri Lanka. © Getty

The league stage encounter between India and Sri Lanka at the Kennington Oval in the recently concluded Champions Trophy had a special significance attached to it - India and Sri Lanka became the first sides to play against each other in 150 ODIs. Such has been the profusion of India-Sri Lanka ODIs since the 2000s - 88 of them - that at one point in Virat Kohli's career, more than half of his games were against the island nation.

Though the two sides have locked horns more than any other sides in the recent past, the contests on the field haven't lived up to the expectations. While Sri Lanka have a slight edge over India in the multi-nation tournaments, it has been a one-way traffic in the bilateral meets. Consider this stat - the last time Sri Lanka won a bilateral ODI series against India (3-0 at home in 1997), Mahela Jayawardene was yet to make his ODI debut (he finished with 448 ODI caps, second most by any player in history).

India - SL ODIs post 2000

Period ODIs Ind Won SL Won Tie/NR Ind Win % SL Win % All ODIs 88 49 32 7 55.68% 36.36% In Sri Lanka 35 17 15 3 48.57% 42.86% Bilateral series 37 27 7 3 72.97% 18.92% Multi-nation series 51 22 25 4 43.14% 49.02%

India won seven out of the eight bilateral rubbers against Sri Lanka post-2005 with the other one ending in a 0-0 draw with rain playing spoilsport. Not only have they won the series, India's domination in this period has been so overriding that Sri Lanka have won more than one match in a series, only once (win margins for India being 6-1, 2-1, 3-2, 4-1, 3-1, 4-1 and 5-0). Things haven't been that different in Sri Lanka as well, as India's win-loss record of 11-4 in Sri Lanka in the last ten years indicate the same.

Sri Lanka average over 47 with the ball against India in bilateral ODIs, nearly 19 points higher than what they average with the willow against them. The difference of 18.85 between Sri Lanka's bowling and batting average is the second highest in bilateral series among top eight teams since 2005. The only higher difference in bilateral ODIs is the one between South Africa and West Indies - 30.71. The next worst for Sri Lanka against an opposition is 13.82, against South Africa (batting average 27.76 and bowling average 41.58).

Highest difference in batting and bowling averages in bilateral ODIs post 2005

Team Against Matches Runs Bat Av Wkts Bowl Av Bat Avg - Bowl Avg SA WI 20 4190 24.21 90 54.93 30.71 Ind SL 37 7954 28.20 188 47.06 18.85 SA Ind 27 5380 25.74 163 42.26 16.52 Aus NZ 34 7324 25.60 200 41.79 16.18 Aus Pak 21 4253 23.75 129 39.72 15.96 Ind NZ 20 4362 29.47 109 45.00 15.52 Pak WI 26 5063 24.22 154 39.53 15.31 Aus WI 20 3656 21.01 132 36.32 15.31

**excludes ODIs against Bangladesh, Zimbabwe & other Associate nations

Out of the 16 times in the 37 ODIs India batted first, eight times they crossed 300. Spin bowling, considered the backbone of the Sri Lankan bowling attack over the years and the way Indian batsmen subjugated them, dictated the results in India's favour. Barring Ajantha Mendis who weaved a web over the Indian batsmen when he initially burst onto the scene, no other Sri Lankan spinner averaged less than 35 against India - the great Muttiah Muralitharan averaged 35 in bilateral ODIs against the familiar foes.

Spin vs Pace in Ind-SL bilateral ODIs since 2005

Team Pace





Spin







Wkts Avg SR ER Wkts Avg SR ER India 132 28.17 31.62 5.35 91 38.58 46.47 4.98 SL 121 43.31 43.79 5.93 66 52.2 57.26 5.47

Lasith Malinga is all set to play his 200th ODI and he is just two scalps away from the 300-wicket mark. However, the problem for the hosts is the inexperience of the other bowlers in the squad - all the 14 have a combined 291 ODI wickets, seven less than Malinga's individual tally. Angelo Mathews and Thisara Perera have contributed 240 of those and it's a welcome news for Sri Lanka that he will bowl in this series.

The challenge for Malinga will be that he will be up against the two batsmen who have dominated him the most in limited-overs cricket - Virat Kohli and MS Dhoni. Kohli has scored 180 off 169 balls off him, getting dismissed just once, while Dhoni has 186 off 167 deliveries against three dismissals. As a result, Malinga's overall ODI numbers against India are few notches below his overall numbers - averages 41.92 against India in comparison to 28.39 in his career.

Malinga's bete noire

Batsman ODIs Runs Avg SR Balls/Dis V Kohli 27 180 180.00 106.51 169.00 MS Dhoni 21 186 62.00 111.37 55.67

Apart from Kohli and Dhoni who average 54.59 and 61.40 against Sri Lanka, Shikhar Dhawan has been another thorn in the eye for them. In nine innings against Sri Lanka, he averages 69.44 with two hundreds and four fifties including a 125 which came during their recent Champions Trophy clash. Angelo Mathews is one Sri Lankan batsman who has done remarkably well against India, scoring 935 runs from 28 innings at 46.75 and a strike rate in excess of 90. However, their skipper Upul Tharanga averages only 29.62 against India.

Sri Lanka have won only one out of the nine bilateral series against Full Member sides since the start of 2015 - against a weak West Indies side at home in 2015. The nine rubbers include a series loss to Zimbabwe and a shared trophy against Bangladesh - two oppositions Sri Lanka used to steamroll on their heydays from the past. With at least two wins needed to secure a direct qualification for the 2019 World Cup, Sri Lanka will have their task cut out against their bogey opposition from the recent past.

Most one-sided bilateral series since 2005

Team Against ODIs Won Lost Win % Series wins SA WI 20 19 1 95.00% 4/4 Aus Pak 21 17 4 80.95% 5/5 Aus WI 20 16 2 80.00% 3/4 Pak WI 26 20 5 76.92% 7/7 Ind SL 37 27 7 72.97% 7/8 Eng WI 18 13 5 72.22% 5/6

**excludes ODIs against Bangladesh, Zimbabwe & other Associate nations

© Cricbuzz

TAGS

RELATED STORIES"
Gautam Gambhir Talks About Yuvraj Singh's Future - Says He Won't Make Comeback To Team India,"Gautam Gambhir doesn't mince words. And has always been vocal about what he feels for Indian cricket. His Twitter handle bears testimony to his comments in the public forum.

This time around, he's opened up on the chances of Yuvraj Singh in the Indian cricket team. He said that the Punjab batsman now won't be able to make a comeback to Team India.

Twitter

Talking about his chances he said, “So, I feel that it’s difficult now for Yuvraj to make a comeback. Hopefully, he does because he is one of the greats of the game.""

Twitter

In an interview with Cricinfo, he said, “I don’t think ‘rest’ is the right word because he (Yuvraj) hasn’t played any cricket for quite a while and he would be wanting to play. If you want to see him at the World Cup, he should be given the maximum opportunity. Because, someone like Yuvraj, you want him in that flow, you want him in that rhythm. You can’t have someone like him playing in one series and resting thereafter.""

Don't Miss 511 SHARES 37.2 K SHARES 11 K SHARES 7.5 K SHARES 2.6 K SHARES 2.8 K SHARES 2.1 K SHARES 647 SHARES 466 SHARES"
"Axar Patel Proves His Worth In Team India, Puts Sri Lanka On The Back Foot With A Splendid Spell","This was another opportunity for Axar Patel to seal his spot in Team India. And he did it exceedingly well with a fantastic spell in Dambulla.

Twitter

In his ten-over spell, Axar picked up three crucial wickets and also choked the flow of runs of the Sri Lankan team.

PTI

He dismissed Kusal Mendis, Lakshan Sandakan and Wanindu Hasaranga. The best part about his spell was the economy rate, which was 3.40. Sri Lanka were dismissed for 216 within 44 overs."
"Solar eclipse presents first major test of power grid in renewable era, Energy News, ET EnergyWorld","By Ruthy Munoz

HOUSTON: As Monday's total solar eclipse sweeps from Oregon to South Carolina, U.S. electric power and grid operators will be glued to their monitoring systems in what for them represents the biggest test of the renewable energy era.

Utilities and grid operators have been planning for the event for years, calculating the timing and drop in output from solar, running simulations of the potential impact on demand, and lining up standby power sources. It promises a critical test of their ability to manage a sizeable swing in renewable power.

Solar energy now accounts for more than 42,600 megawatts (MW), about 5 percent of the U.S.'s peak demand, up from 5 MW in 2000, according to the North American Electric Reliability Council (NERC), a group formed to improve the nation's power system in the wake of a 1964 blackout. When the next eclipse comes to the United States in 2024, solar will account for 14 percent of the nation's power, estimates NERC.

For utilities and solar farms, the eclipse represents an opportunity to see how well prepared their systems are to respond to rapid swings in an era where variable energy sources such as solar and wind are climbing in scale and importance.

Power companies view Monday's event as a ""test bed"" on how power systems can manage a major change in supply, said John Moura, director of reliability assessment and system analysis at the North American Electric Reliability Corp.

""It has been tested before, just not at this magnitude,"" adds Steven Greenlee, a spokesman for the California Independent System Operator (CISO), which controls routing power in the nation's most populous state.

CISO estimates that at the peak of the eclipse, the state's normal solar output of about 8,800 MW will be reduced to 3,100 MW and then surge to more than 9,000 MW when the sun returns.

CISO's preparation includes studying how German utilities dealt with a 2015 eclipse in that country. Its review prompted the grid overseer to add an additional 200 MW to its normal 250 MW power reserves.

""We've calculated that during the eclipse, that solar will ramp off at about 70 MW per minute,"" said Greenlee. ""And then we'll see the solar rolling back at about 90 MW per minute or more.""

Power utilities say the focus will be on managing a rapid drop off and accommodate the solar surge post the eclipse. Utility executives say they do not expect any interruption in service, but are prepared to ask customers to pare usage if a problem arises.""We want to assure our customers that we have secured enough resources to meet their energy needs, even with significantly less solar generation on hand,"" said Caroline Winn, chief operating officer at utility San Diego Gas & Electric Co.

In the Eastern United States, utilities will have more time to watch the results of their Western counterparts. PJM Interconnection, which coordinates electricity transmission among 13 states from Michigan to North Carolina, says non-solar sources such as hydro and fossil fuel can easily supplant the 400 MW to 2,500 MW solar loss, depending on the cloud cover.

For small-scale solar providers, the eclipse is a drop in the revenue bucket. Ron Strom, a North Carolina real estate developer, sells the power from a 58 kilovolt system atop a commercial property in Chapel Hill to Duke Energy.

""The event may cost me eighteen cents or thereabouts if my panels don't produce solar for three hours,"" said Strom."
"Forest & Wildlife News, Tigers News from India","Never miss a great news story!

Get instant notifications from Economic Times

AllowNot now

You can switch off notifications anytime using browser settings."
"Australia recall Faulkner, Coulter-Nile for India tour","AUSTRALIA SQUAD ANNOUNCEMENT FOR INDIA TOUR

Australia recall Faulkner, Coulter-Nile for India tour

Cricbuzz Staff • Last updated on Sat, 19 Aug, 2017, 08:57 PM

James Faulkner last played an ODI in February this year. © Getty

Australia have recalled all-rounder James Faulkner and pacer Nathan Coulter-Nile for their upcoming tour of India. While Faulkner makes his way back to the ODI squad, Coulter-Nile finds a place in squads of both the limited-overs formats. The T20I squad also includes uncapped left-arm pacer Jason Beherendorff, who averages 19.47 for his 53 scalps in 38 T20s.

Left-arm fast bowler Mitchell Starc, meanwhile, continues his recovery from an injury to his right foot away from the game. The spearhead of Australia's bowling attack sustained the injury midway through Australia's Test tour of India early this year. He played the Champions Trophy but has been given more time to return to his best.

With the upcoming Ashes series in mind, Starc has not been included in Australia's two-Test tour of Bangladesh (starting from August 27) as well as the India tour.

Australian team physiotherapist David Beakley explained that that the fast bowler's recovery has been slower than expected: ""We have recently reviewed the progress of Mitchell's right foot injury and the healing process has been slower than we would have liked.""

""Consequently, in order to ensure his best possible preparation for the Ashes, he will be unavailable for the Tour of India and will continue his rehab in Australia with an aim to have him play for New South Wales in the domestic one-day cup.""

Australia are scheduled to play five ODIs and three T20Is in India during the months of September and October this year.

ODI squad: Steve Smith, David Warner, Aaron Finch, Glenn Maxwell, Marcus Stoinis, Travis Head, Matthew Wade, Nathan Coulter-Nile, Pat Cummins, James Faulkner, Josh Hazlewood, Ashton Agar, Hilton Cartwright, Adam Zampa T20I squad: Steve Smith, David Warner, Jason Behrendorff, Daniel Christian, Nathan Coulter-Nile, Pat Cummins, Aaron Finch, Travis Head, Moises Henriques, Glenn Maxwell, Tim Paine, Kane Richardson, Adam Zampa

After constantly being laid low by injuries, Coulter-Nile found success while representing Kolkata Knight Riders during IPL 2017. The fast bowler, who bagged 15 wickets in eight games for KKR, is expected to make a big impression during the India tour. Cricket Australia selector Trevor Hohns talked up Coulter-Nile's return while also praising all-rounder Faulkner's familiarity with the sub-continent.

""Nathan brings raw pace to the side with good variation. It is great to see him back from injury and we are hopeful he will have a big impact in this series. ""James Faulkner is a solid One-Day campaigner and is very familiar with sub-continent conditions, coming off a very good tour of Sri Lanka last year. We hope that he will take his chance in returning to the one-day side,"" Hohns said.

Cricket Australia have also invested some amount of faith in Western Australia all-rounder Hilton Cartwright, picking him in both the squads. Cartwright, who made his Test debut for Australia earlier this year, comes with the reputation of being a big-hitter and is expected to slot into the shorter format with ease.

""Hilton is an aggressive striker of the ball and we think his game will be well suited to the transition to short-form cricket,"" Hohns opined.

While wicketkeeper-batsman Tim Paine has kept his T20I spot despite poor outings with the bat during the home series against Sri Lanka in February, all-rounder Daniel Christian braces himself for a return to the national side after more than three years.

© Cricbuzz

TAGS"
Jan Dhan Yojna: News on Financial Inclusion in India – The Economic Times,"Never miss a great news story!

Get instant notifications from Economic Times

AllowNot now

You can switch off notifications anytime using browser settings."
"Congress accuses Adani Group of over-invoicing electrical equipment, Energy News, ET EnergyWorld","NEW DELHI: The Congress on Friday alleged that a directorate of revenue intelligence ( DRI ) probe concluded in 2014 has named the Adani Group in its report charging that the group utilised a network of offshore companies to purchase electrical equipment and then sell it to its Indian counterpart at over 86% above the original value.Addressing a press conference, AICC spokesperson Ajay Maken claimed that the “entire scam could be estimated at a sum of Rs 50,000 crore, across multiple companies, and affecting various components of power sector including purchase of coal, setting up of plant for generation of electricity and equipment for transmission of power”.Denying the allegation, Adani Group said the statements and reports were brought out with ulterior motives to create sensationalism.“As a responsible corporate citizen, all our transactions are always conducted within the framework of extant regulatory guidelines and provisions. It is a standard procedure for the group to follow international competitive bidding (ICD) route for major capital expenditures to ensure transparency and competitiveness in the process,” the company said.Maken said on February 5, 2013, the UPA government initiated an inquiry into the practice of over-invoicing on import of electrical equipment/ machinery by a subsidiary of the Adani Enterprises Ltd . On the basis of the probe, a 97-page showcause notice was issued to a wholly-owned subsidiary of Adani Enterprises Ltd, he said.The report submitted by DRI has been put in public domain and a recent expose by a reputed international publication makes it clear that the DRI report names the Adani Group, he said.Maken alleged the NDA government “decided to go slow on this important matter, and as a result, till today, the investigation has not reached its logical end.”"
"Tamil Nadu's power loss pegged at 13 per cent, Trichy tops list, Energy News, ET EnergyWorld","CHENNAI: Trichy region has the maximum distribution loss (19.08% - 51.11 million units) in the power sector in Tamil Nadu . Tirunelveli stands second at 15.16%, South Chennai has 13.99% loss and North Chennai 11.50%.These are the findings of the first-ever region-wise analysis of power distribution loss in the state. Distribution loss occurs owing to old meters, old cables as well as power theft. The total distribution loss in Tamil Nadu is estimated to be 12.91%. With the changing of old meters with digital ones, the loss is likely to reduce in the coming years.Trichy region comprises Cauvery delta region and Karur district.""Farmers' connections in delta districts don't have meters and most of them use higher horse power pumps. For example, if a farmer has been permitted to use a 5 horse power pump, he would be using a 10 horse power pump. The extra power used is accounted for as distribution loss,"" a senior Tangedco official told TOI.Tangedco estimates that farm power connections could be the main reason for Trichy region topping the distribution loss chart.In urban areas, the loss is owing to old cables and meters.""We have a target to lower the distribution loss in urban areas to single digit percentage, but in rural areas we hope to bring it down to 4%,"" said the official. In urban areas, apart from digital meters, the discom will also set up modern sub-stations to reduce distribution loss.""Though the investment to set up modern sub-stations like gas insulated switchgear (GIS) is high, such infrastructure needs less land and it will also lower distribution loss. Such sub-stations will be set up at least in urban areas where acquiring land is a problem,"" said the official.Tamil Nadu Electricity Regulatory Commission (TNERC), in its tariff report, has asked Tangedco to differentiate between power theft and transmission loss.Unless this is done, the distribution loss trajectory may not reflect the ground reality."
"fuel cells: Anglo American swims against the current in backing fuel cells for vehicles, Energy News, ET EnergyWorld","FILE - In this photo taken Monday, Nov. 17, 2014, the engine part of a Toyota Motor Corp.'s new fuel cell vehicle Mirai is shown at its showroom test course in Tokyo. A New Mexico startup is betting on automakers to develop hydrogen cars and wants to provide material for them as nations and companies scramble to bring pollution-free vehicles to drivers. Japan announced in May 2017 that it was backing a push for pollution-free vehicles that run on hydrogen.Photo/Shizuo Kambayashi, File)

By Barbara Lewis

LONDON: Anglo American is placing a contrarian bet on hydrogen fuel cell vehicles as it tries to squeeze more profit from its platinum reserves, but risks being left behind as rival miners look to cash in on battery-powered cars.

A push, particularly in Europe and China, for lower-emission transport raises the prospect of weaker demand for platinum, whose biggest industrial use is in diesel vehicles.

Other big miners are positioning themselves for the shift away from the combustion engine by betting on lithium and cobalt, both used in electric vehicle batteries.

Glencore signed a major deal last October to sell 20,000 tonnes of cobalt products, a hitherto niche material whose production it dominates, while Rio Tinto is sitting on a large deposit of lithium.

As the world's top supplier of platinum, Anglo American is left with little choice but to remain committed to the metal. But it sees strength in what others may perceive as a weakness.



""Platinum and palladium will long play a critical air quality role in the global vehicle fleet, including in heavy commercial vehicles, hybrids and the emerging hydrogen fuel cell electric technology,"" CEO Mark Cutifani told Reuters.

The firm has modernised operations, aiming to mechanise at least 70 percent of its platinum mining to boost efficiency. Cutifani is relentlessly pursuing a target of 15 percent return on capital, up from 4 percent in the first half of this year.

It has also invested $110 million on encouraging technologies that use platinum, setting up partnerships with innovators, and lobbying governments to provide more infrastructure for hydrogen fuel cell vehicles.

Instead of relying on a battery, such vehicles convert hydrogen into electricity using a fuel cell, in which platinum acts as a catalyst. Water is the only emission.

Each vehicle would need between 10-15 grams of platinum, Anglo estimates, compared with around 7 grams in the catalytic converters of an average diesel car.

WILL THE BET PAY OFF?

China has set a target of 1 million hydrogen fuel cell vehicles by 2030, which Anglo says would require 300,000 troy ounces of platinum, about 10 percent of current auto demand and a chunk of its annual production of more than 2 million ounces.

But so far the take-up of hydrogen vehicles is tiny, and industry experts say their wider use is years away at best, with high purchase prices and a lack of refuelling stations the major barriers.

Anglo says its lobbying is nonetheless paying off.

Britain, for example, announced a 23 million pound ($30 million) fund to accelerate the take-up of hydrogen vehicles and has pledged to expand the refuelling network from a dozen stations nationwide so far.

Cutifani meanwhile joined forces with CEOs from the motor, chemical and oil industries who launched the Hydrogen Council lobbying group at the start of this year.

Toyota, which backs fuel cells because it does not want to be dependent on a single technology, was among those represented.



The Japanese car maker sees advantages in hydrogen vehicles' greater range and faster refuelling compared with battery power, although it has said it expects the technology to reach the mainstream only by the mid-to-late 2020s.

It is also seeking to reduce the amount of platinum needed to keep down costs.

Volumes of platinum used in fuel cells per car have been falling for the last 10 years, Toyota's director of advanced technologies Craig Scott told Reuters, and are likely to drop further through technology or the use of alternative metals.

Also Read: Isro's space battery to power govt's e-vehicle drive

BOTTOM LINE

At the height of the platinum market around a decade ago, when prices soared above $2,000 an ounce, the metal accounted for nearly 30 percent of Anglo's core earnings (EBITDA).

That share has fallen to less than 10 percent as the price of platinum has dropped to around $980 an ounce. Anglo has cut costs and reorganised its portfolio, selling off some assets including its Rustenburg platinum mine in South Africa, a flashpoint of union violence.

Cutifani said there were no plans to expand the platinum business. But it is a significant contributor to earnings that could boost shareholder returns in the event of a platinum rally.

That may be a long wait.

Frances Hudson, an investment director at Aberdeen Standard, which holds Anglo American shares, said the short-term consensus was for weak prices for most of the commodities the firm holds.

""But the company's portfolio of long-life and mainly low cost assets (diamonds, copper and platinum) should be fine on a three-to-five year outlook as supplies tighten,"" she said.

Anglo is focused in the meantime on raising the value of every ounce of platinum it mines. Investors are waiting to see whether it is a bet that pays off.

""The market believes in electric vehicles. The market is sceptical about fuel cells. Anglo could be right, but the market has yet to be convinced,"" said Chris LaFemina, a managing director specialised in mining at Jefferies bank.

(Additional reporting by Jan Harvey, Simon Jessop and Zandi Shabalala in London and Joe White in Detroit; Editing by Nick Tattersall and David Stamp)"
