Title,Article
Ravi Shastri wants India to be best fielding side at 2019 Cricket World Cup,"Ravi Shastri has laid emphasis on Indian cricket team’s fielding, highlighting it as the key area heading into the 2019 World Cup in England.

Shastri was appointed as India’s head coach following Anil Kumble’s controversial exit from the post owing to his “untenable” relationship with Virat Kohli.

(Read | Why MS Dhoni may not make it to 2019 Cricket World Cup)

While the team travelled to West Indies without a head coach, Shastri was welcomed back by Virat Kohli and Co. with a 3-0 Test series win in Sri Lanka.

“A disciplined approach is what counts. Look at this series. Barring the two no-balls in the second Test from Hardik and one in the third game from Mohammed Shami, we’ve not faltered. How many catches did we drop? Two? Going forward, that is what we need to avoid altogether,” he said.

(Read | Hardik Pandya happy to be even 10 per cent as good as Kapil Dev was for India)

“When the time comes for India to field a side for the 2019 50-over World Cup, we should have the best fielding XI in the world walking out. Only the fittest of the lot will survive and thrive going forward and that’s right up there in the list of priorities.”

Ravi Shastri feels his return to the Indian team has been smooth because he is in charge of the side he had put in place in his previous stint as team director.

“I said at the start of the (Sri Lanka) tour that I’m walking into a set-up which I had put in place and was working on until a year ago. That’s the same set-up I’ve walked back into,” said Ravi Shastri, who represented India in 80 Tests and 150 ODIs.

(Read | Upul Tharanga to lead Sri Lanka in ODI series against Indian cricket team)

“The trust is there. I can’t speak of the time when I wasn’t around, but what I can say with a sense of absolute belief is that nothing has changed between how things were during my last stint and now.”

With Shikhar Dhawan, Cheteshwar Pujara, Virat Kohli and Ajinkya Rahane all crossing the three-figure mark, KL Rahul slamming crucial fifties and the lower middle-order making those useful contributions in Sri Lanka, Shastri expects good days ahead during overseas tours.

“To be honest, with a batting unit like this one, the last thing you’d do is lose sleep. The core is such a good one and I’m glad the way Shikhar [Dhawan] is timing the ball. He’s got two big hundreds that have put him in the frame of mind that he loves to be in,” Shastri told a leading newspaper.

(Read | Seasoned India can now focus on bigger battles)

“Cheteshwar [Pujara] has been batting like a dream and he’s in a zone where he has set his targets going forward. And as if all of this wasn’t enough, you saw a knock of a different kind here the other day.

“Hardik Pandya’s century simply changed the course of an entire Test in less than an hour. We were thinking of going ahead by 60 to 80 runs when the tail was batting and look where we ended. Five batsmen got a hundred in this series and close to 10 cricketers got 50-plus scores, which is a first in Test cricket for any team,” he added.

(Read | India vs Sri Lanka ODIs: Upul Tharanga pleads for patience after Test debacle)

Shastri also heaped praise on Hardik Pandya and Wriddhiman Saha: “Hardik may still be new to Test cricket but he’s showing what a quick learner he is. As Virat [Kohli] said, he’s been the biggest positive of this series. He was working on the cutters for the first time on the morning of the day’s play with Arun and he didn’t flinch once in going out and testing it the same day.

“As for Saha, he has been excellent, be it his wicketkeeping, batting or catching. He had always been an unwavering guy in domestic cricket for years and that hard work is showing. He’s grown so much in confidence and remember, he’s walking into MS’ [Dhoni] shoes. He’s done phenomenally well to grow out of that shadow.”"
"Breast cancer may kill 76,000 Indian women every year by 2020","Lack of early diagnosis of breast cancer may kill 76,000 Indian women a year by 2020, says a study, one of whose researchers is of Indian origin.

One of the most commonly diagnosed type of cancers among women in India, breast cancer claimed 70,218 lives in 2012, the study published in the Journal of Business Research showed. It also revealed that the average age of death from the disease has shifted from 50 years to 30 years.

The magnitude of the problem is enormous and has major policy implications for the Indian government, said Vijay Pereira, Associate Dean (Research) at the University of Wollongong in Dubai. Pereira said there were complex challenges at national, state and community levels.

“What is clear is that healthcare at state-level must transform to deliver quality care and awareness,” Pereira said. The researchers found lack of awareness about self-examination and cultural barriers played a major role. Women sought medical care extremely late. Women do not get access to health services and are reluctant to consult male doctors, neglecting their health due to family obligations. They are over-dependent on other family members. All of these cause delay in diagnosis, the researchers said.

Thus, educating Indian men about the significance of early diagnosis for breast cancer, could be the key to halt the disease which is turning into an epidemic, the researchers suggested. “India is still a patriarchal society. Although women are now in responsible jobs and earning for their families, it’s the men who are the head of the household,” said Judith Fletcher-Brown, from the University of Portsmouth in England.

Even educated professional women do not discuss private matters about their bodies with their husbands, fathers or brothers. So it’s essential to direct health messages towards men, Fletcher-Brown said.

Rapid economic development and greater urbanisation are also responsible for the rise in breast cancer rates, the researchers noted. Besides, women tend to have children at a later age and breast feeding is less, which increases their chances of developing the disease. Working women in urban India often have a more western diet leading to obesity. That also increases the risk. The study said community health nurses had the greatest impact in raising awareness of early breast cancer symptoms. In addition, schools and media were also found to be good channels through which awareness could be raised in young women.

Follow @htlifeandstyle for more"
Rohit Sharma aims to continue be a nightmare for Sri Lanka in ODI cricket series,"No one knows how to deflate the Sri Lankans more than Rohit Sharma. He may be in and out of the Test team but in ODIs Rohit has been quite frankly, a nightmare for Sri Lanka in recent times. Holder of the highest ODI score 264 that came against Sri Lanka, Rohit couldn’t have got a more familiar opponent to make his comeback from a thigh injury.

Elevation to vice-captaincy means this series is going to be more special for Rohit. “It is a huge honour to be appointed as the vice-captain. Ten years ago, I was only thinking of playing for India. I am not thinking too much about it, I just want to enjoy the moment as of now. The last few years have been really good, we just need to continue that,” said Rohit.

READ | Ravi Shastri wants India to be best fielding side at 2019 Cricket World Cup

Captaincy comes naturally to Rohit. Three titles in the Indian Premier League apart from an exemplary record was reason enough for the selectors to consider him for the job. International cricket is a different ball game compared to the IPL, but Rohit said “the excitement and the energy level is the same”.

“So yes, nothing changes too much. I am the vice-captain here, there I was the captain, so I was more in front. Here I have to play a little behind-the-scene role.”

READ | Upul Tharanga to lead Sri Lanka in ODI series against Indian cricket team

The one-day series starts in the backdrop of the humiliating whitewashed inflicted by India. But Sri Lanka will take some confidence from their upset win over India in the Champions Trophy when they chased down a 300-plus total.

READ | India vs Sri Lanka ODIs: Upul Tharanga pleads for patience after Test debacle

“I have no idea about the squad for this ODI series but what they had in the Champions Trophy was a very good side. They beat us quite comfortably. So you know in one day cricket they are a very good team. We just got to do what we have been doing for the past few years,” said Rohit.

“As far as I am concerned we need to look at what we need to do as a team and bring out the best on the field. That’s what we did in the recent Test series. We just focused on what we need to do as a group and that has always been the talk. We need to focus on our ability and strengths.”

Having recently completed 10 years in international cricket, Rohit said it’s been a roller-coaster ride. “Those 10 years have gone really fast. It has been up and down but that’s how it is for any sportsman. You get to learn a lot more when you have your ups and downs. It teaches you a lot many things,” he said.

READ | Virat Kohli says August 15 is extra special for him. Here’s why

“Before those ten years, I never thought I would play for India. I was just enjoying my cricket, playing for my school, for Mumbai. (Only) When I started playing Ranji Trophy, I realised that I have that goal at which I can look at. And once I was picked up for Indian team, there was no looking back. Even now when I stand here being the vice-captain, it feels pretty good. There’s lot more to do and I look forward to it.”

At the same time, he has had to cope with the disappointment of not being able to cement his place in the Test team. “Nobody likes to sit out. But again, it all depends on the team dynamics, what the captain and the coach wants to play. And you got to accept the fact and move forward. It was great to watch everyone displaying that skill. (Winning) 3-0 outside India is a great achievement.”"
"Kuldeep Yadav in mix for 2019 ICC World Cup spot, says chief selector MSK Prasad","The core group of Indian team management wants to have a proper plan in place for young chinaman Kuldeep Yadav, who is expected to play a big role for the national team across formats in the long run.

With Ravichandran Ashwin and Ravindra Jadeja plying their trade in English county circuit, young Kuldeep will lead the spin attack against Sri Lanka.

However skipper Virat Kohli, chief coach Ravi Shastri and chairman of selectors Ravi Shastri want to handle the UP youngster with a lot of care.

Kuldeep is certainly in mix for the 2019 World Cup in England.

READ | Hardik Pandya happy to be even 10 per cent as good as Kapil Dev was for India

“We have a keen eye on both short and long term objectives. We cannot ignore the forthcoming home cycle wherein India will play Australia and New Zealand in limited- overs’ cricket and we also have to build for England in 2019,” Prasad told mediapersons yesterday.

“We wanted to start this process with the limited-overs’ tour to West Indies’ itself, but we couldn’t do it because of the short change-around time after the Champions Trophy. We had to send the same team to the Caribbean as we did to England,” Prasad added.

While limited overs cricket can’t be ignored, India’s gruelling away season will kickstart with a tour to South Africa in early 2018.

READ | Indian cricket team hoists tricolour in Kandy to celebrate Independence Day | Video

“We also have to consider Test cricket and India have three tough challenges in South Africa, England and Australia in 2018. We have to prepare for all formats simultaneously, and in hindsight, this county stint for our senior bowlers opens a great window of opportunity for us,” Prasad added.

While he is still the third choice spinner in Test squad, Kuldeep seems to have made it his own after some good performances.

“A chinaman bowler is slightly different from what people usually face so they can make an impact longer than other bowlers. But you still have to keep working on your game, keep finding ways to make batsmen think twice and take those wickets, giving the team breakthroughs.

READ | Virender Sehwag, R Ashwin lead Independence Day wishes by cricketers on Twitter

Kohli has a word of caution for Kuldeep -- work hard in order to maintain consistency in form and top level fitness.

“Kuldeep will have to keep working hard on his game. He is a great talent, we know that, but to keep that fitness and form going, he has to keep working hard. He has the desire to do so. We have faith in him, and he has delivered every time he has played. So it is a great sign for him,” said the skipper."
"Chelsea vs Burnley, Premier League 2017/18, full football score","Burnley pulled off a huge upset as they defeated defending champions Chelsea in the first game of their new Premier League campaign on Saturday. Sam Vokes starred for Burnley with two of his side’s three goals before half-time, Stephen Ward also netting in between the Wales striker’s double. Get full football score from Chelsea vs Burnley, Premier League here.

If you can’t see the widgets properly, click here"
India vs Sri Lanka 2017 News and Updates at Hindustan Times,"Aug 15, 2017 22:40

Hardik Pandya reveals he will be happy if he can become even ten per cent of the player Kapil Dev was for India, saying he simply wants to be the best he can be. read more"
THE CLASS OF 2018: Why doesn't this co-ed school have any girl students?,"The Government Co-education Secondary School in Naya Bazaar, is 'co-ed' only in name. In the seven years since the school moved into its new building, a girl is yet to seek admission.

Co-education schools are a rarity in Delhi's government school system, accounting for a mere 17 per cent of the city's 1,009 schools in 2015. Most of the remaining schools are run in two shifts, where girls study in the morning and boys in the afternoon.

Educationists are increasingly convinced of the importance of boys and girls studying together from a young age; particularly in a city like Delhi where violence against women is common, and most young men and women live in gender-segregated spaces.

""Any project where homogeneity is brought about artificially can never prepare students for challenges they will face in society,"" said Minati Panda, chairperson of Zakir Husain Center for Educational Studies at the Jawaharlal Nehru University.

So why don't girls study at the Naya Bazaar school?

The history of this school building offers an insight into not just the constraints of Delhi's school system, but a perspective on how girls and young women are pushed out of public spaces almost by default.

The building at Naya Bazaar began as a government girls school. But in 2004, the building was closed for repairs and the students and staff were shifted to the Sarvodaya Kanya Vidyalaya in Pul Bangash.

In 2009, a co-ed school in the Bara Hindu Rao neighbourhood had to be moved to make way for flyover.

""I am not sure what happened to the girl students in Bara Hindu Rao, but when I came here in 2012, the school already had only boys as students,"" said Gauri Shankar, the principal at Naya Bazaar.

The gender balance, Shankar said is further skewed by the fact that three of Naya Bazaar's feeder schools are boys school at the primary level. ""We are ready to give admission to girls but most of them go to Pul Bangash school as this school is in the middle of market area.""

Now, no parent wants their girls to go to a school full of boys.

""I didn't know if Rahul's school was co-ed,"" said Pawan Gautam, whose son studies at the school, ""There are no girls in his school, so I didn't want to send my daughters there.""

Only 17% of Delhi's 1009 are co-educational by default, rather than design.

Why so many single-sex schools?

Most of Delhi's schools are single sex by default rather than design. The primary reason, officials from the department of education said, is this allows the department to run two schools from the same building.

""The population of Delhi has increased many-fold, and we have to create opportunities for these students,"" said Saumya Gupta, director education. ""Girls go the morning shift as you can't ask parents to send girls in the evening, and boys come in the evening.""

Officials said many parents prefer to send their daughters to a girls' school.

""Most of our schools are decades old and maybe at that time locals demanded their daughters to be sent to a girls school,"" said an official, who did not wish to be named. ""Such local conditions still exist in certain areas although we need to break these stereotypes.""

Yet, graduates from these schools wish for a more liberal education.

Amit Kumar, who studied at Government Boys Senior Secondary School, Sangam Vihar, said he struggled to adjust at a co-ed college.

""I had almost negligible interaction with girls,"" he said. ""When I moved to college, it was a different world where boys and girls studied in the same classroom.""

""It was difficult to adjust and interact with the girls. Maybe if I was from a co-ed school it would have been easier to adjust.""

Experts agree.

""It is desirable to have co-education so that students can learn to engage with the opposite sex in a natural way while they are growing up,"" said Poonam Batra, a professor at the Delhi University's education department.

A 2014 study published in the journal 'Sex Roles', found that teachers in single-sex school tended to rationalise segregated schools on the basis that girls and boys learn differently, thereby perpetuating gender stereotypes.

The Department of Education insists that change is around the corner.

""We are opening 16 new schools in this academic session and all are co-ed,"" said Gupta, the education director.

But for now, Naya Bazar, the co-ed school that never had any girls, is being turned into a boys school, perpetuating a cycle that everyone in the department says they want to break out of."
"Sri Lanka’s spineless show vs India leaves players, Board with mountain to climb","The Test series win against Australia last year could have ushered in a new era. The losses to South Africa could’ve been due to lack of experience. The Test loss to Bangladesh could’ve been due to fatigue.

But the alarm bells were ringing when the Angelo Mathews-led Sri Lanka were beaten by the unfancied Scotland just ahead of the ICC Champions Trophy. Sri Lanka’s misery continued during the tournament when they lost to eventual champions Pakistan from a winning position.

This wasn’t all as Sri Lanka, so strong at home, couldn’t stop Zimbabwe from registering their first-ever ODI series win overseas. Prior to this, Zimbabwe had never beaten Sri Lanka in an ODI in their backyard.

READ | Apologetic Sri Lanka skipper Dinesh Chandimal dubs loss to India ‘worst series ever’

Now, Virat Kohli’s men have rubbed salt into Sri Lanka’s wounds with a 3-0 Test series thrashing. Agreed Rangana Herath, Asela Gunaratne, Nuwan Pradeep and Suranga Lakmal suffered injuries, and skipper Dinesh Chandimal missed the first Test due to illness, but the will to fight was only seen during the second innings of the Colombo Test, when Dimuth Karunaratne’s and Kusal Mendis’ 191-run stand – after being asked to follow-on – briefly revived hopes of a fightback.

‘Ranji team can beat this side’

Former India skipper Sunil Gavaskar didn’t mince words when he said Test was a ‘lofty’ word to use for the lopsided series.

“To be frank, you can’t call this a Test match. The Indian team hasn’t been tested at all,” Gavaskar said in the post-match discussion.

“A Ranji team in the elite status can beat this Sri Lankan side.”

READ | India sweep Sri Lanka 3-0, complete historic away series win: Video highlights

The current state of Sri Lankan cricket is such that it won’t be surprising if experts are dismissive.

Having a bad day or a bad game is one thing but when a top team starts losing to lower-ranked sides, and its batsmen and bowlers show no inclination to fight as seen in the India series, something is seriously wrong.

‘All about poor administration’

Sri Lanka’s World Cup-winning skipper Arjuna Ranatunga has expressed anger at how the island’s cricket is administered and said he has stopped watching the team’s international fixtures.

“Sri Lanka cricket and the manner in which it is being administered is so disgusting I don’t watch our national cricket team anymore,” Ranatunga said.

A year ago, Angelo Mathews has demanded improvement in the Sri Lankan cricket system. He had even termed some of the team’s performances as ‘humiliating’.

READ | Virat Kohli and Co. make history with first ever overseas whitewash Test series victory

“The coaches at the back-end have a big job to do,” he said. “If we don’t have bowlers, we have to know how to produce them.”

There will be introspection in the Sri Lanka dressing room after the loss to India, but drastic changes may be beyond the Board. However, that is what Sri Lankan cricket fans will be rooting for."
"Independence Day 2017: Best quotes, SMSes, wishes to share on WhatsApp and Facebook","Every year, August 15 serves as a great reminder of the sacrifices made by innumerable freedom fighters and protesters. Seven decades later, India has come a long way in terms of progress. Let’s celebrate this Independence Day with some great quotes:

1) We celebrate bravery of our ancestors and their gift of freedom. Long may our flag wave! Happy Independence Day!

2) Let’s take this day to think about of our past and resolve to build a better future for our country. Wishing you a Happy Independence Day!

3) “Our nation is like a tree of which the original trunk is swarajya and the branches are swadeshi and boycott.” — Bal Gandhar Tilak.

4) Freedom in our mind, faith in the words, pride in our souls. Let’s salute the great men and women who made this possible. Happy Independence Day!

5) Ask not what your country can do for you. Ask what you can do for your country! Happy Independence Day!

Here are some Independence Day images you can share on social media:

Follow @htlifeandstyle for more"
CBSE Class 10 Compartment result 2017: Here’s how to check,"The Central Board Of Secondary Education (CBSE) is expected to declare the results of Secondary School Certificate or Class 10 (compartmental) examination, 2017 on its official result website this week.

In a notification issued earlier, the CBSE said the probable date for the declaration of results for Class 10 compartmental exam was the third week of August. The board, however, did not announce any exact date and said: “no enquiries about the actual date of result will be attended to”.

Steps to check CBSE Class 10 compartment exam 2017 result:

1) Visit CBSE’s official result website

2) Click on link for compartment/improvement exam result-2017 for Class-X

3) Enter required details as given on your admit card (like roll number)

4) Click on submit

5) Result will be displayed on the screen

6) Take a print out and download the same on your computer

The CBSE Class 10 compartmental exams were held from July 17 to July 24. In addition to theory papers, the board also conducted practical exams.

The education board declared its Class 10 or Secondary School Certificate (SSC) main exam results on June 3 this year.

The overall pass percentage fell to 90.95% from 96.21% in 2016, registering a dip of over 5%. A total of 16,67,573 candidates appeared for the main exam this year. About 7,81,463 students appeared in CBSE’s school-based exam and 8,86,506 students took the board-based exam."
How hard is it to find a good government school in your neighbourhood,"Based on the, this is what the map looks like.

Number of students enrolled in the school"
"In pics: Smart comb, hair growth helmet, breast pumps at CES 2017","How books, toys and learning activities at home can boost your child’s brain power

Aug 16, 2017 16:42 IST"
