Title,Article
"In 2015, 2 children below age 5 died every minute in India","Nearly 1.08 million Indian children under the age of five years died in 2015–that’s 2,959 deaths every day or two each minute–many of them of causes that were preventable and treatable.

India’s under-five mortality rate (U5MR)–the probability that a child born in a specific year will die before reaching the age of five–was reported to be 43 deaths per 1,000 live births in 2015 in the Sample Registration System Statistical Report 2015, the latest available data.

Child mortality is considered one of the bellwethers of the health and well-being of a nation because factors that impact child mortality also affect the health of entire populations. During 2015-16, when the economy was scaling the growth charts by recording a best-in-five-years growth rate of 7.6%, India’s U5MR of 43 in 2015 placed it the worst among BRICS countries and the third worst in South Asia, despite a 26-point improvement from a rate of 69 in 2008.

Some Indian states such as Assam and Madhya Pradesh recorded worse U5MR than Ghana in sub-Saharan Africa.

Most under-five deaths were attributed to neonatal causes (53%), pneumonia (15%), diarrhoeal diseases (12%), measles (3%) and injuries (3%), the Ministry of Health and Family Welfare’s Annual Report 2016-17 said, citing World Health Organization data from 2012.

“More than two-thirds of infants die in the very first month. About 90% of these deaths are due to easily preventable causes like pneumonia and diarrhoea,” according to Save the Children.

More under-five children died in rural areas (48 deaths per 1,000 live births) than in cities (28), data show.

The government has identified 209 low-performing districts as priority areas which would be closely monitored while receiving higher per capita funding, technical support and help in adopting innovative approaches, Faggan Singh Kulaste, minister of state in the Ministry of Health and Family Welfare, told the Lok Sabha (lower house of parliament) in a reply on July 28, 2017.

The minister outlined government initiatives to reduce child mortality under the National Health Mission such as the Janani Suraksha Yojana (safe motherhood scheme) and the Janani Shishu Suraksha Karyakaram (mother and child care programme), which entitle pregnant women who deliver in public health institutions to free ante-natal check-ups, post-natal care and treatment for sick infants for up to one year of age. Special neonatal care units have also been set up in government facilities, he said.

Under the universal immunisation programme, the government provides free vaccination against life-threatening diseases such as tuberculosis, polio, tetanus and measles, the reply stated.

U5MR: Assam, Madhya Pradesh worst in India and as bad as Ghana in sub-Saharan Africa

Despite these government programmes, the data paint a worrying picture.

Among the 22 Indian states and union territories (UTs) with a population of 10 million or more, Kerala reported the lowest U5MR at 13, while Assam and Madhya Pradesh reported the highest at 62.

Only four of these states–Madhya Pradesh, Odisha, Himachal Pradesh and Punjab–have lower female U5MR than male.

India’s sex ratio at birth–the number of girl children born per 1,000 male children–was 903 girls per 1,000 boys in 2015, IndiaSpend reported on August 2, 2017. This was worse than Pakistan (920) and Nepal (939).

The Millennium Development Goal (MDG)-4 (to reduce child mortality) was to bring U5MR down to 42 deaths per 1,000 live births by 2015, the Lok Sabha reply stated.

The Sustainable Development Goal, which replaced MDG-4 from January 2016 onwards, is a U5MR of 25 deaths per 1,000 live births for all countries by 2030.

Data show that 14 of the 22 larger Indian states have attained MDG-4 (<42 deaths per 1,000 live births) and four states have surpassed the SDGs, namely Maharashtra (24), Delhi (20), Tamil Nadu (20) and Kerala (13).

This wide variance across states is due to systemic but potentially remediable differences in one or more aspects of healthcare facilities across states, as well as other social and cultural factors such as women’s education and sanitation.

India sluggish in tackling child deaths despite fast economic growth, says UNICEF

About 5.9 million children under the age of five died worldwide in 2015–16,000 every day–due to diseases that are preventable or treatable, such as pneumonia, diarrhoea, malaria, meningitis, tetanus, measles, sepsis and AIDS, the United Nations Children’s Fund (UNICEF) said in its The State of The World’s Children report for 2016.

The report said countries such as India and Nigeria are “sluggish” in reducing child mortality, despite leading on the economic growth front globally. This indicates that “economic growth does not guarantee improved child survival, and a country’s income need not hinder progress”, it noted.

South Asia and sub-Saharan Africa accounted for 80% of under-five deaths in 2015, nearly half of which took place in the Democratic Republic of the Congo, Ethiopia, India, Nigeria and Pakistan, the report said.

India reported the highest U5MR among BRICS countries at 43 deaths per 1,000 live births in 2015, followed by South Africa (41), Brazil (16), China (11) and Russia (10).

Among its South Asian neighbours, India fared better only than Afghanistan (91) and Pakistan (81). Maldives reported the lowest U5MR at nine deaths per 1,000 live births, followed by Sri Lanka (10), Bhutan (33), Nepal (36) and Bangladesh (38).

“More than three-fourth of under-five-deaths in India are due to neonatal causes, pneumonia and diarrhoea,” Rajesh Khanna, senior technical advisor with child rights NGO Save the Children India, told IndiaSpend. Babies with birth asphyxia (deprivation of oxygen during delivery that can lead to lifelong brain damage and death), preterm babies, babies delivered at home, babies of poor and/or migrant families, and malnourished children are most vulnerable, he said.

Khanna said although interventions to prevent and treat childhood diseases are available, there are many challenges: Lack of knowledge and awareness about these solutions among communities, inadequate availability and access to these interventions within the public health system, and patchy quality of services provided for these interventions. “All these challenges are more pronounced for the marginalised and underprivileged population which has the maximum burden of child deaths,” he said.

Khanna said all pregnant mothers must be provided with proper antenatal care services and nutritional supplements. “Institutional delivery or delivery by skilled personnel, early and exclusive breastfeeding for all babies, access to universal immunisation and hygiene must be ensured” in order to reduce infant mortality, he said.

(Published in arrangement with IndiaSpend.)"
"Arsenal vs Leicester City, Premier League 2017-18: Full highlights, scores","Arsenal staged a dramatic fightback to kick off the new Premier League season with a thrilling 4-3 victory against Leicester on Friday. Arsene Wenger’s side scored twice in the last 10 minutes as Aaron Ramsey equalised before Olivier Giroud bagged the winner at the Emirates Stadium. Alexandre Lacazette gave Arsenal an early lead before Shinji Okazaki and Jamie Vardy put Leicester ahead. Danny Welbeck levelled for Arsenal, but Vardy’s second goal looked to have won it for Leicester until the sensational finale. Get full football score and highlights from Arsenal vs Leicester City, Premier League 2017-18 here

If you can’t see the widgets properly, click here"
Play with the Swachh Bharat rankings and make your city “cleaner”,"Play with the Swachh Bharat rankings and make your city “cleaner”

The government’s rankings of the cleanest cities in the country, released last week as part of the Swachh Bharat campaign, had some surprising outcomes. “Is Varanasi really cleaner than Bhubaneswar?” my editor asked in an article earlier this week. Others have asked some version of the same question: How were these rankings produced? And is the methodology sound? The rankings consider three broad categories of data: documentation provided by civic authorities, feedback from citizens, and independent ground assessments. Intuitively, one might think that the ground assessments — which involve unbiased people observing how clean the city actually is — would be the most important source of data. But the way the Ministry of Urban Development calculated the rankings, ground assessments are the least important. Instead, 45% of the ranking comes from documentation provided by the cities, 30% comes from citizen feedback, and the remaining 25% is derived from the ground assessments. What if these categories were weighted differently? We’ve built a tool that lets you find out. Adjust the weights of the three categories below, and see how the rankings change.

Use the white handles to adjust the weights. Documentation Ground assessment Citizen feedback

Or, use these buttons.

Reset Documentation only Ground assessment only Citizen feedback only All three are equal

View chart City Your rank Gov't rank Change in rank Each dot represents a city or civic authority. Hover over a dot for details. Scores get higher with your weights or lower with your weights.

So what if we scrap the documentation and citizen feedback, instead relying entirely on the ground assessment? Bhopal rises to the top of the list, while Indore falls to 11th. Varanasi actually improves, rising from 32nd to 28th, while Bhubaneswar improves from 94th to 70th, still far behind. If we only consider citizen feedback, Neemuch, Madhya Pradesh, rises from 136th to the top of the charts. Apparently, Neemuch’s citizens think their city is very clean, even if the government and independent assessors disagree. And if only documentation matters, Chandigarh becomes the country’s cleanest city, rising from its former rank of 11th. Why did the government choose to weight documentation so heavily? “In initial years, you have to push municipalities to do work,” said Quality Council of India’s Anay Agarwal, who directed the survey project. “Even if results are not visible on the ground, they have to be awarded — in terms of higher ranking — for starting the work.“ In other words, by weighting the rankings as it does, the government wants to encourage cities to demonstrate an institutional commitment to staying clean. By this thinking, cities that provide documentation of their clean-up efforts demonstrate a commitment to the process, even if the results have yet to show up on the ground. Samarth Bansal contributed to this article."
"Born on August 15, 1947: The search for Delhi’s Midnight’s Children","The house stood at the dead-end of a narrow, serpentine alley in Khair village. We knocked on the wooden gate.

It was the third day of our search for Delhi’s Midnight’s Children – born on the August 15, 1947. It had brought us to a nondescript village on the south-western periphery, around 30 kilometres from the city centre.

A young woman peeped through the gap between the doors. “I am looking for Shish Ramji? Is he your relative?” we asked.

“Why are you enquiring about him?” she replied, with a question.

“We are looking for a girl child who was born on August 15, 1947 in Khair village. Her father’s name was Shish Ram as per government records.”

“Shish Ram was my husband’s grandfather but he died long ago,” she said. “My father-in-law would be able to tell you something. He lives outside the village next to the pond near the bus stand. His name is Azad Singh. He retired from DDA. Ask anyone there, they will tell you the exact location.”

But the meeting with Azad Singh did not yield much.

“Yes, Laxmi (name changed) was my elder sister who was born on August 15 in 1947 but she died a few years later. Then I was born in 1950,” he told us.

Before meeting Singh, we had visited 25 addresses, taken down on a notebook from the municipal records, but there had been no breakthrough.

The only exception was Gurgaon-based archaeologist and author Himanshu Prabha Ray. We located Ray through the internet. She was born in an Army Hospital in Delhi Cantonment on the day India attained freedom.

Birth registration in Delhi

Before a proper mechanism to register birth and death could be evolved, it was the duty of the chowkidar (watchman) to inform the police station concerned or the tehsil about these developments in their respective areas or a midwife used to record them. Hospitals and maternity centres would register births and deaths handled by them. This system continued for decades even after the independence.

“With no organized public transport, it was not possible for chowkidars to go to police station or tehsil office to record birth. Owning a bicycle was a big deal. Therefore, the chowkidars reported birth/death once in a week or 10 days by which time some of the dates slipped his memory. So, it was completely dependent on the chowkidars’ memory,” said MS Shehrawat, 69, Advisor (Public Relations) of New Delhi Municipal Council (NDMC). The oldest birth listed in council’s record is from 1917.

Tracking down 70-year-old addresses

According to government data, 132 births (including 62 girls) were registered in Delhi on August 15, 1947. The population of Delhi was around seven lakh at that time. Apart from the New Delhi Municipal Council, set up in 1927, to manage civic affairs of the new capital ‘New Delhi’, there were seven municipal sub-committees looking after smaller regions such as Delhi Fort area, Civil Lines, Shahdara, Mehrauli, Narela, West Delhi, and Najafgarh.

An undated photograph of Walled City (PIB)

As per the documents, at least 46 children were born in the Walled City on Independence Day.

We thought tracking down these 46 would be easier because in Old Delhi had stronger community ties unlike the urban population in gated colonies in other parts of the city.

However, the records mentioned only the father’s name and the place of birth – hospital or locality.

A city transformed

Even for someone born and brought up in the Old City, the addresses are hard to track. In the past seven decades, not just the demographics, the topography has changed as well. For instance, Pahari Bhojla near Turkman Gate used to have ‘13XX’ series for house numbers around 1947 as per the municipal records, but these now begin with ‘21XX’.

Similarly, serial numbers in most localities in Shahjahanabad such as Kucha Sohan Lal (Sita Ram Bazaar), Suiwalan, Gali Gadhiya (Kalan Mahal), Shahganj (Ajmeri Gate-GB Road), Kucha Dakhni Rai (Darya Ganj), and Kucha Pandit (Lal Quan) have also been revised.

“Before the formation of Municipal Corporation of Delhi (MCD) in 1958, there were 10 different notified committees functioning for different areas in the city. They have their own arrangement for allocating house numbers. When the MCD came into being, house numbers were changed. This was primarily for property tax, which required standardization of house numbers,” said MC Sharma, former Delhi Mayor.

Haji Mian Faiyazuddin, 79, who runs a guest house in Jama Masjid area, said his residence number in Kucha Meer Ashiq was also changed twice in 1950s.

Another major hurdle was that several families have shifted outside the Walled City. Even their neighbours did not know their whereabouts. Their properties have changed hands twice or thrice like the Saxenas’ of Kucha Sohan Lal in Bazaar Sita Ram, famous for beautifully carved facades of palatial mansions and family of kulfi makers.

The Saxena family, which used to reside in a part of the haveli, had a baby boy on August 15.

“The family sold the house to its previous owner long ago, I don’t remember when. They had two-three children whose name I have also forgotten. No one from the family has visited this place for years,” said RN Saxena, 87, a resident of Kucha Sohan Lal.

In the last 70 years, new constructions --transformation of single storey structures and mansions into mutli-storeyed apartments – has taken its toll on landscape and livability index of Shahajananad.

Extinction of ‘Jalal Manzil’ (in Gali Wakil Abdul Aziz, Kucha Pandit) is one such example. The municipal record has an entry of a birth on Independence Day at this address.

“There were hardly 10 houses in this street. At present, there are more than 100. I have not heard of Jalal Manzil ever though I am born and brought up here,” said Mohd Farid, 45, who runs a salon in Kucha Pandit.

In spite of this, we tracked down Saifuddin Azad at Basti Harphool Singh in Sadar Bazar. His son, Moinuddin, said that he had died around 18 years ago.

When our efforts in the Walled City failing to bear fruits, we tried out luck in the villages of Delhi in south-west and north-west districts.

Makeover of villages

Soon, we realized our folly.

Mubasi Ram, 90, a resident of Mukundpur, said the villages had started changing rapidly by the end of 1990s.

Flashy multi-storeyed houses have come up on agricultural land in Bhalaswa, Pitampura, Mukundpur, Rithala, and adjoining areas. Several old timers, who could not afford a house in the city like Ram, moved out and built their houses on the outskirts. The villages have now become home to migrants from eastern Uttar Pradesh and Bihar.

“The landlords built plush bungalows but people like me built houses outside the village limit,” Ram said.

Mubasi Ram (HT Photo)

Our next stop was Najafgarh sub-division in south-west district.

The cluster of villages in Najafgarh – Khair, Mitraon, Dhansa, Jaffarpur Kalan, Ghalibpur, Dhichaon Kalan, and others – retain families who have been living here for generations.

As per the government record, one Bihari Lal family had a boy on Independence Day in Mitraon, 70 years ago. A village elder directed us to retired squadron leader Shree Bhagwan, whose father’s name was Bihari Lal.

According to the villagers, there were two men in Mitraon, who would go by the same name around 1947 and Bhagwan’s father had a child around that time. His father, we were told, had fought in Second World War for the British.

Shree Bhagwan with his wife Santra Devi in 1969. (HT PHOTO)

Bhagwan was bit surprised and curious when told about our quest. “I don’t know about my date of birth in government record. I was admitted in the village school by my uncle in 1954, where the birth date was registered as June 6, 1947. At that time, no one would bother to check the municipal records,” said Bhagwan, who is the eldest among five siblings.

Lilu Ram (Vipin Kumar/HT PHOTO)

Later, we met Lilu Ram, a tailor in Bijwasan village, whose date of birth is also August 15, 1947 in the municipal record. He, too, expressed ignorance. “My birth date in school had been registered as January 26, 1947. The record, however, correctly identifies my father as Kishori,” Ram said.

Record mismatch

A senior municipal corporation officer, who is privy to the birth and death registration, said this ‘mismatch’ might be attributed to two factors -- system for birth registration prevailing during that period and the unwillingness of parents to register the birth of their children.

When the registration of births or deaths was made mandatory in 1969, the process was streamlined as per provisions of registration of Births and Deaths Act.

“Earlier, parents and relatives would not take it seriously and birth date was casually mentioned while admitting children in schools. But the fact is that births and deaths are being registered by all municipalities in Delhi since 1850s. We have records dating back to 1869,” he said. “Do you want to see them?”

Maybe some other time."
"Maharashtra: Two men fall into a 2000-feet deep valley, video captures fall","Two revellers died after falling into a 2,000 feet deep valley in Amboli Ghat in Sindhudurg district of Maharashtra.

A video of their fall has gone viral on social media, even as their bodies are yet to be recovered.

The incident took place at Kawale Saad Point in Amboli Ghat, a popular picnic point, on August 1, police said.

“Imran Garadi (26) and Pratap Rathod (21), who were part of a group of seven, fell into the valley. Their bodies are yet to be recovered,” said Sunil Dhanawade, Senior Police Inspector of Sawantwadi police station.

The victims and their friends worked at a poultry farm in Kolhapur, he said.

While others left the Kawale Saad Point after spending some time, Garadi and Rathod lingered back. When they didn’t join the group, their friends approached Sawantwadi police.

Police found out about the mishap from local people and shopkeepers, and roped in trekkers of Hill Riders Group to search for the duo.

The bodies were spotted down in the valley, but were yet to be recovered as heavy rain, water cascading down the hill and mist made the operation difficult, the officer said.

The video which is circulating on social media shows the two men, bottles in hand, climbing the fence around the edge of the valley and backtracking once or twice. Then the two are seen standing on the edge, beyond the fence, and slipping down."
Return to Harry Potter makes JK Rowling the world’s richest author in 2017,"We hope JK Rowling has reserved a particularly large vault at Gringotts bank. A bumper year for the Harry Potter novelist has magicked her back to the No 1 spot on Forbes’ list of the world’s richest authors, almost a decade after she last topped it.

Forbes – which uses a mix of print, ebook and audio sales data, television and film earnings and expert industry opinion to come up with its list – estimates that Rowling earned $95m in the year to 31 May. This figure is the equivalent of more than $180 per minute, thanks to the sensational sales of her play script, Harry Potter and the Cursed Child. When the Harry Potter sequel was released last summer, it sold more than 680,000 print copies in the UK in the first three days alone, and became the fastest selling book since the final Harry Potter novel.

Rowling’s earnings have been boosted with the release of Fantastic Beasts and Where to Find Them, a film set in the Harry Potter world for which she wrote the script, which was published in November. Her original publisher, Bloomsbury, has also been releasing illustrated versions of the Potter novels, to mark 20 years since the publication of the first in the series, Harry Potter and the Philosopher’s Stone.

Forbes producer Hayley Cuccinello admitted she was surprised to see Rowling’s earnings increase $76m over 12 months, attributing the surge to the recent successes from the Harry Potter franchise on stage and screen. “But unless Rowling releases another bestselling book in time for next year’s list,” said Cuccinello, “her earnings will almost certainly dip dramatically and she’ll likely relinquish first place.” Rowling, who last topped Forbes’ list in 2008, comes in this year $8m ahead of second-placed James Patterson, the thriller powerhouse who has headed the list for the last three years.

Follow @htlifeandstyle for more"
"India sweep Sri Lanka 3-0, complete historic away series win: Video highlights","India registered an emphatic win over clueless Sri Lanka, completing a historic 3-0 clean sweep of an away Test series. Bundled out for 135 in the first innings and made to follow on, Sri Lanka went down without a whimper to be all out for 181 at the Pallekele International Stadium on Monday. The innings win inside three days meant India have for the first time inflicted a whitewash in a three-Test series away from home. Watch match video highlights of India vs Sri Lanka, 3rd Test, Day 3 here. (HIGHLIGHTS | SCORECARD)

Virat Kohli and Co won the first Test in Galle by 304 runs and the second by an innings and 53 runs in Colombo."
