Title,Article
Independence Day 2017: How Akshay Kumar redefined patriotism for millennials,"When I was a child, Independence Day celebrations were never complete without watching Raajkumar-Nana Patekar-starrer Tiranga. If it was not the chest-thumping patriotism of Tiranga, it was Manoj ‘Bharat’ Kumar who was the staple of Independence Day.

The films would aim to put in touch with our ‘Indianness’ – with a generous dose of jingoism – mostly at the cost of western countries or the neighbours across the border. The western values were targeted and ‘mere desh ki dharti’ celebrated. Now, as we celebrate the 70 years of independence, the ethos have changed just like the mascot of nationalism in Indian cinema.

Today, the de facto face of Indian pride in cinema is Akshay Kumar and no film says it as clearly as his latest, Toilet Ek Prem Katha. The film sees him taking on the society, hand-me-down sanskriti and even his own family to fight for the right for proper sanitation.

Akshay Kumar in a still from Toilet Ek Prem Katha.

And that is the beauty and innovation of Akshay’s patriotism - he hails the Indian culture but fights the evils embedded within the society. Unlike a Bharat Kumar, Akshay’s characters do not demonise the western culture, instead they tell the world that when it comes to making India great – thoda hai, thode ki zaroorat hai.

So whether it is Airlift and India evacuating its people from a war-torn Kuwait or Rustom where even infidelity was due to a man’s love for his country, Akshay’s film has India and patriotism at its heart. His upcoming, Padman and Gold, will just take this narrative further.

Clearly cast differently from Manoj Kumar, Akshay’s characters do not wage war against enemies from outside, instead, they intend to cleanse our system from within. Akshay’s first in the series was OMG! Oh My God! (2012). Directed by Umesh Shukla, the film challenged blindly following traditions and beliefs deeply rooted in Indian culture. Though it targetted all religions, the movie faced flak for being “anti-Hindu”. This was much before the hyped Aamir Khan film, PK, saw the light of the day.

Akshay Kumar and Paresh Rawal in Oh My God!

Akshay began churning out films like Holiday (2014), Gabbar Is Back (2015), Baby (2015), Airlift and Rustom (2016) every year, along with the usual masala entertainers he is known for. Akshay took on everything from corruption to terrorism in these films to bring India the sweet climax it always desired but could not achieve in real life.

Unlike a Manoj Kumar, who had to explain his behaviour and attire at each step in Britain (Purab Aur Pashchim), when Akshay strolled through the lanes of London (Namastey London and Patiala House), he did so unapologetically. But whatever his character wears, he is rooted to his mitti.

Akshay Kumar and Katrina Kaif in a still from Namastey London.

Asked about Akshay’s brand of patriotism, film scholar and author of the book The Making of Don, Krishna Gopalan earlier told Hindustan Times, “If Manoj Kumar is Bharat Kumar, Akshay Kumar would be Mr Hindustan. The two actors are part of different eras. The India of Manoj Kumar was not as confident while the India of Akshay Kumar does not deal with any inferiority complex. Akshay has established with his films that it is cool to be an Indian.”

Much like his onscreen persona, Akshay in real life also promotes causes such as women learning self defense or starting an online portal for kin of soldiers killed in encounters.

Scriptwriter Jaideep Sahni, who has worked with Akshay in Neeraj Pandey’s Special 26, said, “I believe Akshay has a certain awareness and there is a social responsibility that he carries with his persona; he has even taken initiatives like promoting self-defense for women and saving the girl child.”

(This is an edited version of an article which was originally published in 2015)"
Photos: Independence Day 2017 from the Red Fort,"about the gallery

Prime Minister Narendra Modi addressed the Indian nation on the occasion of the country's 71st Independence Day, from the ramparts of the historic Red Fort in New Delhi."
Sharad Yadav in deal with Lalu to launch son from Bihar’s Madhepura in 2019?,"Janata Dal (United) Rajya Sabha MP Sharad Yadav, at odds with the official leadership of his party, is understood to have struck a deal with Rashtriya Janata Dal (RJD) president Lalu Prasad to field his son as the RJD candidate for the Madhepura seat in the next Lok Sabha poll.

Yadav has expressed his disagreement with JD (U) president Nitish Kumar’s decision last month to jettison the 20 month old grand alliance government in Bihar last month and to form a new one with the BJP, with himself has CM.

Much against the wishes of the JD (U)’s official leadership, Yadav has commenced a tour of Bihar on Thursday, dubbed the Jan Samvad Yatra, to “gauge public mood”. He has been sharing stage with RJD leaders and has been openly critical of the JD (U) leadership..

RJD insiders said Lalu had ‘agreed’ to field Sharad’s son Shantanu Bundela, a post graduate from London University, from Bihar as a quid pro quo for the JD (U) veteran’s ‘rebellion’ against Nitish Kumar. “The move suits both the Yadav stalwarts’ common agenda to keep CM Kumar on tenterhooks”, said a party leader.

However, no official confirmation of this move was available immediately.

Sharad’s supporters point out he had already been sidelined in the JD U). As such, getting for his son the Madhepura in north Bihar, which he had represented four times but, as JD (U) candidate, had lost to RJD’s Rajesh Ranjan aka Pappu Yadav, in 2014, sounded like a good deal.

Madhepura, a Yadav stronghold and land of BP Mandal, whose Mandal commission report formed the basis of job reservation for the other backward classes, in the early 1990s, is “available” in the sense that Pappu was expelled from RJD in May 2015 for questioning Lalu’s ‘family-centric’ politics.

The Madhepura seat was won by Sharad four times between 1991 and 2009, whereas Lalu, who broke away from the original Janata Dal, to form the RJD in July 1997, won the seat in 2004. In 2014, RJD’s Pappu Yadav won it, defeating JD (U)’s Sharad.

Despite being represented by political heavyweights, development has largely eluded Madhepura. An electric locomotive factory cleared during Lalu’s tenure as railway minister (2004-09) is still in a limbo. As its MP, Sharad has also faced flak for being away from the constituency and doing little for its development.

Old associates of Sharad are of the view that his ‘move’ to launch his son as RJD candidate was a gambit, considering sitting MP Pappu, who wields influence in Madhepura, had given no indication he was ready to give up the seat.

“Also, it won’t look very good for Sharad to launch his son in politics, considering he has always opposed dynastic politics”, said a Sharad supporter.

But at the veteran socialist leader hit Muzaffarpur district of north Bihar on Friday, his mood remained defiant. He accused party chief Nitish Kumar of intimidating his (Sharad’s) supporters. “They are handing out the threat of expulsion from the JD (U). This is intolerable”, he said."
Binge on these five super TV shows to escape the disaster that has been 2016,"Demonetisation. The US election outcome. Pollution. Leonard Cohen no more. Kashmir. Kanpur train derailing… And these are events that have occurred only over the last few weeks. The list gets longer and longer as you go back month-on-month to the disaster that has been 2016. So if you, like us, are feeling overwhelmed and need a different world to flee to – even if figuratively – here are five fantastic TV shows to binge-watch that promise an escape, alright. So get streaming and wake up (to a better reality, hopefully) when December ends.

Stranger Things

This Netflix-original that debuted in July this year, and which is possibly one of the best shows of 2016, is a sci-fi thriller with a liberal dose of mystery, drama and jumpy horror moments thrown in. But what makes Stranger Things so special – apart from the nail-biting plot and stellar cast – is the possibility it offers of an alternate universe where everything is just the same as yours, yet quite not so. The ‘Upside Down’ may not exactly be the kind of world you were hoping to escape to, but it is exciting no less.

Black Mirror

The third season of this highly acclaimed satirical sci-fi series released last month and the ratings have already been through the roof. Unlike the first two seasons that had three episodes each, this has six marvels, each with a different plot and cast. And each is a terrifying study into our world today – obsessed with technology, social media and keeping up appearances online – and the world we might be living in if we aren’t careful enough. As series creator Charlie Brooker said in a 2011 The Guardian interview when the show first premiered, “They’re all about the way we live now – and the way we might be living in 10 minutes’ time if we’re clumsy”.

The 100

Another science fiction, this one is a post-Apocalyptic action drama that rolls both utopia and dystopia into one action-packed, heart-thumping show. Ninety-seven years after a nuclear war wipes out civilisation on earth, a spaceship housing the last lone survivors starts running critically low on life support. So it sends back 100 juvenile lawbreakers back to earth in the hope of repopulating the planet. You’ll be making a mistake if you plan to leave the rest to imagination.

The Returned

Adapted from the 2012 French series Les Revenants, this supernatural thriller that released last year will give you all the creeps, and then some feels. A sleepy little mountain town is suddenly thrown into complete chaos when several locals come back from the dead. No, literally! As if resurrecting from their other worlds wasn’t enough, they also haven’t aged and are unaware of their own deaths. The shock of their families is only understandable, but what is difficult to comprehend are the strange happenings that begin to occur in the town following their arrival. [PS: You might want to watch the French original, as the English one was called off air abruptly. Talk of strange happenings!]

The Night Of

This crime thriller that premiered in August this year had even Shah Rukh Khan hooked, reportedly. Don’t be discouraged by the fact that there is not even a hint of any other world in this – it’s simply set in present-day New York. Sometimes, a different world can exist in your own mind, where the sequence of events is vastly different from what is presumed by others to have occurred – especially when there’s alcohol and a cocktail of drugs involved. This is what happens when after a night of partying with a female stranger, a man wakes up to find her stabbed to death and is charged with her murder. Add prevailing racial tensions in the mix, and you’ve a total mind-bender.

From HT Brunch, November 27

Follow us on twitter.com/HTBrunch

Connect with us on facebook.com/hindustantimesbrunch"
‘End of combustion engine-powered car’: Volvo to go all electric from 2019,"Geely-owned Volvo Car Group said on Wednesday all new models launched from 2019 will be fully electric or hybrids, spelling the eventual end to nearly a century of Volvos powered solely by the internal combustion engine.

The Gothenburg-based company will continue to produce pure combustion-engine Volvos from models launched before that date, but said it would introduce cars across its model line-up that ranged from fully electric cars to plug-in hybrids.

Volvo’s plans make it the first major traditional automaker to set a date for the complete phase-out of combustion-engine-only models though electrification has long been a buzzword across the industry and Elon Musk’s Tesla Motors has been a pure-play battery carmaker from day one.

“This announcement marks the end of the solely combustion engine-powered car,” Volvo Cars chief executive Hakan Samuelsson said in a statement.

Five new models set to be launched in 2019 through 2021 - three of them Volvos and two Polestar-branded - will all be fully or partially electric.

“These five cars will be supplemented by a range of petrol and diesel plug in hybrid and mild hybrid 48-volt options on all models,” Volvo said.

“This means that there will in future be no Volvo cars without an electric motor.”

Volvo has invested heavily in new models and plants since being bought by Zhejiang Geely Holding Group from Ford Motor Co. in 2010, establishing a niche in a premium auto market dominated by larger rivals such as Daimler’s Mercedes-Benz and BMW.

Part of its strategy has also been to embrace emerging technologies which allow higher performance electric vehicles as well as, eventually, self-driving cars.

Only last month, Volvo said it would reshape its Polestar business into a standalone brand, focused on high-performance electric cars aimed at competing with Tesla and the Mercedes AMG division.

Volvo has also taken steps towards an eventual listing, raising 5 billion crowns from Swedish institutional investors through the sale of newly issued preference shares last year, though the company has said no decision on an IPO has been made."
"Capital gains: How 1947 gave birth to a new identity, a new ambition, a new Delhi","On August 15, 1947, when India awoke to life and freedom, the land’s long-standing capital had already made its tryst with destiny.

The British partitioned India and the tremors of one of the largest migration in human history that displaced 15 million people were felt across the subcontinent. The mass churning also changed Delhi like never before.

Partition was announced on June 3, 1947. One-third of Delhi’s population — 329,000 of 900,000 — left for Pakistan. But another 495,000 Hindus and Sikhs from Western Punjab, Sindh and Northwest Frontier poured in almost simultaneously.

The city had a long history of suffering invasions. But this time it wasn’t about fighting foreign raiders. Delhi, now the capital of Independent India, had half a million of its own people at its doorstep. The challenge was to find homes and jobs for the newly arrived and assimilate their culture, language and beliefs.

But the indomitable Punjabi spirit refused to become a burden or even wait for acceptance. In no time, the new residents of Delhi had stamped their cultural and political dominance on the city. They became, as Ranjana Sengupta, the author of Delhi Metropolitan, puts it, “the last conquerors of Delhi.”

THE LANDSCAPE CHANGED

The bulk of these newcomers — 470,386 of the total 495,391 — were urban refugees from West Pakistan who naturally chose Delhi for better job prospects. But the walled city was already too crowded to accommodate so many. The Imperial New Delhi, then merely ten years old, could barely house the city’s government staff.

“Nowhere to go, we broke the lock of an empty house on Panchkuian Road and moved in temporarily. Later, we shifted to a place in Nizamuddin bought for Rs 6000,” said BJP politician Vijay Kumar Malhotra.

The refugees found shelter in camps, gurdwaras, temples, schools, even military barracks. The less fortunate settled for parks and pavements. Many built wooden shacks adjacent to Red Fort. “We called them the Gatta (cardboard) colonies,” recalled 88-year-old philanthropist OP Jain, who as an 18-year-old took charge of supplying food to the refugee camps.

Central Rehabilitation Advisor Mehar Chand Khanna showing an under-construction refugee quarter at Lajpat Nagar to British politician Aneurin Bevan on February 13, 1953. (HT Archives)

To accommodate the influx, 36 permanent rehabilitation colonies named after freedom fighters — Lajpat Nagar, Rajendra Nagar, Patel Nagar, Tilak Nagar, Malviya Nagar — came up on erstwhile farmland and ridge forests. “An allottee paid Rs 12.30 per month for 10 years for a house built on a 60-80 square yard plot,” recalled former DDA commissioner AK Jain.

From 198 sq km in 1951, Delhi’s urban area grew to 323 sq km in 1961. “But Nehru confessed in Parliament that this was an ad-hoc measure and cities had to be planned better. The Delhi Development and Municipal Acts were legislated in 1957 with the idea that the DDA would be the apex planner and developer and the MCD would service the city,” said Jain.

Private property developers such as DLF were brought in to established Model Town, Rajouri Garden, East of Kailash and Greater Kailash.

THE ENTERPRISE

Shelter secured, the refugees had to find a livelihood. Those who had some capital tried to set up businesses they used to run in Pakistan. But those who didn’t have the money tried whatever menial jobs came their way.

A spice trader from Sialkot, Dharam Pal Gulati (now 94) bought a horse cart from Chandni Chowk for R 650 and ferried passengers. Within a year, he saved R 9,700 and re-launched the family brand — Mahashiya Di Hatti (MDH) — from a kiosk in Karol Bagh.

“The refugees never said no to any opportunity. They sold their goods at virtually no profit but earned from the margin on baardana (cardboard), jute sacks and wooden cartons used in packaging,” said OP Jain.

Bhim Sen Puri, 95, the owner of Central New Agency, recalled how the hallowed arcades of Connaught Place had turned into squatter zones. “They sold anything they could lay their hands on. Even eggs, which were not seen in Delhi shops before,” he said.

Since it was difficult to get into established trades, the refugees would make parts and supply to big industries. Providing ancillary services and goods — from tailoring outside garment shops to machine parts and sub-assemblies — became a Punjabi enterprise.

AN INDUSTRIAL CITY

Before 1947, retailers from neighbouring districts picked up goods from the old city and carried them back in camel carts. From a regional trading centre, Delhi was soon to become an industrialised city. The 1964 Industrial Survey showed that between 1945 and 1951, the number of registered factories grew from 227 to 431. Before 1945, there were three bicycle-manufacturing industries. By 1951, there were seven.

There was an explosion of retail and general merchandise shops. Many enrolled in small scale industry training at government centres. At Arab Ki Sarai, Japanese technicians ran modules in 12 different crafts. It helped that most refugees were literate, often better educated than the locals. A study by VKRV Rao and PB Desai showed 88% of men and 68% of women in Kingsway Camp were literate.

The newly established ‘ring towns’ such as Sonepat, Ballabgarh, Faridabad and Ghaziabad initiated the idea of the National Capital Region. Within the city limits, Okhla and Nariana Industrial Estates were set up with the government initiative to promote refugee enterprise, V N Dutta wrote in his essay ‘Punjabi Refugees and the Urban Development of Greater Delhi’.

It is in these factory towns that Janaki Das Kapur, a businessman from Lahore, started Atlas Cycles. HP Nanda and his brother, also from Lahore, founded the Escorts Group. Raunaq Singh from Daska set up Bharat Steel and Apollo Tyres, and Rawalpindi’s Bhai Mohan Singh came to manage Ranbaxy.

POLITICAL ALIGNMENTS

In the decades leading up to Partition, Hindu nationalism had gained ground both in Western Punjab and Delhi, deriving support from the Hindu business communities in both areas. One effect of Partition was to increase the concentration of these business communities in the capital. This, rather than the scars of the Partition, boosted the fortunes of Hindu nationalist parties in Delhi, wrote Christophe Jaffrelot in ‘Delhi: Urban Space and Human Destinies’.

Several leaders of the post-Independence Delhi Jana Sangh (a predecessor of Bharatiya Janata Party) — Balraj Madhok, Vijay Kumar Malhotra, Bhai Mahaveer and Madanlal Khurana among others — were refugees from west Punjab.

BJP veterans Madanlal Khurana, V K Malhotra and LK Advani (left to right) at a Jan Sangh protest on 14 January, 1973. (HT Photo by Virendra Prabhakar)

Malhotra recalled how the political climate was ripe to create an anti-Congress front. “The RSS had been banned (following Mahatma Gandhi’s assassination)... Dr Shyama Prasad Mukherjee had resigned from Nehru’s cabinet. There was no one to represent the Hindu point of view in Parliament,” he said.

The Akhil Bhartiya Vidyarathi Parishad was formed in 1949 and Jana Sangh in 1951. In the pre-Assembly elections in 1951, BJS won five seats. In Lok Sabha, they got three. “Dr Mukherjee famously remarked that today’s minority is tomorrow’s majority,” recalled Malhotra.

NEW CULTURAL SYMBOLS

The cult of Sheranwali Mata has no clear pre-partition history either in Delhi or Punjab, but it somehow got inextricably linked to the Punjabi Hindu refugees of 1947, wrote Ravinder Kaur in her book — Partition Narratives Among Punjabi Migrants of Delhi.

City politician Jai Prakash Aggarwal, whose family has been associated with Ramlila celebrations in Delhi for over 100 years, said the Bhagwati Jagran and Mata ki Chowki were common even before Partition. “But as the population of Hindus increased after Partition, these celebrations came out of homes into the streets. They became more visible,” he said.

LOST AND GAINED

Many grieve the loss of high culture that once defined Delhi. With a large Muslim population gone, Urdu, the city’s dominant language, went into a decline and was soon substituted by Hindi and Punjabi. Mushairas (Urdu poetry recitation) became rare and were replaced by government-sponsored Kavi Sammelans.

The late Ahmed Ali, the author of ‘Twilight in Delhi’, who left for Karachi during Partition, lamented to writer William Dalrymple how Delhi was dead. “All that made Delhi special has been uprooted and dispersed. Now the language has shrunk. So many words are lost,” Dalrymple quoted him saying in The New Yorker in 2015.

Despite this undercurrent of resentment, what was the most remarkable about the refugee resettlement in Delhi, as Ravinder Kaur wrote, was the absence of any noticeable conflict. While the strifes between the ethnic Sindhis and the Muhajirs (Muslim refugees from India) often turned violent, Delhi as always was more accepting, and willing to evolve.

Since those tumultuous years of Partition, the ever-expanding capital has attracted and in turn got enriched by millions of migrants from all corners of the country. Seven decades on, Delhi’s fascinating journey towards becoming a truly cosmopolitan city continues."
