Title,Article
"Chipmaker Nvidia, Volvo, AutoLiv team up to develop self-driving vehicles by 2021","Chipmaker Nvidia Corp on Monday announced it was partnering with Volvo Cars and Swedish auto supplier Autoliv to develop self-driving car technology for vehicles due to hit the market by 2021.

Volvo is owned by China’s Geely Automobile Holdings Ltd .

The Silicon Valley-based Nvidia also announced a non-exclusive partnership with German automotive suppliers ZF and Hella for artificial intelligence technology for autonomous driving.

Nvidia came to prominence in the gaming industry for designing graphics processing chips, but in recent years has been a key player in the automotive sector for providing the so-called “brain” of the autonomous vehicle.

The company, whose many partners already include Tesla Inc, Toyota Motor Corp and tier one supplier Robert Bosch, announced its latest deals at an automotive electronics show in Ludwigsburg, Germany.

Nvidia’s Drive PX artificial intelligence platform is used by Tesla in its Models S and X and upcoming Model 3 electric vehicles. Volkswagen AG’s Audi is also using the system to reach full autonomous driving by 2020.

In a call with reporters, Nvidia’s senior automotive director Danny Shapiro said carmakers and their main suppliers are now moving away from the research and development phase of autonomous vehicles and into concrete production plans.

The system developed jointly by ZF and Hella, and using Nvidia’s Drive PX platform, will combine front cameras with radar and software to create technology meeting the Euro NCAP safety certification for so-called “Level 3” driving, in which some, but not all, driving is performed by the car.

Volvo is already using the Drive PX for the self-driving cars in its “Drive Me” autonomous pilot program.

Volvo’s production vehicles built on Nvidia’s platform, as announced on Monday, are planned for sale by 2021."
Serie A 2017-18: Five players to watch out for this season,"The Serie A season begins on Saturday when Juventus start their bid for a seventh successive Scudetto with a home game against Cagliari.

Roma and Napoli are once again likely to provide the primary challenge to Juve’s dominance, while AC Milan will be looking for a resurgence after an extremely busy transfer window.

READ | Everton shrug off crowd trouble in Europa League win vs Hajduk Split

Ahead of the 2017-18 kick-off, we look at five players to keep a close eye on in the battle for the title.

Leonardo Bonucci (AC Milan)

🗣 @bonucci_leo19 to @MilanTV: ""Being captain is a huge responsibility""

He then spoke of his ambition 🏆

Watch more 👉🏻 https://t.co/v2GFygM2ME pic.twitter.com/aaDTqZ1pKg — AC Milan (@acmilan) August 15, 2017

No Serie A transfer raised more eyebrows than Italy centre-back Bonucci’s move from champions Juventus to AC Milan - one of 10 new additions for the Rossoneri. Bonucci left Turin amid a breakdown in relations with coach Massimiliano Allegri and will be depended on to solidify the defence as Milan aim for a return to the Champions League under Vincenzo Montella.

Paulo Dybala (Juventus)

Paulo Dybala was crucial to Juventus’ run to the UEFA Champions League final last season. (AFP)

Argentina forward Dybala may have only scored 11 Serie A goals last season in a campaign hampered by injuries, but he announced himself in the Champions League with his stunning display against Barcelona in the quarter-finals. Even with Gonzalo Higuain up front, it is Dybala who is poised to ascend to superstar status for the Bianconeri and his growing reputation was furthered by a double in the Supercoppa Italiana loss to Lazio.

READ | Thierry Henry wants the Premier League trophy to be named after Alex Ferguson

Dries Mertens (Napoli)

Previously linked with Chelsea and Manchester United, it is something of a surprise Mertens remains at Stadio San Paolo after an incredible 2016-17. The Belgian forward netted 28 goals in 35 Serie A games last term and shows no signs of slowing down after a fine finish in Wednesday’s Champions League play-off first leg victory over Nice.

Domenico Berardi (Sassuolo)

One of the hottest properties in Italian football, Berardi scored five goals and registered nine assists last season to help Sassuolo finish 10th and has since been linked with Juventus, Roma and Inter. Even Real Madrid have been talked up as a possible suitor for the 23-year-old forward, and such links will only intensify should he impress again for the Neroverdi.

READ | Lionel Messi, Cristiano Ronaldo lead sports stars in condemning Barcelona attack

Cengiz Under (AS Roma)

Roma paid €13.4million to prise Turkey forward Under away from Istanbul Basaksehir as sporting director Monchi and coach Eusebio Di Francesco plot a challenge for the title. Under, who plays predominantly on the left, recorded seven goals and five assists to help Basaksehir to second in the Super Lig. The 20-year-old already has two goals in four caps for Turkey and will look to take the next step in the capital."
"Wimbledon 2017: Roger Federer and Marin Cilic win, set up finals clash","IndiGo says news of cancelled flights being spread to malign its brand name

Aug 20, 2017 20:36 IST"
Riding the horse of life to death: Vijay Nambisan (1963-2017),"In the early 1990s in Bombay, poetry, or prose for that matter, was not about getting prizes. Or even being recognized in a bookshop or a restaurant. It was a defiant and dangerous personal vocation. Something like the helpless inner voice that urges a prospective Christ to climb his cross as a matter of course, and drive the first nail with his free hand.

Poetry was a romantic, seemingly interminable act of self sacrifice. First it required a measure of self abuse. Then with luck words came. And they would sound real. For better or worse, that has changed . Writing is a career now. A performance. A mime of the self. A frantic if studied method to hang on to what may not be there anytime now: an award, a fellowship, a flung nickel, an air ticket. And it involves one of the most tiring tasks an intelligent human can embark on: self promotion.

Vijay Nambisan was capable of neither. In one of Vijay’s prose works, Language as Ethic, he argues from the heart—and shores up those arguments from his phenomenal intellect — that at the core of communication is not even words and images, but integrity. Devoid of it, language assumes a political and manipulative nature. On the surface of it, the premise sounds like the plea of an honest man to all to be good. But it explains, typical of Vijay’s work, as in a flash, why a whole culture is incapable of facing up to truth at just about every level. And a people’s proneness to collective delusions.

In the Bombay of the ‘90s there was a bunch of people from different generations who, more or less, spoke the then young Vijay’s alien language: poetry. Dom Moraes, Arun Kolatkar, Adil Jussawalla, Nissim Ezekiel, Eunice De Souza, Jeet Thayyil to name a few. In my perception, at that time, among the senior poets Dom was closer to youngsters like us than the others. Dom was particularly encouraging of Jeet, Vijay, and me, regular visitors to Dom’s residence in Sargent House, Allana Road, Colaba.

In the Bombay of the ‘90s there was a bunch of people from different generations – like writer-poet Dom Moraes (left) and publisher David Davidar– who, more or less, spoke the then young Vijay’s alien language: poetry.

Dom had written, perhaps excessively kind, introductions and blurbs for the three of us, and recommended us to David Davidar, who published the now landmark Penguin Gemini series. As far as I can recall — and there is not much I am able to forget — most of us were on some mood altering substance or the other most of the time, and had a certain contempt for what Vijay described as the Corporate Poet. And he did not mean just poet. He was against suits, boots, hats. And an equal measure of contempt for time; why else would we all try so desperately to fast-forward our clocks?

One of the accidental meeting points of the younger lot of poets was the Debonair magazine, whose office then was in Worli, housed in an unpretentious building. It would be always hot inside. And then there would be areas where it was wintry. The air conditioning was uneven. At the time, Anil Dharker was running it, and, like a classic literary editor, he was open to new writers. The poetry editor for a while, if I recall correctly, was Imtiaz Dharker.

When Dharker quit, Adil Jussawalla took over. It was at this time that I first met Vijay. I had gone there, mid-morning, to follow up on an article; Vijay was in Adil’s cabin. He saw me and came out, grinning like he had met a cousin long lost. We went down to the bar round the corner and had a few. Sometime in the twilight hours, we parted, and all I could take away from that meeting was that I was supposed to meet him the next morning, at his paying guest room, close by.

I went, nursing the by now familiar hangover, and knocked on the door. Vijay opened it, but his face had undergone drastic restructuring. The night before he had fallen flat down the stairs on his chin, and was lighter for three or four teeth. There was blood on the stairs. I went back, in search of phantoms similar to Vijay. But could not find too many — even over the years.

Adil Jussawalla (in picture) took over as the poetry editor of the Debonair magazine after Imtiaz Dharker quit in the 90s. (Anshuman Poyrekar/HT Photo)

I mention these details of the inner workings in the literary alleys of Bombay of that rather unchronicled decade because Vijay stuck to that life, took several more falls. Lost more than his teeth.

The others moved on or tried to move from that unforgiving, transgressive life, in which words had to be bought with a little bit of life in exchange, an unsustainable trade.

Vijay bought into solitude, sometimes hating it, sometimes, choice-less, loving it. It gave him, I imagine, a martyr’s identity. He was the knight of poetry, and he was going to ride the horse of life to death. The smarter among his friends veered away from that track.

Through it all, Vijay wrote. Not much, but a little that said a lot. For him it was hard to separate a way of living from a way of writing. To create, he had to destroy. And his own body seemed the closest at hand.

He knew what he was doing. And, to me, it felt like a kind of vengeance. I was not sure vengeance against what. Most likely against himself. Between suicide and murder, he would choose the first. He knew his ways of life hurt people who loved him the most; his family; his very caring wife, Dr Kaveri Nambisan, a fine novelist herself. A few times, he went off alcohol; but he unerringly came back to, as he puts in a different contest, in Reminders of Gain : The call of the arrow/Summons the bow//

There are the usual articles doing the rounds that Vijay was a recluse. That word is a much-prostituted one in literary descriptions because it is used as if reclusion is a kind of extreme glamour of the eccentric. But then this is a place where the press described him as “the first all India poetry champion in 1988.”

The truth was that Vijay was dysfunctional. The only place he could be himself and find a transcendental value was in the world of words. He was close to a few people. That kept shifting. For a while, or so I think, he was quite my comrade in arms; in alms, too. The early years in Bombay for instance. Then we drifted. In his later phase, he was perhaps close to Jeet.

Vijay Nambisan was close to poet and writer Jeet Thayil. (Pradeep Gaur/Mint)

In between, I moved to Pune to head the Times of India’s edition there. Vijay and Kaveri had taken up a house in Lonavla, where he said the “clouds passed through his head, if he opened the window.” I never did make it to Lonavla.

In the car from office to my house once, Vijay said, “You have become a different man.” All the while I wondered how to tuck him in bed, given his slightly accusatory mood. This was around the time he had done a rare, cadenced translation of selected portions of Poonthanam’s Jnana Paana, (Song of Wisdom).

Poonthanam was a great 16th century Bhakti poet who more or less wrote the rules of the Malayalam language and literature. He was a devotee of Krishna, especially after the accidental death of his infant child. Poothanam’s rival in Krishna bhakti was Melpathur Narayana Bhattathiri, a rather superior — he was one of India’s first astronomers, and he was a great mathematician and linguist as well — brahmin who wrote, Narayaneeyam in Sanskrit. Poothanam’s work made literature accessible to the Malayalee non-brahmin. One of the great questions in Malayalam literature has been: Which work is better? Or which works better?

When Vijay said he was going to translate these ancient poets to English, I remember asking him, who’s going to read it. Vijay asked for some salt. Because he sweated a lot, he would mix salt in alcohol. It was all quite scientific at one level. I got him salt. He blew some smoke in my direction and grinned his famous grin. He didn’t care. That’s what he meant. The market did not enter into the world of his words. His integrity was a voice that he could ever rely on to impel him to triumphs and disasters.

Later, he said the translation was no easy job. Though Vijay, like quite a few IIT-ians, had a photographic memory, he was not fluent in reading or writing Malayalam, even though he asserted his provenance and ethnicity wherever possible.

What he did was to ask his father — who, when I met him once at his home in Bangalore, seemed both proud and worried about his prodigal son — for literal translations and then trans-created it beautifully into rhythmic wisdom.

Consider the opening lines of his work: “O yesterday the things we did not know would come!/And O the things we do not know will come today!/Now we behold those soon pass away!/ We are not told how long they’ll stay with us”.

There is a touch of Hamlet here: “There’s a special providence in the fall of a sparrow. If it be now, ’tis not to come. If it be not to come, it will be now. If it be not now, yet it will come — the readiness is all.”

At the time when the book came out, it was mostly criticized for his self-confessed ignorance of the vernacular, and his own agnosticism. To my mind, it was a spectacular act of literary courage, though not easy to distinguish from self indulgence, and dare.

Through it all Vijay drank. Went into detox. Came out. Wrote. Smoked. He smoked, I had often thought, as an antidote to alcohol. It was a break from what he was doing to his liver. For this, he had to destroy his throat and lungs. Either way, he would pay a price.

He paid it. Because the rest of the world of his 90s had changed. They had become gentrified. All the more reason he had to stay the course. He was the last man standing. What he thought of the change he said a few years ago in Outlook: “Eighteen of the happiest months in my life were spent in rural Bihar. It may sound like reverse snobbery, but I can’t help that. My wife and I were honoured members of the community, no one tried or wanted to shoot us, and the nuns looked after us like friends. What more could we want? A Learjet?”

This was the stay that went into the writing of his funny and insightful work: Bihar is in the Eye of the Beholder. It explained, as perhaps only a poet could, the intricate workings of a place that failed to work. And still survived like a trick that explained the tawdry magic of India. This book too was commissioned by David Davidar of Penguin, with whom Vijay had a productive relationship.

That’s saying a lot. Vijay’s ties changed with the tides of his mind. People betrayed him, by just not calling him up. In his mind, and I believe he is right, he was one of the few genuine artistes who deserved recognition, but would do nothing outside the covers of his books, to wangle it.

His latest collection, which was released last year, First Infinities, has some remarkable poems. It was perhaps justly brought out by an alternative publishing house, Hemant Diwate’s Poetrywala. Some of the poems suffer from a certain vulnerability to fall into the rhymes and rhythms, which take the poet away from the place he intended to end up in when he set out. But more often than not, the music ends in notes you did not think resided in them. It’s only the fine permutation of the words that makes possible a beauty which was not there till Vijay thought it up:

Snow

Crisp in the winter’s morning,

Softly all through the night,

What is this without warning,

Falling and white?

I have never seen snow

But I can imagine it quite –

Not how it tastes, but I know

It falls and is white.

One morning I’ll open the door

To bring in the morning’s milk,

And all around there’ll be snow –

Fallen and still.

How I’ll roll in the stuff!

How I’ll tumble and spin!

Until the neighbours cry, Enough!

And send me back in.

These are times when people die to live. Vijay lived to die. And write. I am glad I walked part of the way with him. He was the light. And he burnt furiously while he was there.

C P Surendran is a poet, novelist, and journalist."
"THE CLASS OF 2018: When parents are short on time and money, kids struggle in school","""Every time a parent asks how the student is doing, they do better,"" says Sanu. ""As SMC members, we have a direct channel with their teachers, too. So kids know that we are not only reliant on their words to know how they are performing. I can easily ask their teachers."" Both Sanu and Devi agreed that getting to know teachers cultivates in their children a certain sort of productive ""fear"".

As the education levels of Chandrashekhar's children has surpassed his own, he says he has become less involved in their lives.

Where Sanu and Devi are assertive, Chandrashekhar is diffident. ""My kids are more educated than me now,"" he says. ""How do I help them out at home? All I do is ask them once in a while how they are doing at school, if they have done their homework. That is all.""

Yet Chandrashekhar's son, Arvind, who is in Class 9 at Sarvodaya Bal Vidyalaya, says he benefits from personal attention from his father. ""When my father asks me about school, it makes me feel like he cares. It matters what I do and how I perform in school. I think I work extra hard on the days he asks.""

Saransh Vaswani, the co founder of Saajha, a not for profit organisation that works to enable parents to participate in the learning of their children and the School Management Committees, confirms that frequent interactions between parents and students are crucial — no matter how educated the parents are.

""It's okay if you are not literate,"" he says. ""You could interact with your child while you are cooking, talk to them about shapes and colours. We have even given parents and students simple worksheets to fill out together. Simple things like, match the 'ba' with 'batak'.""

But like Chandrashekhar, his wife, Vimala Devi, and his other child, Jyoti, 21, also work long hours at intensive jobs, leaving them with only so much time and energy to interact with the Nikki and Arvind afterward. Vimala Devi and Jyoti each work at a garment factory in Okhla. Vimala Devi makes Rs. 6,000 a month; Jyoti makes Rs. 7,000. They work from 8am until 8pm most days, leaving Nikki to do household chores in addition to their schoolwork.

""I come back late from work. I don't even have time to ask about her studies sometimes,"" says Vimala Devi of Nikki.

Vimala Devi passed through only eighth grade; Chandrashekhar didn't make it past Class 5. Jyoti, who makes a strong effort to help her siblings, had to quit school during Class 8.

Jyoti's foreshortened time in school was a direct result of her family's poverty. She now plays the role of a surrogate parent to her siblings.

The end of a dream

Jyoti's foreshortened time in school was a direct result of her family's poverty.

""I always wanted to study and become 'something', 'someone',"" she recollects. ""From the seventh grade, I knew I wanted to become a doctor. My mom used to fall ill often, you see? So I wanted to treat her.""

This dream ended in 2008 when her father fell ill with multiple masses in his kidneys. She was in seventh grade. The family had to leave their small village in Uttar Pradesh for Delhi so that her father could seek treatment at the All India Institute of Medical Sciences.

""When we moved to Delhi, we soon realised that we could not afford the expenses if I did not work too,"" says Jyoti. She joined her mother at a factory making, she says, ""chamkeeli things"", shiny trinkets that were decorated with small mirrors and sequins.

""I remember having to beg her boss to give me a job as well,"" says Jyoti. ""I was not 14 yet, so it was illegal to employ me. Saab finally relented and allowed me to work there, helping with some of the handiwork, for around Rs. 1,200 per month. They used to make me hide in boxes or send me out to play at the time of inspections.""

Though the new job meant that Jyoti could support her parents and siblings, it also meant that she would never become a doctor.

""Now I try to live out my dreams by playing a doctor at home when somebody falls ill,"" Jyoti says. ""Even when neighbours fall ill, I talk to the doctors about it and then prescribe the medicines they suggest.""

Though many parents realize that education is central to the future success of their kids, it is a long-term investment with no immediate returns.

The financial straits of Chandrashekhar's family is typical of other families in the pahadi school. The average household income is about Rs.10,000 to Rs. 20,000 a month, according to Sonu Nijhawan, the vice principal.

Teachers say they regularly see how the academic futures of their students are thwarted by the poverty of their families.

""One instance that I will never forget is that of Madhu,"" says Neelam Sanjeeta Minj, the teacher who is in charge of the school's management committee. ""One of our bright students, though she had only secured a 68% in her tenth grade. Her family was originally from a village in Rajasthan, and her father worked as a halwai here in Delhi. She had to discontinue her studies and go back to her village because her father was not earning enough to sustain a family here in Delhi. I still remember her crying.""

Much though many parents realise that education is central to the future success of their kids, it is a long-term investment with no immediate returns. For poorer families, it often must be sacrificed.

""I keep telling Nikki to study,"" Jyoti says. ""I even ask her to not do the household work. I say I will make dinner after I get home; I usually ask her to make use of the time to study.""

Wondering about the future

""Hum toh padh nahin paye, humare bache to padhe (We were not able to study, but we would like our kids to study)."" This belief, according to Minj, is the driving force behind many success stories of kids whose ""stubborn"" parents insisted they get an education.

Jyoti is largely uneducated herself, works a difficult job, and comes home exhausted. Still, she has intuited what Minj learned from experience, and is determined, as a kind of surrogate parent, to provide her siblings with the unflagging attention and support that they need.

""I keep telling Nikki to study,"" she says. ""I even ask her to not do the household work. I say I will make dinner after I get home; I usually ask her to make use of the time to study... I sometimes yell at them when I see them squander away the opportunity given to them by goofing around. You are allowed to play, of course, but you need to study.""

Nikki dreams of teaching Hindi someday, and regularly practises by helping classmates with their homework. If she succeeds in becoming a teacher, it would radically change her family's circumstances.

Nikki has noticed her sister's efforts. ""'Padhle (study) Nikki, padhle.' This is something you will hear often in this house,"" she says. She dreams of teaching Hindi someday, and regularly practises by helping classmates with their homework. If Nikki succeeds in becoming a teacher, it would radically change her family's circumstances. A senior secondary school teacher in Delhi government schools can make as much as Rs. 55,000 a month.

Nikki's teachers say that she is receiving high marks, but getting that job at a government school wouldn't be easy: she'd have to complete an MA and BEd in Hindi and pass an additional set of tests even to be considered.

Jyoti has devoted herself to the difficult task of supporting the education of her siblings. But she is also acutely aware of how different Nikki's future might be different from her own. The eldest child wonders what her life would have been like if she hadn't dropped out of school.

""My siblings, especially the youngest brother, call me uneducated at times,"" Jyoti says. ""It is usually when I insist he go finish his homework or schoolwork. But when he calls me 'unpadh', I get angry, upset, all at once. I sometimes take it out on my parents. I ask them why they let their other kids study, but did not send me to school. I know it was not a choice they were happy making. It was something they were forced to do. But sometimes, I ask anyway."""
