Title,Article
India hit high notes on fitness ahead of ODI cricket series against Sri Lanka,"The usually fickle weather in Sri Lanka in July-August was relatively benevolent as the Indian cricket team crushed the hosts to complete their first-ever clean sweep of an away Test series.

With the Sri Lankan team in disarray, the Indian side has firmly stayed focused on finding a new high in terms of fitness ahead of the five-match One-Day International series, starting on Sunday with the first game at the Dambulla International Stadium.

READ | Virat Kohli continues to top ICC ODI rankings for batsmen

On Friday, the first series training session for Virat Kohli and Co, ahead of their limited-overs series, was an intense affair with the players waiting out a brief stoppage at the batting nets due to a downpour.

Soon after, the Indian skipper, the fittest player in the squad, took the lead in the team’s new mantra of raising fitness levels in the build-up to the 2019 ICC World Cup in England.

Stripped to their waist, Virat Kohli and KL Rahul were put through the beep test – the original version before the advanced ‘yo-yo’ version was introduced. Both batsmen covered the different distances between markers, making sure they timed their runs in keeping with the beeps.

READ | MS Dhoni faces acid test in Sri Lanka ODI series with eye on 2019 ICC World Cup

Virat Kohli (R) with former India captain Mahendra Singh Dhoni during a practice session at The Rangiri Dambulla International Cricket Stadium in Dambulla. (AFP)

It severely tested both, and the profusely sweating batsmen kept at it with trainer Shankar Basu monitoring the test.

Soon, Mahendra Singh Dhoni, the seniormost player in the squad, joined and started doing his running routine between markers placed adjacent. Dhoni seemed drained by his short routine and then held an intense discussion with Basu.

READ | MS Dhoni in focus at training as India gear up for ODI series vs Sri Lanka

It is clear that India, ranked No 3 in the ICC ODI rankings, are favourites against Sri Lanka, ranked No 8 in the list and it was understandable the team’s focus was on improving its level. Yuvraj Singh and Suresh Raina were reportedly omitted for the India-Sri Lanka series as they didn’t meet the high fitness standards set and coach Ravi Shastri has said agility will be the key going forward.

“When the time comes for India to field a side for the 2019 50-over World Cup, we should have the best fielding XI in the world. Only the fittest of the lot will survive and thrive going forward and that’s right up there in the list of priorities.”

Batsman Manish Pandey, fresh from leading India A to the Tri-series win in South Africa, is confident India would come on top in the limited-overs series as well.

“A couple of things we have in our favour, we whitewashed them in the Test series, so they might be a little down. But this is where we have to focus and keep playing our cricket well, and do our basics right. If we do that we are hoping to have a good one-day series too.”

READ | Sri Lankan cricket’s transition grinds to halt at India roadblock

But the team’s focus on Friday was on fitness rather than tactical discussions.

“We had a meeting and spoke about it (fitness) for an hour and everybody is happy with it. From the senior-most guy, MS Dhoni, to the junior-most Kuldeep Yadav, everybody is happy (about pushing fitness levels). If it is an advantage for me, I would love to take it up and work hard.

Asked about the routine of Kohli and Rahul after the batting nets, he said: “Everybody has their own thing to do, individual warm-up and training, whatever helps to take our game to the next level. This is what we do the whole year; it’s not just the cricket we play. The test we have, at least twice a year, we all prepare for that as well.”"
MS Dhoni faces acid test in Sri Lanka ODI series with eye on 2019 ICC World Cup,"The lion may be the king of jungle, but elephants rule in the forests around the central Sri Lankan town of Dambulla, where the buoyant Indian cricket team starts a five-match One-Day International series against a struggling Sri Lanka on Sunday.

READ | Why MS Dhoni may not make it to 2019 Cricket World Cup

Drivers taking certain stretches around Dambulla in the night have eyes peeled for the big boys who sometimes decide to take over the roads.

For Virat Kohli’s One-Day International squad, the series will start in earnest the build-up to the 2019 ICC World Cup in England and Wales, which is less than 24 months away. And all eyes will be on former skipper MS Dhoni, especially after chief selector MSK Prasad’s recent comments left an elephant-in-the-room tone.

READ | MS Dhoni in focus at training as India gear up for ODI series vs Sri Lanka

Under pressure

The suggestion by MSK Prasad, a former India wicketkeeper himself, that Dhoni, 36, will be in contention for the championship he won as skipper in 2011 only if he delivers consistently has put pressure on the senior-most member of the side.

“We don’t say it is automatic, this thing… but we will see. We are all stakeholders. We all want the Indian team to do well. If he is delivering, why not? If he is not, we will have to look at alternatives,” Prasad said.

The statement has brought extra pressure on a vital member of the squad building up for the 2019 World Cup, although MS Dhoni will be 38 when it comes around.

Prasad’s comments have caused confusion because there are no issues about Dhoni’s fitness as of now, his keeping remains sharp while vital inputs to Virat Kohli, who took over from him in January, from behind the stumps have been acknowledged by the skipper. Where MS Dhoni has been found wanting is in his famed role as a finisher.

READ | Why Yuvraj Singh, Suresh Raina did not make Indian team for Lanka series - truth revealed

Build-up time

However, the team composition does not reflect MSK Prasad’s comments. There is no second wicketkeeper with youngster Rishabh Pant, doing duty for India A in South Africa, not picked for this series.

READ | Virat Kohli continues to top ICC ODI rankings for batsmen

India are unlikely to play more than 30 One-Day Internationals between now and the 2019 ICC World Cup, which has a May start. That means the national selectors face the challenge of giving MS Dhoni – his India appearances are limited --- enough games and at the same time stick to their rotation policy.

The national selectors have slotted KL Rahul to bat at No 4. That leaves either the technically proficient, who is also the most versatile batsman after Virat Kohli, to take over at the top if Shikhar Dhawan or Rohit Sharma suffer a dip. Even Ajinkya Rahane, who finds his spot shaky, can step in if required.

READ | Rohit Sharma aims to continue be a nightmare for Sri Lanka in ODI cricket series

However, India’s top-order is likely to be tested only while playing overseas, not in the sub-continent. And that is where MS Dhoni will also be required to marshal the middle-order batting, where Kedar Jadhav or young all-rounder Hardik Pandya don’t have the experience to handle pressure, like ‘Mr Cool’ has down the years.

As of now, that appears the only box India would like to tick early in the World Cup build-up.

Familiar turf

Dhoni has seldom revealed his emotions, though he has acknowledged he is no longer the finisher of old. And his tortuous 54 off 114 balls, in the loss to West Indies at North Sound, Antigua in a 11-run defeat soon after the ICC Champions Trophy will keep experts wondering whether he will be a force when the 2019 ICC World Cup comes around.

READ | Seasoned India can now focus on bigger battles

However, India’s double World Cup-winning skipper can look forward returning to Dambulla. The last time India played here was in 2010, and Mahela Jayawardene, Kumar Sangakkara and Tillakaratne Dilshan helped Sri Lanka extend their record against India here 7-4. Dhoni alone showed resistance, and was the only India batsman to get a half-century in that defeat."
India practice under lights ahead of 1st ODI vs Sri Lanka,"Aryan and Suhana Khan spotted out and about in Mumbai, looking like movie stars. See pics

Aug 20, 2017 18:05 IST"
CBSE Class 10 Compartment result 2017: Here’s how to check,"The Central Board Of Secondary Education (CBSE) is expected to declare the results of Secondary School Certificate or Class 10 (compartmental) examination, 2017 on its official result website this week.

In a notification issued earlier, the CBSE said the probable date for the declaration of results for Class 10 compartmental exam was the third week of August. The board, however, did not announce any exact date and said: “no enquiries about the actual date of result will be attended to”.

Steps to check CBSE Class 10 compartment exam 2017 result:

1) Visit CBSE’s official result website

2) Click on link for compartment/improvement exam result-2017 for Class-X

3) Enter required details as given on your admit card (like roll number)

4) Click on submit

5) Result will be displayed on the screen

6) Take a print out and download the same on your computer

The CBSE Class 10 compartmental exams were held from July 17 to July 24. In addition to theory papers, the board also conducted practical exams.

The education board declared its Class 10 or Secondary School Certificate (SSC) main exam results on June 3 this year.

The overall pass percentage fell to 90.95% from 96.21% in 2016, registering a dip of over 5%. A total of 16,67,573 candidates appeared for the main exam this year. About 7,81,463 students appeared in CBSE’s school-based exam and 8,86,506 students took the board-based exam."
"Swansea City vs Manchester United, Premier League 2017/18, full score: ManU win 4-0","Manchester United went into half time against Swansea with a 1-0 lead thanks to a goal from Eric Bailly. The second half then saw Swansea look to defend and prevent Jose Mourinho’s side from scoring any more goals and maybe get a quick goal on the counter attack. Swansea prevented the scoreline from changing much until the 80th minute, when Romelu Lukaku scored United’s second goal of the game. Paul Pogba and Anthony Martial then scored in quick succession to ensure Manchester United left Liberty Stadium with a 4-0 victory and all three points. Catch full score and full commentary of Swansea City vs Manchester United, Premier League game, here. (LATEST FOOTBALL NEWS)

Swansea City played a goalless draw against Southampton, away from home, in their opening league game of the season and this loss spells further trouble for the Welsh side, who just about escaped relegation last season.

If you are unable to see the full score of Swansea vs Manchester United, then click here."
India look to extend dominance over Sri Lanka in ODI series,"India openers Shikhar Dhawan and Rohit Sharma will reunite at the top as Virat Kohli’s side aims to repeat its dominance over Sri Lanka in the five-match One-day International series starting at the Dambulla International Stadium on Sunday.

India, the No 3 team in the ICC ODI rankings, will have a point to prove after Sri Lanka upstaged them in the group stages of the ICC Champions Trophy, where the hosts were still eliminated while India finished runners-up.

READ | KL Rahul looks to cash in on season of fresh starts under ‘inspiration’ Virat Kohli

Dhawan and Rohit have been the vital aspect of India’s ODI campaigns for a while, but their century partnership in that match against Sri Lanka did not prove enough.

Tough times

Sri Lankan cricket is passing through dire times, and new skipper Upul Tharanga, who stuggled in the Test series, will have his task cut out. The former winners, currently ranked eighth, must win at least two matches to finish among the top-eight teams in the ICC rankings ahead of the September 30 cut-off for a direct entry to the 2019 World Cup.

The depth in the Indian batting has left even a player of Ajinkya Rahane’s quality without a guarantee he will play. With KL Rahul assured of the No 4 slot, Rahane will hope to get the nod ahead of Manish Pandey – in-form and a brilliant fielder – as well as Kedar Jadhav – a big-hitter who can also bowl spin.

With the vice-captaincy going to Rohit, Rahane, India’s key middle-order batsman in Tests who sat out most of the ICC Champions Trophy games but was the highest scorer in the West Indies series that followed, is no certainty in the eleven.

READ | MS Dhoni reveals how to ‘turn the screw’ on opponents without sledging

Hungry bunch

All-rounder Hardik Pandya, who made a splash in the Test series with a racy debut century in the Pallekele victory, and chinaman bowler Kuldeep Yadav will look to extend their fine form.

With Mohammed Shami and Umesh Yadav as well as R Ashwin and Ravindra Jadeja not playing, the likes of Axar Patel and Yuzvendra Chahal can hope to get a look-in alongside Shardul Thakur, the 25-year-old Mumbai pacer who is yet to play for India.

Sri Lanka will be boosted by the experienced Lasith Malinga, but will have to bat far better than they did in the Test series to make it an even contest and ensure they don’t have to fight the qualification battle for the World Cup spot.

READ | India vs Sri Lanka: Can Virat Kohli break his record of ODI tons vs SL? 5 key battles

Kusal Perera and Dhanushka Gunathilaka, whose half-centuries helped Sri Lanka upstage India in the Champions Trophy, as well as Angelo Mathews, who gave up captaincy after the humiliating home ODI series loss to Zimbabwe, will have to come good.

The Indian bowling attack will be eager, and will be backed by the new-found intensity for fielding. However, Sri Lanka have had the upper hand at Dumbulla, where they hold a 7-4 win-loss record."
"Maharashtra: Two men fall into a 2000-feet deep valley, video captures fall","Two revellers died after falling into a 2,000 feet deep valley in Amboli Ghat in Sindhudurg district of Maharashtra.

A video of their fall has gone viral on social media, even as their bodies are yet to be recovered.

The incident took place at Kawale Saad Point in Amboli Ghat, a popular picnic point, on August 1, police said.

“Imran Garadi (26) and Pratap Rathod (21), who were part of a group of seven, fell into the valley. Their bodies are yet to be recovered,” said Sunil Dhanawade, Senior Police Inspector of Sawantwadi police station.

The victims and their friends worked at a poultry farm in Kolhapur, he said.

While others left the Kawale Saad Point after spending some time, Garadi and Rathod lingered back. When they didn’t join the group, their friends approached Sawantwadi police.

Police found out about the mishap from local people and shopkeepers, and roped in trekkers of Hill Riders Group to search for the duo.

The bodies were spotted down in the valley, but were yet to be recovered as heavy rain, water cascading down the hill and mist made the operation difficult, the officer said.

The video which is circulating on social media shows the two men, bottles in hand, climbing the fence around the edge of the valley and backtracking once or twice. Then the two are seen standing on the edge, beyond the fence, and slipping down."
Independence Day 2017: 5 tips that promise you freedom from everyday tech nightmares,"India is today celebrating its 70th Independence Day. The country is en route to a technology revolution wherein everything is becoming digital and is accessible on-the-go. From peer-to-peer money transfers to watching movies, technology has indeed helped improve our productivity. Even as users like you and me are becoming more used to a ‘smarter’ lifestyle, there are still some tiny yet persistent problems that slow you down. Come India’s 70th Independence Day, let’s use these simple steps to make our lives digitally smarter.

Pesky calls, texts

Who doesn’t get annoyed by calls from unknown numbers offering new schemes? Funny thing, all these pesky calls come especially when you are middle of something important. Well, we all have faced it. Fortunately, there are a few workarounds.

One of the first things you might want to do is getting registered to Telecom Regulatory authority of India’s (TRAI) National Do Not Call Registry (NDNC) aka Do Not Disturb (DND). In order to get your number on the DND list, you need to send an SMS ‘START 0’ to 1909 or you can simply make a call at toll-free number 1909.

Users receive an SMS informing about registration in the NDNC. Do note that DND activation takes up to 2-3 days. You can check the status of your DND registration in the NDNC list by clicking here.

You can also use the TRAI service for getting rid of pesky SMSes. The regulator has divided the promotional messages in primarily seven categories – banking, real estate, education, health, consumer goods and automobiles, entertainment and tourism. To block SMS from, say banking, send an SMS “STOP 1” to 1909.

If you are an Android user, you also have the option to download TRAI’s DND app from Google Play store.

Registering on the DND list may filter out a lot of pesky calls and texts, but you think it’s still paltry, you may give a shot at Truecaller app. Available for both Android and iOS, Truecaller allows users to see live caller ID and identify unknown calls, block spam SMS and calls. TrueCaller works better on Android than iOS.

Battery life

There are a very few smartphones that can actually run an entire day. A lot of us are usually scrambling for a charging port or a charger by end of the day. One of the easiest ways is to simply carry a portable powerbank. There are tones of affordable power banks available online. For an example, I use Xiaomi’s 10,000mAh portable charger, which is available online for Rs 1,199.

The Xiaomi Mi Powerbank is business card sized. (Xiaomi )

In case you are not carrying a powerbank or intend to buy one, you can still optimise the battery life of your smartphone through a few simple tricks. Before we elaborate, Android users can go to Settings> Battery > Use any of the battery modes depending upon your requirements. Nowadays, most of the Android phones come with a dedicated battery optimisation mode that help elongate battery life of the smartphone. Apple iPhone users can also do the same by going to Settings > Battery > Low Power Mode.

In order to draw more juice from the battery, you can try out following things:

1 Disable location, Wi-Fi, Bluetooth and data

2 Reduce the screen brightness to minimum

3 Deactivate apps that have been set to auto-sync or always on

4 Kill the background apps

5 Airplane mode (will disable cellular connectivity)

Documents organisation

For a lot of works including some government applications, a scanned copy is necessary. Not all of us have scanners at home. Well, even if some of us do, we cannot carry our scanners all the time. For an example, I had to send scanned copies of offer letter, appointment letter and relieving letter to my new employer. While I had the hard copy of those documents, the scanner at my office wasn’t working. So here’s what I did.

I downloaded the HP Smart app, which actually allows me to remotely control my Wi-Fi enabled printer/scanner/copier at my home. While one can remotely send command to the printer to scan the copy, one can also click a photo of the document through the smartphone camera, save it as PDF (a more accepted form of scanned documents) or .JPEG image. The documents can be arranged, renamed and shared it over the email, Google Drive and social networking apps like WhatsApp and Messenger. You can also try out Adobe Scan app for iOS and Android.

Some of the smartphones, like Gionee’s, come preloaded with a Document mode within the camera app as well.

Limited phone storage

You may think limited phone storage is a third-world problem or of those having lower-end phones. Well, you’re right, mostly. I use an iPhone 6 16GB model and most of the time its storage is almost full. I plead guilty for not deleting a lot of older photos, and even my iCloud photos backup has ran out of the storage. Well, Google Photos is the best option available at the moment.

Available for both Android and iOS, the Google Photos app allows you to back up your photos, access on-the-go and the best thing is you get unlimited storage if you choose the option to compress photos to 16-megapixel. Videos that are higher than 1080p resolution will be resized 1080p. You can check your Google storage plan here.

Google lets you back up unlimited photos and videos for free in ‘High Quality’. (Google)

Besides Google Photos, you can always use apps like Apple iCloud Library, Amazon Photos, Microsoft OneDrive and Dropbox among others to backup your data.

In order to further optimize the space on your Android smartphone, you can try out Lite versions of the apps like Facebook, Twitter, Skype, Flipkart, Snapdeal and LinkedIn. Of course, the experience is not on par with the main versions of the app, but these Lite apps work well on lower-end phones and slower 2G data network.

If you like to listen to music a lot on-the-go but face the problem of limited storage on the smartphone, I’d recommend you stream music from apps like Saavn and Gaana. These apps allow you to save the music and listen later offline. A paid subscription should not hurt much, I assume. Or, you can simply use YouTube’s offline feature.

While iPhone users don’t have the luxury of microSD cards, Android users, on the other hand, can very well use them to optimise built-in storage on the smartphone. If your smartphone runs on Android Marshmallow and above, you can use microSD card as an internal storage. Once you insert a microSD card, you will get two options -- use microSD card as internal storage and use microSD as portable storage. Choose the former. Do note, not all the smartphone brands allow using microSD as internal storage.

Email clutter

If you are a professional or student, emails are pretty much part of your day-to-day routine. But of course not all the emails need to be seen immediately or responded. While Google and Microsoft do a pretty decent job at categorising the emails for your, still you will need to do a bit more with them.

Google’s Inbox is a pretty decent service that helps improve productivity. The service shows you highlights instantly without needing to dig through emails, add reminders to the top of your inbox and even set snooze emails reminders that should come back to your inbox whenever you want. One of the best things is it allows you to bundle group messages and get rid of the clutter. You can also further customise the bundle by grouping emails from social network, promotions, purchases, and so on.

If your Gmail storage is full, you can delete emails containing heavy files with this simple process – just enter has:attachment larger:1M to search for emails that contain files more than 1MB in size. You can also narrow down the search to specific date and even larger files if you want. Don’t forget to clean your trash folder for Gmail to reflect your actual storage."
