Title,Article
MacGill confirmed as Bangladesh spin coach,"NEW JOB

MacGill confirmed as Bangladesh spin coach

Atif Azam • Last updated on Thu, 10 Aug, 2017, 03:38 PM

MacGill has no prior coaching experience but has mentored a number of spinners in Australia. © Getty

Bangladesh Cricket Board have confirmed roping in former Australia legspinner Stuart MacGill as their spin coach and now they are waiting for his arrival, subject to him obtaining a No Objection Certificate (NOC) from Cricket Australia.

BCB president Nazmul Hasan earlier had said that they have chosen Macgill as their spin consultant for a period of three months and was keen to see him working with the boys before the start of the two-match Test series against Australia, scheduled to start from August 27.

Nazmul had announced the decision after the meeting of board of directors at the Sher-e-Bangla National Stadium on July 30 as they scrutinised the shortlist of spin coaches who showed willingness to work with the Bangladesh national side. MacGill will replace Ruwan Kalpage.

Kalpage was sacked last year as he refused to arrive on time and from then onwards BCB was working to rope in someone to work with the slow bowlers. According to BCB cricket operation chairman Akram Khan they are not sure whether they can have the services of Macgill before the start of the upcoming series against Australia but are confident it won't take too long for him to arrive.

""We have confirmed MacGill,"" Akram told Cricbuzz, on Wednesday (August 9), when he was asked about the development regarding MacGill's appointment. ""We are waiting for him to get his NOC from CA.

""Even if we don't get him before the series against Australia we are sure we will have him in our dressing as soon as he obtains the required documents to work here.""

MacGill has been regarded as one of the unluckiest players that the world of cricket has seen so far. Despite having enormous talent he could never become a regular in the Australian team because of the presence of legendary leg-spinner Shane Warne in the same era. As a coach, MacGill has no experience till date apart from mentoring some spinners in Australia.

BCB said that they would give MacGill a long term contract after observing the team's progress under his supervision and after consulting for how long he is willing to continue with the team.

© Cricbuzz

TAGS

RELATED STORIES"
How to stay friends with your ex,"





Breakups are painful and can be equally hard on both partners. But, sometimes, no matter the reason for parting ways, it is tough to cut the person off from your life completely, especially if you have common friends or have kids together. Malaika Arora and Arbaaz Khan who recently ended their marriage remain amicable and are often seen on outings together with their kids. She recently spoke about their equation and was quoted saying, Arbaaz is a part of my family, the father of my child. Certain equations don't change overnight. The things that happened should remain between us. It's personal. We don't have to prove anything to anybody. Meeting (Arbaaz Khan) makes my son happy, and that makes me happy.""



With a few easy steps former partners can pave the way for a friendship with mutual respect:



Firstly, stop referring to him as your ex.

"
ET Now,"Sorry, this content is not available in your country"
The Eternal Quest,"Many aspirants begin their spiritual journey with great enthusiasm but somewhere along the way, they slow down or get confused. GURUDEVSHRI RAKESHBHAI says the pause helps you scrutinise your religious activities and understand your true intentions



Pursuit of liberation begins with a desire for it.However, one wonders if man has the genuine desire for it.He is easily satisfied doing a few religious activities, and although he expects liberation, he lacks a genuine desire for it. Generally, one eats food when one feels hungry. But in our modern-day pseudo-lifestyle, meal times are fixed. You never ask the body whether it is hungry or not.You know it is time to eat, so you eat. Such ‘hunger’ can be false. Mere thinking about mealtimes can make you falsely believe that you are hungry. Try this experiment.Ask someone at home to turn the clock to make it an hour early so it shows 1 pm, your regular mealtime, when it is actually noon. Looking at the clock, you will spontaneously feel hungry! Now, try making it an hour late so it shows noon when it is actually 1 pm. On that day, you will feel hungry later! If looking at the clock determines your hunger,your hunger is artificial;it is not real.It is only a mental need,not physical.In the same way,religious activities without a yearning for liberation are only mental demands, not the need of the soul; they are emotional outbursts triggered by external circumstances.



You Want Both



Dig a little deeper into your desire for light and you will realise that you want both, the illumination of enlightenment and the darkness of worldliness. On the one hand, you say you don’t need the world, that you want only the bliss of the soul.Yet, for happiness, you run towards the world. In short, you don’t wish to become free from darkness, yet you wait for illumination to happen. Don’t you realise that without wanting to remove the darkness,you cannot light your lamp? First, realise that you actually want darkness alone.You have always hoped to acquire joy from darkness alone and fear that illumination will shatter your dream world.You love worldliness alone, yet you believe, and make others believe that you want liberation. You speak of liberation but to become happy, instead of bringing changes in yourself, you try changing the world.You speak of liberation only to comfortably live in the world. How will you light the lamp if you are so attached to darkness? Even if someone tries to light it for you, you soon blow it out.Even when someone shows compassion towards you, it does not make a difference.You are in love with darkness and wish to live in that alone. Enlightened ones have showered compassion upon you in the past.The sun itself has come knocking at your door, but you choose to hide in your darkness.You know that with light,your desire and hope from darkness will be destroyed. So you fear light.As long as you have even a bit of inclination to acquire from darkness,you will not let the lamp be illumined. You are so dishonest that you are not ready to accept the way you are.You do not want to accept that, ‘I want to live in darkness alone. I want happiness from worldly objects and events.’You join those who speak about light and show how interested you are in it, but you want to live in darkness alone. If you accept that you are merely talking about light and are not really interested in it,one can find a way out.You love darkness but you want to show that you are a lover of light.You can’t give up your attraction of being called religious for there is reputation and honour associated with it. Your attraction for this honour linked with religiousness makes you start pretending to be religious.You actually use religion to hide your flaws.Showing aspiration for illumination,you continue to hide your delusion. Your cry for light is merely to hide your passion for darkness.There is no inner transformation. You still want to make changes in the outside to gain joy and peace. There were two friends fishing on the banks of a lake. Seeing the lake-supervisor approach, one of the friends started running.The supervisor chased him, caught him after a mile and a half and said,“You will be prosecuted for fishing without a fishing licence.”The man immediately took out his licence from his pocket and showed it to the supervisor.The supervisor was surprised and said, “If you had the licence, why did you run?”The man said,“I had the licence, but my friend didn’t!” This man ran far away from the spot so that his friend could escape and hide.The same thing happens in your mental world.To conceal your wrong inclinations,you act pious.This is the ‘benefit’ of being ‘religious’ without truly yearning for liberation! No one will doubt you. If you want transformation, catch your desires. Go to their roots. Start accepting your flaws.That is the first step towards liberation.



Stop Self-deception



Many approach me for learning how to meditate because they want inner peace. But they show no enthusiasm in fulfilling the conditions necessary for meditation. Only a true customer is ready to pay the price, for he knows the real value of liberation.If you want liberation without paying its price, you are a beggar asking,‘teach me meditation, give me satsang, show me the means.’ But when it comes to putting anything at stake, you withdraw. You complain that ‘I have a lot of difficulties.Once everything is set,I will begin the pursuit of liberation.’Amidst the chase for wealth,power, family, status, reputation, you are stranded. Stop deceiving yourself — if you genuinely desired liberation,you would have given up everything and worked for liberation alone.



Turn Within



Only when you turn within, you experience bliss. A mind wandering outside can never be happy or peaceful. It gets sorrow wherever it goes. In spite of wealth,status,relations you have remained unhappy and wounded within. As long as you are living with the belief that,‘I will get happiness from the other’,you will remain sorrowful.Happiness is your nature, so by focusing within and staying steady within, you will experience it. If happiness were to come from the other,why haven’t you found it till now? Many times you have extended your begging bowl in front of others, and sometimes had some good fortune too,yet,why have you not been happy? Don’t you realise that those you beg from are beggars themselves, begging from you and others? If indeed they had happiness,why would they demand from you? All in the world are asking for happiness, yet no one is seen receiving it because asking itself is a mistake. By asking,you continue being outside. You forget that what you are asking is your own inherent nature.What is missing is identification with it. Turn towards the Source,your true Self, for happiness is religion; to turn outwards for happiness is being irreligious. None have ever gained happiness from outside, and those who have turned within have never failed to experience bliss.Even though their ways have been different — some by dancing, some by sitting in meditation,some through devotion and some through knowledge, but the direction was the same,for their destination was the same, the Self.Where there is forgetfulness of the Self, there is suffering.Where there is awareness of the Self, there is bliss. By remaining outside, you will gain nothing, and by turning within, nothing will remain to gain.



¦ Follow Gurudevshri Rakeshbhai at speakingtree.in



"
"How to kiss so that it leads to hot, steamy sex","A kiss works as a precursor to sex. A hot, steamy, make-your-knees-weak, make-you-dissolve-like-Klimt’s-famed-The Kiss-painting kiss is the precursor to some oh-my-gawd-there-there-there-ooooooooooh kind of sex.

Without tantalising you further, here’s how to kiss so that he knows there’s going to be some seriously sizzling sex coming up next:



Be the initiator: There is nothing that turns a guy on more than a woman who takes control and has her way with him. Initiate the kiss by pressing your lips onto his and making him respond to you. While your lips get busy, let your hands rove over his body. And moan. You’ll activate an arousal in milliseconds.



Open wide: Your goal is a long, wet French kiss, but tease him before you get there. Open your mouth gradually. Get him hot and bothered before you open wide and let his tongue in. Sit in his lap in cowgirl position, so you’re on top of him and he’s at your mercy. Kiss his lower lip and move to his upper before opening your mouth and letting your tongue meet his more-than-eager one.



Be aggressive (with your tongue): Let your tongue be in the thick of the action. Do all the talking by slipping it into his mouth and letting it roll over his, clockwise, then counter-clockwise. Play tongue hockey and tease him by withdrawing and starting over. Nibble on his lip, preferably the juicier, thicker one, before you slip your tongue in again. By now, all his signals will be green and he’ll be raring to have rip-your-clothes-off, all-night-long sex.

Photograph: Shutterstock"
What Does Halle Berry Do To Look 30 At The Age Of 50? She Follows A Ketogenic Diet,"Halle Berry has always been a sight for sore eyes because of her elegance, grace and good looks; both on and off the screen. Over 50 years old now, she still doesn’t look a day older than 30!

iskandarx.blogspot.in

So what’s Berry’s secret? She swears by a ketogenic diet!

This essentially means she’s learnt to live without carbs and sugar and live off healthy fats, like the ones you get in avocados, coconut oil and eggs. Your body learns to burn fat instead of sugar or carbs and eventually your fat burns off your body, according to Madamenoire.

Me when someone says ""I'm coming over and I've got snacks."" A post shared by Halle Berry (@halleberry) on Mar 30, 2017 at 2:12pm PDT

""I try to eat four small meals a day. I like to feel strong and healthy,"" Berry tells Women & Home South Africa. ""I started to eat loads of wonderful fresh vegetables, chicken, fresh fish, and pasta. I cut out red meat and cut back on fruit because it can contain quite a lot of sugar,"" she tells Daily Mail UK.

She also talks about how sugar is like poison for your system and your skin and how avoiding it helps as a natural anti-aging secret!

“I use Xylitol as a sugar substitute and give it to my daughter. It’s rough though because she’s at a friend’s birthday party every other month and there are all these wonderful birthday cakes so I don’t deprive her of that. I strongly believe in talking about nutrition at an early age and setting a good example,” believes Berry as stated in Marie Claire UK.

Beautiful backyard bounty with my babies. ❤️🍓🌼💁🏽👧🏽👼🏽🌸🍅🌶 A post shared by Halle Berry (@halleberry) on Jun 25, 2016 at 9:41am PDT

“It's a lot harder than it used to be [she laughs]. As I get older, I am more conscious of what I eat. That's not to say I won't have a glass of red wine occasionally—it's my guilty pleasure. [If I do], I make sure the rest of my meals that day are clean and healthy: lots of vegetables; no bread … and lots of water,” she tells L.A. Times.

She doesn’t usually work out with a trainer but trains religiously every day, no matter what!

“When my work schedule permits, sometimes I work out with a female trainer. No matter what, every day I exercise for at least 30 minutes,” she tells L.A. Times. “I have never worked out with a lot of weights unless I had to for a film role. Left to my own devices, I just do cardio. I do exercises that involve my own body weight because I never want to get too muscly,” adds Berry.

Being in London makes me miss my workout buddy @natbardonnet 💪🌊 A post shared by Halle Berry (@halleberry) on May 15, 2016 at 2:35pm PDT

She focuses on bodyweight style training and not weight training and mixes it with yoga and pilates to maintain a lean and tender muscle tone. She also mixes it up her routine every three to six months in order to trick her body so her workouts continue to remain effective, according to Madamenoire.

“Her abs look amazing,” says Nat Bardonet her trainer who focuses on training her abs three times a week during their 30-minute training sessions, as stated in People.

“The way I push Halle, not many people would be able to last,” says Bardonnet. “She always has great energy and a great smile,” adds Bardonet. “She always stuns me how beautiful and sexy she looks. Whatever curveball I throw at her, she can take.”

Don't Miss 110 SHARES 624 SHARES 2.7 K SHARES 1.6 K SHARES 1.2 K SHARES 1.1 K SHARES 392 SHARES 639 SHARES 231 SHARES 367 SHARES

BTS on my last shoot of the summer.👙🌊💪🏽 A post shared by Halle Berry (@halleberry) on Aug 30, 2016 at 11:55am PDT

But her transformation is not a recent on, as she made some dramatic changes as a 19 years old when she was diagnosed with diabetes.

“I try to do my part as a role model, by openly talking about it, what I’ve gone through, how I handle it in my life…I hope I’m getting the message out there—that it’s nothing to be ashamed of,” Berry tells the Inquirer.

Working on myself, by myself, for myself. A post shared by Halle Berry (@halleberry) on Mar 13, 2017 at 6:03pm PDT

“I got diagnosed with diabetes at 19. I just have a healthy diet, and I always exercise. As I’m getting older, that kind of attention to my health is paying off. I only work out three times a week, 30 minutes a pop,” adds Berry. “I am diabetic, so exercising has always been a part of managing my disease and keeping my sugars under control,” she tells L.A. Times."
Government must develop its ‘human capital’ akin to private sector,"By M Muneer

Rajiv Gandhi had famously stunned the nation when he said that only 15 paise of every rupee earmarked for the poor actually reach them. With Aadhaar and digitisation, things may have ameliorated, but no one knows for sure. Imagine the possibilities if 100% reach the final beneficiary. Here’s another one for the imagination: you walk into a sarkari office with dread for a certificate and get treated as if you’re in a luxury car showroom. Every government servant you encounter truly service-oriented? Far-fetched?

Not necessarily. It is plausible if GoI develops its human capital akin to the private sector, and aligns it to the vision and mission. Government must invest in constituting ‘government capital’ (GC): a bundle of intangible assets that includes human capital, information capital (such as the Aadhaar, PAN and other systems), leadership capital, innovation and education ecosystems, the Centre and state brands, culture of meritocracy and fairness, execution capabilities and so on.

To do this, the government folks — including the policymakers — must get trained and skilled. Almost all the intangible assets that form GC will be driven by one: human capital. Yet, government hardly thinks about building and growing this most critical capital. Bureaucrats elbow their way through to be sent to the best universities across the world for additional training. But training must be contextual to the policies of the elected governments for it to derive value.

Worse, the training of the-less-than-1,700 IAS officers at Ivy Leagues at huge costs has poor returns on investment since most of them use it for personal benefits. This amount could have been better utilised had there been training for other employees for such normal things as communication, citizen-centricity, service quality, productivity, risk-taking, leadership, etc. How many Harvardtrained bureaucrats resort to training their subordinates? Productivity suffers from there itself with topdown communication and no twoway discussions.

Historically, countries with large GC have succeeded in creating far bigger per-capita GDP growth. Countries like Saudi Arabia, Nigeria and Venezuela have high natural resources, but made poor investments in their people and systems, creating far less output per person and experiencing much slower growth rates than countries like Singapore, Israel and South Korea, which have few natural resources but invested heavily in human and other capital. GC creates value at both macro and micro economic levels.

GoI instituted the Skill India programme based on an OECD report arguing for developing countries to build their skilled labour for economic progress. The fact that India was way behind — at 10% skilled human capital in comparison to the 50-92% of developed nations — prompted GoI to drive Skill India without applying further thought. The report didn’t specify that the skilling should begin at home, and that it is very much the government’s business to skill its employees.

Had that happened first, the Skill India mission would have delivered wonders. Currently, it is a breeding ground for profiteering and nepotism.

This is also a classic case of over dependence on external consultants when one’s own employees have irrelevant skills. A bureaucracy driven by rules and regulations will always float a tender and use the consultant to mandate everything else. If developed well, government employees would be the torchbearers in driving ecosystems so needed for the future of job-creation, innovation, education and just about everything else.

Exactly how many people are employed in government? According to the Seventh Pay Commission, no one really knows! And how about productivity? There is no data on this either, but it is much lower than in the developed world and certainly dismally lower than in the private sector.

With the global economy looking bleak, government will have to stick to an austerity drive and get its employees to do more with less, and differently.

It should get employees to ‘own’ its many initiatives. Also, urgently needed is a system to develop the capability and capacity to redesign GoI’s service, become ‘human capital architects’ by providing evidence-based, innovative thinking. This should include emboldening and expediting fraternisation, co-designing across public services, and creating enabling frameworks.

If the human capital is aligned to the mission, significant outcomes can be triggered. And with equitable natural resources and intangible assets, India could leapfrog on growth rates if action is taken quickly today.

The writer is chief evangelist, Medici Institute"
"World News: Asia, Europe, America, India & Rest of World News Headlines",
