Title,Article
This Post Of Kamya Panjabi On Pratyusha Banerjee's Birthday Is Heartbreakingly Beautiful,"2016 was not that great for Indian television as one of the most famous faces of the telly world, Balika Vadhu actress Pratyusha Banerjee, left us forever.

Twitter

The actress allegedly committed suicide.



The actress' close friend and TV personality Kamya Panjabi posted a sad albeit beautiful message about her on social media site Instagram on her birthday today.

She shared two adorable snaps of them together and wished her Happy Birthday.

While Pratyusha's death came as a rude shock to her close friends and family, the entire industry was upset about her untimely death.

Pratyusha was found hanging in her Goregaon flat on April 1, 2016. Her parents had flown down from Jamshedpur post her death and had alleged (after her cremation) that the Bangur Nagar Police was not investigating the case properly.

Don't Miss 444 SHARES 5 K SHARES 59.4 K SHARES 40.9 K SHARES 5.6 K SHARES 11 K SHARES 4.5 K SHARES 10.7 K SHARES 3.9 K SHARES 4.7 K SHARES"
Ever Wondered Where Fat Goes When We Lose Weight? Here’s What Science To Say,"We’ve all lost and gained weight at some point in our lives. While most of us are well versed with the process of putting on weight very few know what happens to the fat you burn.

via GIPHY

Does it fall off your body or converted into energy or does something completely mystical we are completely unaware of?

via GIPHY





60% doctors and dieticians misguide their clients/patients into believing that fat is converted into useable energy

via GIPHY

If that were to be true all that energy would probably cause an internal explosion in your system

via GIPHY

The truth? You breathe out 4/5th of the fat you burn into thin air

via GIPHY

In the form of carbon dioxide and water in whatever ways it can

via GIPHY

Don’t go crazy breathing faster though, you would just hyperventilate and pass out!

via GIPHY

That's why if you’ve ever checked your weight in the morning, you’ll notice that weigh lesser—about a 100 grams or so. That’s because you breathed out that bit during your sleep!

via GIPHY

So if you’re someone who’s desperately looking to lose weight, sleeping on it may be a viable option for you!

via GIPHY

Don't Miss 386 SHARES 2.7 K SHARES 1.6 K SHARES 1.2 K SHARES 1.1 K SHARES 392 SHARES 232 SHARES 367 SHARES 18.5 K SHARES"
Mindful Plunge,"In water, PRIYA M MENON manages to do what she couldn’t do on land — tune out everything else and withdraw into her inner Self



As I sat in the orthopaedist’s office, I smiled.Along with the prescription was a note for the physiotherapist and the exercise recommended — swimming. Maybe my bad knee will ensure I am third time lucky, I thought, before heading back to work. My first two attempts at learning swimming had ended in disaster.Growing up close to the Kochi backwaters and spending summer vacations at my grandma’s home by the seaside, I loved the sight, smell and sound of water. When I was eight,my father took me to a small pool that had opened in the children’s traffic park in Kochi. Clad in my bright new swimsuit, I was asked to get into the shallow side of the pool and wait for the instructor. As I clung to the edge, peering eagerly up at the adults hovering close by, a man with bloodshot eyes leaned over. “Let go, turn around and just kick with your hands and feet.That’s all you need to do,” he barked. I obediently let go, flailed around and promptly sank. As I went down for the third time, my father, in his crisp white shirt and mundu, jumped into the pool and fished me out. It turned out that the man was not the instructor but an alcoholic wandering around the park.Anyway, my swimming classes ended and the pool also closed not much later.



A couple of decades later,along with my colleagues at the newspaper I then worked for, I signed up for a summer swimming camp at a small hotel in Chennai.The pool was small, dirty and filled with people of all age groups.The blazing heat, shrieking kids with dripping noses, and leering men who gargled into the pool’s gutter ensured I soon came down with an infection.And thus my second attempt was also thwarted, but not before I had learnt to float. So, this time round, I scouted out the cleanest pool I could find, and signed up for adult swimming classes.The first day went well.I arrived at 7:30am sharp to find a group of middle-aged and elderly men and women — each one at various stages of learning — in the pool, while three young coaches kept vigil.The instructor,an elderly man, soon appeared.Thanks to my earlier classes,I managed to float across the pool with ease. The second day, the coach began teaching me the breast stroke — first the arm movement,then the frog kick. Over the next few days, I struggled to master it, gulping air greedily as I surfaced, trying to get the coordination right.The more I struggled, the more energy I spent, and by the time I reached midway through the 25m pool, I gave up. Till the granny who was learning swimming to enjoy her Bali holiday with family spoke words of encouragement. Three months of classes later, she was still struggling to swim a lap.



The women in their 50s, freed from household chores with the advent of their daughters-in-law, had been there for two months floundering but delighting in their new-found freedom. And they were not ready to give up. Ten classes later, exhausted by my attempts, I decided to let go and simply float.After a few seconds, lulled by the rhythm of the water, I slowly began the strokes — stretching out my arms, pulling the water back, coming up for air,kicking out. Again and again, concentrating on the feel of the water, the rhythm of my breath.And even Phelps couldn’t have felt prouder when the cheers broke out as I finally finished the lap. The succeeding laps were much easier. The trick, I realised is to let yourself go,tune everything out,take it slow and not worry about reaching the other end of the pool. At the end of the hour, I found myself tired but elated, and strangely peaceful and calm. For a person who had tried yoga and meditation in vain — the former I managed to do for a month, the latter has always eluded me — it was the closest I got to experience the benefits of either. Bringing it up in conversation with a friend and yoga enthusiast, I realised that swimming is in fact considered by many to be moving meditation. Breaststroke or freestyle,swimming blends most of the principles of yoga and meditation. In water, I manage to do what I never can on land — focus on my breath, tune out everything else and withdraw into my inner self,a place where there are no deadlines or chores; and simply concentrate.



It’s the closest I have got to mindfulness — all I am aware of is the way my body glides through water, and the breath that fills my lungs. And with it comes a certain peace.Even as the physical exertion helps the body, the mental calm rejuvenates me.And the happy hormones released keep me smiling through the day. I had looked to heal my aching knee but the pool had healed my inner self. The classes did come to an end but the learning hasn’t stopped.The seniors I met showed age is no barrier where learning is concerned.The granny’s Bali vacation turned out to be memorable, as she snorkelled with her grandchildren. The women in their 50s have moved on to a dancing class.As for me, I am joining my 78-year-old swimming buddy next weekend so we can learn how to tread water in the deep. ■

"
"These Test World Records Are Still Held By Rahul Dravid, India's Most Dependable Batsman","Rahul Dravid has been called The Wall for India. He was also India's most dependable batsman in a career that spanned 16 years.

AFP

The man even now still holds some major records in Test cricket. Let's take a look:

1. Most catches in Tests - 210

AFP

2. Most balls faced in Test cricket - 31,258

AFP

3. Bowled the maximum times in Tests - 54

AFP

4. Involved in most century stands in Tests - 88

AFP

Don't Miss 98.6 K SHARES 25.6 K SHARES 3.1 K SHARES 3.7 K SHARES 4.7 K SHARES 4.1 K SHARES 2.1 K SHARES 3.5 K SHARES"
Here are 9 Questions That Only A Premier League Buff Can Answer,"Moderate

Not knowing about Premier League is not a crime. But not Googling up is stupidity."
Selfie spoilsports: The taxman is going to snoop on the pictures you post on Facebook 😜,"A worried-looking Chintoo talking to his pal, Pintoo.

Chintoo: Arre Pintoo, have you read that report in TOI that those taxwalas are spying on us by looking at the photos that we post on Facebook?

Pintoo: Why don’t they look at their own pictures on Facebook if they want to do time pass?

Chintoo: Oof, oh. The taxwalas are not looking at our Facebook selfies to do time pass. They are looking at our Facebook selfies so that they can raid our houses.

Pintoo: Raid our houses? I didn’t know putting selfies on Facebook has become a crime. Has anyone informed Mark Zuckerbergji about this?

Chintoo: No, no, bewakoof. Putting selfies on Facebook is not a crime. But having concealed income is a crime. And that’s why the taxwalas will raid our houses.

Pintoo: But how will the taxwalas know we have concealed income by looking at our selfies?

Chintoo: How? Simple. When do you take selfies? When you go on that super deluxe holiday in Switzerland. Or throw a party at a 5-star hotel for 300 friends. Or pose in front of that new Merc. Right? So how come you pay zero income tax and can yet go on that Swiss holiday, throw that party, buy that Merc? That’s how the taxwalas know you have concealed income and raid your house.

Pintoo: What spoilsports! What’s the point of a Swiss holiday, or a 5-star party, or a new Merc if you can’t take selfies to put on Facebook. But I’ve got an idea. We can still take selfies of our holidays, and parties, and cars and put them on Facebook after photoshopping someone else’s face on our face. Then that guy’s house will get raided, not ours.

Chintoo: What a genius idea!

Chintoo and Pintoo, both thinking: I know whose face I’ll photoshop: his."
26-Year-Old Man Diagnosed With 'Binge Watching Addiction' Is Somewhere All Of Us,"Well, if you binge watch your favourite TV series by sacrificing your sleep, you’ve got to read this. A 26-year-old, marketing professional in Gurgaon has been diagnosed with “addiction of online binge watching”.

oddyseyonline

He approached the hospital, complaining that he has depression and anxiety, however his psychiatrist found a completely different reason to his problems.

Dr Manish Jain, consultant, department of psychiatry, BLK Super Specialty Hospital, found out that the patient used to watch documentaries and TV shows in one go, due to which he always used to be sleep deprived. For two years, he kept binge watching that led to depression, mind absenteeism and anxiety.

Despite travelling 60-80km to work everyday and working a nine-hour shift, the marketing professional couldn’t let go off his addiction. Despite reaching home late, he always used to watch documentaries and TV shows, instead of sleeping. This made him wake up late in the morning and missing workdays too.

giphy

Binge watching addiction has become a lifestyle-related addiction. Watching shows continuously by giving up on sleep and social life can easily lead to depression and anxiety.

The Gurgaon man now has to go through a psychotherapy for curing his addiction.

While many of us binge-watch our favourite TV series, little did we know that it can be a root cause for so many problems? What do you think can be a solution for this? Tell us in the comments section."
"अगर आपके भी साथ भी हों ऐसी घटनाएं, तो संभल जाएं... दुर्भाग्य का दस्तक हो सकता है ये!",
महापंडित रावण ने लक्ष्मण को तीन बातें बताईं जो जीवन में सफलता की कुंजी है,
Mandal’s children: Maratha reservation agitation must spur political class to look beyond quotas,"The assertion of Maratha power culminating in a massive rally that paralysed Mumbai, India’s financial capital, is a warning sign that India’s growth story is in danger of veering off course. When dominant groups like Marathas and Jats vie for reservation, originally conceived as an instrument of social justice to uplift those who suffered under the caste system, it calls for a comprehensive review of this policy. The original plan was to progressively end reservations but now more groups wish to enjoy its benefits. Legal challenges over Maratha reservation exceeding Supreme Court’s 50% cap on quotas constrains the state government, but that has not stopped protesters from pressing their demands.

To mollify them chief minister Devendra Fadnavis has announced sops that extend to Marathas educational benefits like fee concessions available to OBC students. But it is unlikely that perceptions relating to denial of opportunities will recede with these new sops. Land-owning communities like Marathas and Jats have been hit hard by the slowing rural economy. That has been exacerbated by the Mandal effect, following which it has become fashionable for powerful caste groups to carve out their own quota of jobs and education regardless of merit. But there is no end to this cycle, as each sop to each caste group will result in other castes feeling aggrieved.

This hankering for reservation militates against Prime Minister Narendra Modi’s exhortation to make common cause against corruption, poverty and illiteracy for the next five years. Society remains divided on caste lines and opposition to reservation is being supplanted with collective bargaining and muscle flexing for reservation. As social tensions increase, it is time to look beyond quotas for solutions that can emancipate and empower the greatest number.

Investing in school education, improving quality of education, and facilitating access to quality education gives all young people, irrespective of caste or religion, a better shot at professional success in later life. It must be noted that young Marathas have spearheaded the 58 muk morchas or silent rallies. Their worries about the future are legitimate but hitting the streets may not yield solutions to their problems. The focus must shift away from hiving up existing jobs to creating new ones and expanding the pie. A new political and social consensus is needed. But who is there to bell the cat?"
Harmanpreet Kaur Names The Actress Who Can Play Her In The Biopic. It’s Deepika Padukone!,"India won the 2011 World Cup and soon plans of making an MS Dhoni biopic were hatched. Then Dhoni's biopic came and rocked the box office. Now the Indian women's team reached the 2017 World Cup final and made us proud. Despite their loss to England, several players got intense adulation from Indian fans. And biopic plans were again hatched. This time around the female cricketer in the spotlight is Harmanpreet Kaur.

Twitter

Considering a biopic is made, who will be the right actress to portray Harmanpreet on the silver screen? If you have listen to what Harmanpreet says, it should be Deepika Padukone. In an interview, she said, “Deepika is a good actor. She’d be the right choice [for the biopic], she’d able portray me well on-screen.""

Twitter

So what's up with Indian team these days? “Right now, we’re focused on winning the next World Cup. There’s so much more that, I need to achieve.""

Don't Miss 98.6 K SHARES 25.6 K SHARES 3.1 K SHARES 3.7 K SHARES 4.7 K SHARES 4.1 K SHARES 2.1 K SHARES 3.5 K SHARES"
Prompt police action — key to end violence against women,"Nirbhaya gangrape case and brutal murder that shook the whole country is still fresh in our memories. The Hon’ble Supreme Court pronounced the judgment only a few months ago wherein the court has expressed deep concern on rising crimes against women. “Increased crime rate against women is an area of concern for law–makers and there is an emergent need to study in depth the root of the problem and remedy the same through a strict law and order regime. Public at large, in particular, men are to be sensitised on gender justice”, the Court noted. The judgment called for strict action by police and secondly, changing the mindset of the society.

Ms Vernika Kundu was driving her car at midnight in Chandigarh and was chased by the goons in their vehicle. They chased her for about 20 kms in different directions. At one point, they overtook and stopped her car, got down and started banging at the car door trying to open it. The lady took a reverse and sped. In the meanwhile , she had called the cops who nabbed the culprits. The action of police so far is commendable. However, the police bungled up the registration of FIR. Ms Vernika had given a complaint saying that she was stalked and there was an intention to kidnap. The fact that she was chased for 20 minutes not allowing her to reach her destination shows an intention to kidnap. This should have been thoroughly investigated. Instead, there was an attempt to tamper with the complaint itself. Law is very clear on the registration of complaints. In the famous Lalithakumari Vs State of Uttar pradesh, Supreme Court pronounced judgment in 2012 and said – “If a cognizable offence is made out in the complaint, the police have no option but to register FIR” . This is further upheld by the Supreme Court judgment in Ramdev Foods Vs State of Gujarat, pronounced in 2015. In both the verdicts, Court has made it clear that “there cannot be a preliminary inquiry in an offence against a person/body prior to registering FIR” Because, preliminary inquiry gives scope to the accused to destroy the evidence and this means denying justice to the victim. The Court has said that only in five categories of offences-(1) Matrimonial family disputes (2) Commercial offences (3) Medical negligence cases (4) Corruption cases (5) Delays in giving prosecution sanction – only in these, there can be a preliminary inquiry. This essentially means that FIR is the starting point of investigation. Sections of law in FIR has to be as per the complaint only. There is no scope to omit the sections contrary to the complaint.

In an offence of stalking, attempt to kidnap as the case of Ms. Vernika, omitting the section of law in FIR is not only ‘Contempt of Court’ but also punishable under section 166A(c) IPC, wherein rigorous imprisonment upto 6 months extendable upto 2 years is attracted.

Data furnished by National Crime Records Bureau shows that there is an increase in crime against women inspite of women making advancement in education and in various fields. Supreme Court noted in Nirbhaya case that “Offences against women are not women’s issue alone but a human rights issue.” It is important to ensure that gender justice does not remain only on paper. Respect for woman and her dignity is the key to end violence against women. This has to start from home. Schools, textbooks, media also have a pivotal role in changing the mindset. When I narrated Vernika incident to my ten-year old child, the answer was – “If the girl was questioned why she was on roads at night the same has to be asked from the boys too.” What is sauce for the goose shall be sauce for the gander as well.

When will the age old police habit of doubting and questioning the victim, and further victimisation end? Will there ever be a time when police are sensitised enough to be empathetic and put oneself in the victim’s shoes? Leave alone being sensitised, if the police acts strictly as per law, most of the problems would be solved. Do the police also get biased in favour of social norms? Yes, very much likely. In India, women drinking alcohol, coming home late night are scorned at. Probably, this is the reason why Vernika lost sympathy from certain sections of society. But police can’t act as a moral-science instructor. There is no law in India that bans women from going out in the night or drinking alcohol. Hence, whether we like it or not, allowing our prejudices/biases to come in the way of implementation of law is unfair to the victim.

Even when Nirbhaya case was reported at first in the media, fingers were pointed at the girl questioning her being on roads at ungodly hours at night. The same is repeated in Ms. Vernika’s case. Many more will ensue in future unless societal attitude on gender role and social expectations change. How-so-ever progress our country could be making in various fields, it is disheartening to note that there is a huge lag between societal norms/traditions on one hand and law on the other. Law of the land ensures equality and justice. But the spirit of law will become effective only when we develop scientific temper."
"Goodbye, Cassini! NASA's Saturn-Bound Spacecraft Enters The Final Chapter Of Its 20-YO Journey","NASA’s Cassini spacecraft has begun the final chapter of its iconic 20-year-journey, where it will conduct a series of daring dives between Saturn and its rings. The probe will finally take a plunge into Saturn’s atmosphere to meet an explosive end, burning like an asteroid.

NASA

Following a final close flyby of Saturn’s moon Titan, Cassini will leap over the planet’s icy rings and begin a series of 22 weekly dives between the planet and the rings between April and September.

On the final orbit, Cassini will plunge into Saturn’s atmosphere, sending back new and unique science to the very end. After losing contact with Earth, the spacecraft will burn up like a meteor, becoming part of the planet itself.

REUTERS/NASA

That dramatic event is the capstone of six months of daring exploration and scientific discovery. Cassini’s final images will have been sent to Earth several hours before its final plunge, but even as the spacecraft makes its fateful dive into the planet’s atmosphere, it will be sending home new data in real time.

From its launch in 1997 to the unique Grand Finale science of 2017, the Cassini-Huygens mission has racked up a remarkable list of achievements, NASA said.

With PTI Inputs"
