Title,Article
Remove BCCI's current office bearers: CoA to SC,"BCCI VS COA

Remove BCCI's current office bearers: CoA to SC

Cricbuzz Staff • Last updated on Wed, 16 Aug, 2017, 05:39 PM

The CoA is unhappy with the ouster of CEO Rahul Johri from the BCCI meeting © AFP

In its fifth status report submitted to the Supreme Court, the Committee of Administrators (CoA) has asked for the removal of the current office bearers of the BCCI for the non-compliance of the court's orders to adopt the Lodha reforms. The CoA cited the court's January 2 ruling that ousted Anurag Thakur and Ajay Shirke from their BCCI posts, for the eviction of acting president CK Khanna, acting secretary Amitabh Choudhary and treasurer Anirudh Chaudhary.

""The Committee of Administrators submits that since the then President and Secretary of the BCCI had been removed because the BCCI failed to implement the reforms mandated by the Judgement despite a period of six months having passed, it is only fair that the current office bearers be treated in the same manner because a further period of six months have elapsed since the said office bearers submitted their undertakings and the reforms mandated by this Hon'ble Court have still not been implemented,"" the report stated.

The report has been submitted two days ahead of the July 18 hearing, wherein the three-member SC bench comprising Justices Deepak Misra, AM Khanwilkar and DY Chandrachud will reconsider some of the Lodha recommendations which it previously accepted, like the one-state-one-vote, strength of the selection committee and the concept of associate membership. Earlier in an SGM held on July 26, BCCI had decided to selectively adopt the Lodha reforms, leaving out five of them.

It was during the same SGM on July 26, when BCCI CEO Rahul Johri was asked to leave. The latest report by CoA, claims that the office-bearers deliberately misconstrued the SC order and ousted Johri from the SGM.

""After the attendance register was signed, the CEO and the other administrative staff including the legal team of the BCCI was asked to leave the meeting on the purported basis that the order dated July 24, 2017 passed by this hon'ble Court only permits office bearers to attend the same""

The CoA further wrote that this was a pre-planned and orchestrated move by the BCCI and explained the 'obvious' motive behind the same. ""The motivations of such a clever manoeuvre are fairly obvious. The presence of the CEO in the previous SGM held on June 26, 2017 had enabled the Comittee of Administrators to receive first-hand account of the proceedings and bring conduct of certain specific individuals to the attention of this Hon'ble Court. The absence of CEO from the July 26 SGM would make (and has made) that task very difficult.""

The CoA brought to SC's notice that the BCCI had failed to adopt a new fund disbursement policy which was formulated by Deloitte in line with the Lodha reforms. ""Adoption of the new fund disbursment policy by BCCI is one such reform aimed at ensuring proper allocation of funds to the State Associations based on need/requirement and with appropriate checks in place to ensure proper utlization and reporting by State associations.""

The report conveyed to the SC, BCCI's failure to appoint a new Ombudsman, despite the position being left vacant since September 2016 after the Justice (retd.) AP Shah stepped down. He had been roped in to address the conflict of interest issues prevalent within Indian cricket. The CoA also noted that the BCCI failed to adopt the new BCCI conflict of interest rules during the SGM in July, despite being handed the copy of the same through email more than a month prior to the meeting. Since the BCCI did not list new conflict of interest rules as one of the five reforms it was against, there was no justifiable reason for BCCI to not adopt the same.

© Cricbuzz"
Teenagers in danger: Blue Whale challenge exposes many socio-psychological vulnerabilities,"Technology is a mixed blessing. For children it can mean enriching new avenues of education as well as better entertainment. But the gadgetry that’s such a defining part of their life today also brings with it constantly morphing dangers, which are very difficult for parents to track 24×7. The Blue Whale Challenge, which has been linked to teenage deaths from Russia to America, is a peril that’s come to attention in India over the last month. The structure of this ‘game’ is that over 50 days the victim is given around 50 self-harm tasks, designed to culminate in suicide.

India’s IT ministry has now directed top internet platforms like Google and Facebook to remove all links to the online game. This is necessary, but will not go far enough to correct the social predicament that underlies why some children may participate in such deadly online games. For one, there will remain corners of the internet where such dangers will still lurk. Two, many young people were being pushed to suicide even before the existence of such games, for reasons society does not really understand, and it is easy to blame such games as the proximate cause when actual causation is much more nebulous. In that sense the urban legends circulating in Delhi and environs about someone chopping off women’s hair are a close analogy. They become ways of naming the state of collective insecurity and free-floating anxiety that we inhabit.

Pressure on young people today is enormous: they are confronted by a dysfunctional education system, support of joint families is gone, parents are overstretched by stresses of modern life. Among the solutions have to be better education as well as better parenting: Talk to the children, have a meaningful engagement with their life and, yes, pay attention to what they are up to online."
"Saira Banu Opens Up About Dilip Kumar's Closeness With His Sons Aamir, SRK And Salman Khan","Just a few days ago, pictures of Shah Rukh Khan visiting Dilip Kumar went viral on the internet. The pictures reflected the bond that Shah Rukh and Dilip Saab share. And Dilip Saab has had this warm bond not just with Shah Rukh but Aamir and Salman Khan too. In a recent interview with Mumbai Mirror, Saira Banu spoke at length about the recent meeting, when Shah Rukh came home. Recollecting how SRK came home and kissed Dilip Saab on forehead, she said,

2/ @iamsrk visited Sahab this evening. Sahab's doing much better since return from the hospital. Shukar Allah. pic.twitter.com/V2njs5swDM — Dilip Kumar (@TheDilipKumar) August 15, 2017

""I even saw him chanting a dua under his breath and blowing it on Saab's face. He was there for Saab's 89th birthday too and sat close to us, holding his hand and mine.""

She went on to describe his first meeting with SRK decades ago when he had signed his first film, Dil Aashna Hai. She went to say,

Pinterest

""We went for the muhurat of the film too. Dilip Saab gave the ceremonial clap. I have always said that if we had a son, he might have looked like Shah Rukh.. Both he and saab are a lot alike and have similar hair, which is why I like to run my fingers through Shah Rukh Khan when we meet. This time he asked me, 'Aaaj aap mere baalon ko haath nahin laga rahi hain?' I was happy to.""

And she had the sweetest things to say about Aamir and Salman, who have always been very accessible.

Agencies

""He goes out of his way to comply with such requests and is constantly in touch. So is family friend Salim Khan and his son Salman Khan. They often drop by on festivals and occasions like saab's birthday. Shah Rukh Khan has been the one who was difficult to reach over the past two three years. I pointed that out to him and he admitted that he has been shooting abroad, but promised to connect more often.""

Don't Miss 1.2 K SHARES 3.5 K SHARES 15.9 K SHARES 26.7 K SHARES 20.7 K SHARES 22.7 K SHARES 18.9 K SHARES 18.2 K SHARES 14.8 K SHARES 19.7 K SHARES"
जिन लोगों के शरीर में रहती हैं ऐसी आत्माएं उन्हें कभी नहीं मिल पाता सच्चा प्रेम,
Planet of the Apps: We humans are so smart that we’ve made machines which are already outsmarting us 😜,"The bad news is that smart machines – collectively known as AI, Artificial Intelligence – are going to take over our lives and enslave us. The worse news is that this has already happened.

I try to send a text message on my mobile phone. When i key in my name, J-u-g, my phone changes it to J-i-g, or J-o-g, or H-u-g, or M-u-g. But never J-u-g. This is called a predictive dictionary, and is an inbuilt feature of the phone.

It predicts what it thinks you want to key in, and if you key in something different it automatically corrects the word to what it thinks it ought to be.

As my phone won’t let me sign off as Jug, should i change my name by deed poll to Jig, or Jog, or Hug? Or how about Mug? Which is exactly what i feel like for allowing my phone to dictate to me what my own name ought to be.

While the driverless car is yet to be mass produced, there is already a driver-less car. Driver-less in that you must obey its commands before you drive it.

You want to show off your new car to your neighbour. You switch on the engine to show him how cool the A/c and the console are. ‘Fasten your seat belt!’ ‘FASTEN YOUR SEAT BELT!!’ An automotive Auntieji inside squawks at you louder and louder.

Fastening your seat belt is of course very necessary when you’re actually driving. But do you have to be made to feel like an idiot fastening your seat belt in a stationary car which you have no intention of driving? You do, if it’s a driver-less car.

There’s a gadget called a fitbit. You strap it on your wrist and it tells you how many steps you’ve walked/run and how many calories you’ve burnt.

Pretty soon you find your fitbit will give you a coronary by making you walk/run more and more. It’s called progressive training. It’s also called giving yourself a fit trying to become fit.

Thinking machines oughtn’t to be called Artificial Intelligence. Their intelligence isn’t artificial, it’s real. Our intelligence, for having invented them, is AI – Altu-faltu Intelligence."
"Indian Economy News, Trade News, Government Policy & Economic Indicators","Never miss a great news story!

Get instant notifications from Economic Times

AllowNot now

You can switch off notifications anytime using browser settings."
"Tamil Cinema News: Kollywood News, Movies, Celebrities, Actresses, Actors, Films, Songs, Videos","Ajith’s photography skills on display in Chennai TNN | | Unseen clicks of Ajith have been exhibited at an artgallery at TTK Road, Chennai

Comedian Alwa Vasu is no more TNN | | Comedy actor Alwa Vasu passed away in Madurai last night

I have seen that in Bollywood, everyone loves Tamil cinema Jyothi Prabhakar | | Director RS Prasanna tells us how it was being a debutant making a movie on erectile dysfunction.

Vikram resumes shooting for Dhruva Natchathiram Mrinalini Sundar | | Actor Vikram has been busy shooting for the action comedy, Sketch, directed by Vijay Chander.

Another wild card entry in Bigg Boss House TNN | | It looks like Bigg Boss Tamil is about to get another wild card entry

Ajith's charisma is mind-blowing: Dhanush TNN | | hanush has praised southern star Ajith, saying his charisma in the upcoming film 'Vivegam'.

Kathir plays a ‘strange’ cop in this crime thriller Sharanya CR | | After getting noticed for his role in Vikram Vedha, Kathir will play a cop’s role in his next, Sathru."
Sangram Singh Launches A Wrestling Championship As He Too Looks To Make A Comeback On The Mat,"In a bid to promote and provide a platform for aspiring wrestlers from Tier 2 and Tier 3 Indian cities, wrestler Sangram Singh launched the KD Jadhav Memorial Kushti Championship in the national capital on August 18.

ap

The one-day event is slated to be held on September 15 at the Talkatora Stadium in New Delhi and will feature five bouts including Sangram headlining the championship, which is also being promoted as a tribute to independent India's first ever individual Olympic medallist KD Jadhav.

""When I read about KD Jadhav, I found out that he devoted his entire to the sport but eventually ended up living his life in anonymity. He didn't even get pension. So, I thought of doing something for the upcoming crop of younger generation of wrestlers. Every aspiring wrestler, particularly from the Tier 2 and Tier 3 cities, should get a platform to showcase their talent and further their respective careers,"" Sangram said during the event.

ap

Sangram, a former wrestler, is himself making a comeback to the mat and hopes that his initiative will help change the face of wrestling in India. The 32-year-old managed to pull off a star-studded event which was attended by India's lone individual Olympic gold medallist shooter Abhinav Bindra, Commonwealth gold medallist boxer Akhil Kumar and Olympian boxer Jitender Kumar.

Speaking at the occasion, Bindra said: ""I am delighted to see that a championship is being held as a tribute to KD Jadhav who holds an important and special place in our Olympic history. We shouldn't forget him and he should get the due for the services he did for the country. I must compliment Sangram for his efforts.""

Bindra, who is part of PM Narendra Modi's Olympic Task Force which has been put in place to prepare action plan for the next three Olympics, called for more opportunities to be given to athletes within the country to ensure a sustained career and increased level of completion. ""We must provide more and more opportunities for athletes at different levels. These things will help create an ecosystem for the athletes in India and we need more of such events and competitions in our country. We need to provide platforms for our athletes to help them prolong their careers. I think such initiatives are going to be very useful in that regard,"" he said.

ap

To make the event a success, the format has been tweaked to suit the TV audience. The wrestlers will grapple on a mat inside a ring in six rounds, each lasting three minutes. There will be a resting period of 45 seconds after each round.

Don't Miss 109.3 K SHARES 48.1 K SHARES 7.2 K SHARES 8.4 K SHARES 3.1 K SHARES 3.8 K SHARES 1.2 K SHARES 1.7 K SHARES 1.4 K SHARES

While Sangram will take on American wrestler Kevin Radford in the main event, there are four under-cards - three men and one women. Upcoming wrestlers such as Yudhistir, Lubhanshu, Sherpal, Himanshu, Shravab, Pratik, Ekta and Akansha will be aiming to make an impression. The organisers have roped in DD Sports as the official broadcaster and claim that the event will also be telecast live in 25 other countries.

An award night for honouring Indian wrestlers has also been planned on the following day of the championship which Sangram claims is first of its kind in the country. ""We will be giving 10 awards to the wrestlers on September 16. Nine of them are for those who have brought laurels to the nation and one will be for lifetime achievement,"" Sangram said.

Originally Published In The Times Of India"
SL name ODI squad; skipper Tharanga calls for support,"INDIA TOUR OF SRI LANKA, 2017

SL name ODI squad; skipper Tharanga calls for support

Cricbuzz Staff • Last updated on Tue, 15 Aug, 2017, 09:03 PM

Upul Tharanga urged the country to rally behind the team while stating that every team in each sport goes through a rough phase. © AFP

In the aftermath of Sri Lanka's abysmal 3-0 Test series loss at the hands of the No. 1 ranked Test side India, ODI skipper Upul Tharanga called for the nation's support and urged the fans to rally behind the team in testing times as Sri Lanka Cricket (SLC) announced the 15-member squad for the upcoming five-match ODI series on Tuesday (August 15).

ODI Squad: Upul Tharanga (c), Angelo Mathews, Niroshan Dickwella, Danushka Gunathilaka, Kusal Mendis, Chamara Kapugedera, Milinda Siriwardana, Malinda Pushpakumara, Akila Dananjaya, Lakshan Sandakan, Thisara Perera, Wanindu Hasaranga, Lasith Malinga, Dushmantha Chameera, Vishwa Fernando

With Asela Gunaratne yet to recover from the thumb injury he sustained during the first Test, the selectors have recalled allrounders Thisara Perera and Milinda Siriwardana for the five-match series. While Perera was overlooked for the home series against Zimbabwe, Siriwardana's last appearance for the national side came in the limited-overs series against Bangladesh in March-April this year.

Veteran fast bowler Nuwan Kulasekara, who featured in the final ODI against Zimbabwe, has been given the axe alongside Asitha Fernando and Lahiru Kumara. In their place, the selectors have included Malinda Pushpakumara, who recently made his Test debut against India and young seamer Vishwa Fernando. Both Pushpakumara and Fernando are yet to make their debut in the 50-over format.

""Every team goes through a rough patch,"" skipper Tharanga said. ""This is something that happens in cycles to every team and every nation no matter how great a cricketing nation they are.

Sri Lanka conceded 600+ totals in two of the three Tests and were asked to follow on in the last two games before succumbing to innings defeats. While the island nation weren't expected to topple the No. 1 ranked side during the series, the manner of defeat came across as rather baffling as their side kept slipping to newer depths every time. With the five-match ODI series and a lone T20I coming up, the skipper noted that every team had its share of lows and goes through a phase of transition before coming back on top.

""Sri Lanka dominated in all three formats for a good 18 years - don't forget this now when we are going through a rough patch. Obviously there are some things we can't openly discuss due to strategic reasons but there are certain areas behind the scenes that need to fall into place for us. These areas are being taken care of, and we are seeing the results behind the scenes - however it will take a little more time for it to be seen externally, so please have patience, and most importantly have faith.""

The skipper also reposed faith in the limited-overs outfit and felt that they are well equipped to fare better against their opponents in the 50-over format of the game. ""Sri Lanka have always been stronger in our white-ball format, and I am confident that we will come out strong and beat India. We have the talent, we have the skill. We have been putting in the hard work, we just need the spirit, and for that we need your support too.

""The support of our fans plays a big role in the morale of the team. We play for our country and our goal is to bring pride to our family of 20 million in this nation - so your support is something that matters greatly to us.

""Yesterday despite the defeat, we saw spectators cheering us and applauding us - this is what we need. It inspires us to fight harder too - so as the captain of the ODI & T20 teams, I want to appeal to each every one of you,"" concluded Tharanga.

© Cricbuzz

TAGS

RELATED STORIES"
Is the Hindu a victim? No. Hindus feel safe and the victim narrative is a manufactured war cry,"The targeting of Amarnath Yatris in Anantnag has sparked off a familiar narrative: Hindus are victims in their own land. According to this shopworn line, Hindus suffer in silence while attacks on Muslims are highlighted. From Paris to Manchester, every time Islamist terror strikes a western city, it is used to put the entire Muslim community in India on notice, even though as George Bush famously said, “India is a country which does not have a single al-Qaida member in a population of 150 million Muslims.” The Hindu victimhood narrative which is nothing but an Islamophobic war cry against minorities, needs to be busted.

Yes, those who died in Anantnag were innocent Hindu pilgrims. Yes, their killers may have been motivated by a radicalised Islam that spurs violence. But is that enough reason to spin a comprehensive story of Hindus at the mercy of a pincer attack from Islamic zealots and liberal “Hindu haters”? Such an imagined attack is not only dangerous fantasy but also deliberate strategy to create a fear psychosis when in fact the Hindu experiences no fear from minorities and is perfectly safe and free to practice his religion in whichever manner he wants. Deliberately manufactured “insults” like Dhoni as Krishna on a magazine cover or whipped up rage over a few seconds of azaan or imagined slights to Hinduism in books and movies are only means to keep the pot boiling and politicise both religion and society.

Islamophobia reigns supreme, making Hindutva a mimic of extremist Islam. The fixation on the Islamic threat has meant that there are politicised Hindus now agitating for blasphemy laws, public punishment of crimes, some even issuing fatwas. Islamophobia is also growing because of perceptions of “appeasement” of Muslims and a selective application of laws. But the special privileges sometimes granted to orthodox maulanas by short-sighted “secular” politicians cannot now be used to demand appeasement of radical Hindutva forces who are claiming total immunity from the law.

The fact is Muslims are the worst victims of terrorism. In 2011 BBC reported 82-97% of terrorism-related fatalities over the last five years were Muslims, the Shia-Sunni conflict has resulted in the Muslim brotherhood turning on itself and in Kashmir the overwhelming majority of the thousands killed in militancy have been Muslims. So who’s the victim here? Images of Muslim groups targeting Hindu shops in Bengal’s Basirhat are troubling, but equally nasty and sinister are the fake photographs being circulated on social media designed to push a strategic campaign that Bengal has become a hub of hatred for Hindus.

Are Hindus victims in Bengal? No, they certainly are not, which is why the fake photos on social media found no resonance among the citizenry which palpably experiences no fear of Muslims. In fact, across India the Hindu experiences no fear at all from the Muslim, however relentlessly “love jihad” campaigns are pushed by Hindutva foot soldiers. The exodus of Kashmiri Pandits was a terrible blot on Kashmir, and exposes the failures of successive governments in Srinagar. But is that reason enough to claim Hindus are under threat across the country?

The Sachar Committee report showed horrifyingly low levels of education and healthcare among Muslims, falling rate of Muslim representation in bureaucracy and police, female literacy lower than SCs and STs; it showed only one out of 25 students in undergraduate colleges and one in 50 in post graduate colleges are Muslims. If the community was “pampered” and “appeased” why doesn’t this show in rising incomes and education? Or are we confusing the political patronage of imams with the average Indian Muslim?

The pernicious whisper campaign that Muslims are reproducing faster than Hindus and will soon outnumber the majority is a myth as shown by the website India Spend, which reveals through figures that fertility rates are higher among poorer communities, both Hindu and Muslim, and are not based on religion. The Left and RSS outfits murdering each other in Kerala are comprised of Hindus on both sides. In fact whether it is the murders of Junaid, gau rakshaks lynching Pehlu Khan, the attack on a Muslim family in a train, or the slapping of sedition charges on those setting off crackers after an India-Pakistan cricket match, the reality is that it is Muslims who are the true victims of the narrative of muscular ‘nationalism’.

By contrast, who or what is victimising Hindus? Who is oppressing Hindus? At a time when Muslim political representation is at an all time low, why should Hindus feel under attack? When Hindu mythology, festivals, iconography, imagery is now the dominant culture in art, books, movies and TV shows, when a government that openly declares that it is a Hindu nationalist government rules with a big majority, why on earth should the Hindu feel as if he is cornered?

Of course, a morally bankrupt Muslim leadership has not helped the Muslim cause. Instead they have created and nurtured a grievance industry for votes and not taken steps to reduce the sense of Muslim separateness. Luckily, in spite of myopic political leaders, bridge builders still exist and many are toiling to maintain inter-community bridges even as the Sangh is determined to blow them up. Radical Hindus are insisting on victimhood, but the real victims of today – the farmer facing debt or the IT engineer facing job loss – are neither Hindus or Muslims, only citizens. The Hindu right should realise that a campaign based on creating fear may bring electoral benefits once, but will not work in the long run, because as far as his religion is concerned, the Hindu feels safe and unthreatened."
