Title,Article
Surviving Tsunami to leading Sri Lanka - the Chandimal story,"SPOTLIGHT Surviving Tsunami to leading Sri Lanka - the Chandimal story Vishaal Loganathan Share Tweet Share

All of 15 when the tsunami hit, Dinesh Chandimal saw, lost, won and lived through it, as he intends to do the same for Sri Lankan cricket now © Getty

As a 15-year-old, Dinesh Chandimal sat at home and watched on TV as Sri Lanka were handed a hammering by New Zealand in Auckland. More than 10000 kilometers away, in Ambalangoda, Chandimal was watching intently hoping to gather whatever points he could. He had to. Chandimal had packed his bags and his cricketing gear the day earlier. He had been called up for the trials for the Sri Lankan Under-15 team. It was to be one of the first steps towards realising a lifelong goal.

It was a poya, full moon day, and as usual the house was being cleaned. Chandimal's mother had stepped out to clear the garbage. Moments later, he heard a screech from his mother. ""Actually, we thought it was a snake or something,"" says Chandimal. But it was the tsunami, or 'The Devil', as Chandimal constantly says.

Ambalangoda was one of the worst hit areas. The waves were more than 15 feet high and came in at a rapid pace. After the first wave had hit the village, the waters drew back, before coming back stronger and more menacingly. The devastation left thousands homeless, hopeless, hungry and frightened. It killed as many, if not more.

""We went there and saw, and one of the uncles in our village, he came and saw for just five seconds and said 'the tsunami has come as a devil'. He said to us 'Please run with your children.' He shouted to us. Then, we ran. Ran for, I think, 200-300 meters. Fortunately, there was a hill. So we ran to that hill and we stayed there. From there, we saw our home and everything going like foam.""

""The tsunami came as the devil,"" Chandimal repeatedly says while talking about that fateful day. Until then, he hadn't even heard the word 'tsunami'. The incidents and memories of that day are fresh and vivid in his mind, and the pain in his voice is all too apparent. He watched his house, his recently-packed kit bag and everything he and his family owned being washed away by the sea. It swallowed up everything, but it also left in its wake a swathe of dead bodies, people Chandimal would've known. Chandimal could only watch on helpless from atop a hill. He and his family were safe, for now.

In the aftermath of the tsunami, a shaken Chandimal went hunting for his kit bag. He had to travel to Colombo for the trials. He found his bag more than two kilometers away, wet and useless. Chandimal wasn't stuck between the devil and the deep blue sea, here the devil was the deep blue sea.

It left him and his family with mental scars that won't easily be erased. ""Of course, it's always at the back of our minds. After tsunami, we went to the sea only twice. That much we were scared as a family. But you know that's the way life goes...""

The events of December 26, 2004, strengthened Chandimal. His family was now without a house, without any clothes or food. It made him resolute, his family's well-being became his main focus and he ensured he reached his goal through cricket.

""One time, in 2004, we didn't have a house to stay. This is a hotel,"" he says, looking around the swanky MovenPick Hotel in Colombo. ""My parents and my family and myself, we put a lot of hard work for me to become a player and a captain. The word is hard work.""

""We were affected by tsunami. We lost everything. Tsunami came as the devil and broke everything. So actually that (motivated me) to become an international cricketer and become a good cricketer. So that was the strength I think, after the tsunami. Then I was thinking I have to stick to my cricket, then I put some target - I want to be this, I want to be this man, this player and stuff.

""One or two months, we struggled as a family. We didn't have a place to stay. (We had) food issues, some clothes issues... So, but I think that gave me really good (motivation) to become a good cricketer.""

So when the opportunity to take his cricket to the next level came calling, Chandimal accepted it, albeit with a heavy heart. The current Test captain was the star of his team, Dharmasoka College, with both bat and behind the wickets. ""My wicketkeeping was superb in that time, I was flying to take catches. No mistakes! Like now,"" he laughs.

My wicketkeeping was superb in that time, I was flying to take catches: Dinesh Chandimal during his college days. © Getty

Against Ananda College, he was the only player to show some fight, scoring 77 not out as the team folded for 120. The coach of Ananda College, Udayananda Perera, was soon at his house, asking his parents to send him to Colombo.

""Actually, my parents pushed me to go to Ananda College. I didn't want to go. Because in Dharmasoka College, it was my first school and I loved playing there, in my home town. My parents told me, 'If you're there (Ananda College), at least you can get a good job. So then, I said 'Okay, I should go now because we have so many family problems.' We didn't have a good home, actually. For six months, we stayed at the government apartments. We were there for six months. So then I felt 'Okay, I should go, I should come to Colombo and play cricket'.

At Ananda College, Chandimal put in the hard yards. His days in the hostel were far from a breeze. He was not with his family, and the food was not to his liking. But he ensured he always put on a smile when his family asked about him.

""I didn't know (anyone in Colombo). I stayed at the hostel, Ananda hostel, for 3-4 years. And I used to eat that hostel food. It's always tough (laughs). Sometimes my parents called me and asked 'Son, are you okay with the food? Are you okay with the stay?' But sometimes, I'm not okay with the food, sometimes I didn't take my breakfast because breakfast was not good to eat. But I didn't say anything to them. I said, 'Yes, I am fine'. And so that's the way I was there at the hostel.""

But it was not all gloom, either. Chandimal maintained a good relationship with everyone at the college, and he was repaid with kindness. He is not sure why, but ventures that maybe it was because of his good behaviour.

""There were the workers, they gave a lot of help to me. Sometimes, when I am not there, when I am out for practice, they make my food, and when I come to the hostel, they bring it to my room. They took care of me really well. I just love to talk the right things with the good people. I feel that's why they loved me.""

From running for his life to now running the country's Test team, Chandimal's life has been a ride full of ups and downs.

Even as captain of the Sri Lankan Test team, Chandimal goes through the bumps regularly. He was handed over the side after Angelo Mathews decided he could not handle captaincy any more. Soon after, he watched as his side suffered a whitewash at home to India. He still has utmost confidence in his team, and says it has the right ingredients. Now his focus is on ensuring all the players play with freedom, to rid his team of any fears, or problems.

Dinesh Chandimal watches on as Sri Lanka suffer an embarrassing series whitewash at home at the hands of India. © Getty

""It's really an honour and a privilege to be the captain of Sri Lanka cricket team. I came with a really hard youth, tough times. I had tough times, good times. As a captain and a player, I just want to give the good things for my players. I just want to take care of them as my brothers. If something happens on the outside, I just want to control that and give good freedom to the youngsters to perform well.

""I just want to, as a captain, take the responsibility or blame. Anything from the outside and I'll get that as a captain. I just want to be relaxed and not put any pressure on my players. That is what I wanted to do. Because I know the hard times, when it comes to you. Actually, once I got my Test captaincy, I said to the players, 'I just want unity first, then attitude, focus, discipline and passion'. That's what I am always discussing with players and staff.""

Just like he did with his family, Chandimal always puts his team first. It's what he did when he was first made the captain too, in 2013.

""To be honest, I was struggling in 2014 with the pressure. Then after that I learnt a lot from that. How to handle the pressure. How to handle the people. How to handle players, how they're thinking and stuff. That gave me a lot of learning. Now, I can take more pressure, and give freedom to my players. 2013 was a tough time to captain the side, because in that time there were experienced players with a young side. I feel I handled it well. The thing is I didn't perform as a player, because I batted at number 6. In T20s, if you bat at number 6, you get only 2-3 overs. So you can't score big runs. You can get only 10-20 runs. As a captain, I had to open or bat at number 3, but I didn't want to do that.

""Because at that time, there was Kusal Janith (Perera). He was playing outstanding (cricket). So then I thought it is better to play Kusal as opener with Dilshan, there's a left-right hand opening combination. Then we had Mahela, then Sangakkara, then Angelo. I wanted to put the most experienced players in the first 10-15 overs. Then, myself at 6. I didn't think about myself, I just thought about the team. How to win. How to lift the World Cup for my mother country. So that's what I always think as a captain. I don't care about my performance, I don't care about my position. That's my first experience as captain in 2013-14.

Now Chandimal captains the Test side without any of the big names who were around in 2013. He's left shouldering the nation's hopes alongside an oft-injured and probably mentally-drained Mathews, and the ageing Rangana Herath. With the team failing to put up a fight, the task has only gotten harder for Chandimal.

""It's always hard, mate. Specially when you're losing games. There are so many questions, but if you're winning - no questions. When you are doing the right things, I feel we are doing so many bad mistakes. When we are not doing well, we don't do any mistakes. It's always tough. Maybe at the moment, we are like that. We are looking forward to get the good results in the future, within six months or one year.

""If you're playing international cricket, as a player, mental toughness is very important because these days, there's so much media and social media (pressure). Someone doesn't like you and they shout at you and stuff. As a player, you have to keep yourself mentally right and at the same time, you have to do your homework as a batsman or bowler.""

In 2004, Dinesh Chandimal stood on a hill and watched in horror his house being flooded and then being washed away. He resolved to fight for his family and take care of them. He did that through his cricket. Even now, when he speaks to his parents, they credit him for putting them back on their feet. ""They tell me every time I meet them, 'now we are in a good position, that's because of you.' And I say, 'No, not because of me, because of we all put our hard work in as a family. That's why we are here, not only because of me.'""

Now his goals have changed. In 2017, he stands as Sri Lanka's captain and watches as his side slips in one shocking performance after another. He again resolves to fight for his team, and take care of them. He must be the right man to take them forward. Because when you've seen, lost, won and lived through what he's seen, lost, won and lived through, fighting and succeeding is in your blood.

© Cricbuzz"
‘7 Sins of India’ – this Chinese video on Doklam is 70 kinds of funny,"Indian television news content is often criticized for being over the top. Moderators are criticized for their histrionics. The absence of reason is mourned, as is the resemblance of programming to government propaganda. But a new Xinhua video suggests that even in this game China has India beat.

Streamed on New China TV, the official YouTube channel of Xinhua news agency, which is the official press agency of the People’s Republic of China, the video features a pulchritudinous female anchor throwing peculiar new light on the Doklam standoff, topped by a faux hirsute faux Indian making a fool of himself backed by a full supply of canned laughter.

The script is pretty hilarious actually. It’s not clear to me if the scriptwriters are really taking the mickey out of India or sort of subtly subverting their own scriptmasters as well.

I have recorded the script below, with the hope that in something like the august tradition of rap battles, someone out there is going to put together a classy rejoinder:

Anchor: It’s been two months since Indian troops illegally crossed the China-India boundary but so far India has shown no sign of withdrawal at all.

When the whole world is trying to wake India up from its impulse China’s realized it’s impossible to wake a guy who is pretending to be asleep.

Faux Indian: Nobody is blaming me because I’m asleeeeep. (Snoring)

Anchor: Fine fine … let’s now take a look at what India has done during these two months which in a nutshell is regarded as the 7 Sins.

No 1: Trespassing

On June 18 Indian border troops carrying weapons and driving bulldozers illegally crossed the delimited boundary into the UNDISPUTED Chinese territory.

Yeah you heard it right, driving bulldozers straight into your house without even knocking at the door. What kind of neighbor would that be?

No 2: Violating bilateral convention

No 3: Trampling international law

You may think Doklam is a disputed area but the truth is both India and the international community have recognized the place as a part of China according to the 1890 convention between Great Britain and China relating to Sikkim and Tibet. And the thing is this exact convention is part of international law.

Didn’t your mama tell you never break the law!

No 4: Confusing and wrong

No 5: Putting blame on victim

This is kind of funny. India has been inventing various excuses to whitewash its illegal move. But first of all you’ve got to make sure your excuses can hold water dude!

India’s argued that China’s building of roads would represent “significant change of status quo … with serious security implications for India”. Would you go and take it up when your neighbor’s building a path in his garden?

Faux Indian: He’s building a path in his garden! I’m in DANGER!!

No 6: Hijacking small neighbor

Well this is most outrageous. We thought India would have been wiser after the first stupid excuse. But this time it attempted to justify its incursion in the name of “protecting Bhutan”.

Faux Indian: Don’t move – this is Bhutan’s home. I’m here protecting it.

Faux Bhutanese: (with the faux Indian waving a knife at him) No not my home.

Anchor: The Bhutanese authorities have clearly told Chinese officials that Doklam is not Bhutanese territory and they are also confused by India’s behavior.

Well I’m just wondering, how does it feel shooting yourself in the foot?

No 7: Sticking to mistake knowingly

China has a strong will to solve the problem peacefully – with the prerequisite of India’s withdrawal of course.

However India is so thick-skinned that it is on the one hand crying for talk but on the other hand refusing to withdraw.

Have you ever negotiated with a robber who had just broken into your home and refused to leave? (Nooo) You call 911 or just fight him back, right?

Faux Indian: Why call 911? Don’t you want to play house bro?

Anchor: If you really want to play, get out of my house first. (Shaking her finger)"
Bollywood Stars Who Are Also Successful Entrepreneurs,"Bipasha Basu, Malaika Arora and Sussanne Khan- Founders Of The Label LifeWhen three fashionistas come together, the world will just become a better place for women especially. While Sussanne Khan has stayed away from the limelight that came with being the (now ex) wife of Hrithik Roshan, together with Bollywood sirens Malaika Arora and Bipasha Basu, the trio have taken their business acumen together to form The Label Life, a lifestyle and fashion brand. Image procured via Google Search Twinkle Khanna- An Interior DesignerThe wit queen of the Entertainment world has a new fan base especially after she released her very first book Mrs. Funnybones. Before she became a full fledged author, Twinkle Khanna has walked in several shoes of an actress, interior designer, film producer and a columnist to name a few. She recently revealed that it was pretty soon when she realised that acting is not her forte so she stepped aside and started interior designing. In partnership with her long time friend, Twinkle is founder of Sushmita Sen- Founder Of I AmThis woman has been an inspiration to many; her confidence is something every woman looks up to. Sushmita Sen defines beauty with brains in the best possible way. This beauty queen, who is also a mother of two beautiful girls, founded I Am. She helps people with education, welfare facilities, medical help, etc. It is one body collaborating with many other organizations, NGOs, TERI, and others with an intention to help people. Image procured via Google Search Arjun Rampal- Lounge OwnerThis hotness of an actor makes several women go weak in the knees with his sexy body and irresistible looks. Apart from being an actor, Arjun Rampal owns a lounge in Delhi named Lap, The Lounge. Image procured via Google Search Salman Khan- Founder Of Being HumanKnown to have a good heart, the 'bhai' of Bollywood, Salman Khan's 'Being Human' is a stint that did wonders among his fans. Apart from promoting his foundation at various events, he also manages to raise awareness and charity with the help of various retail outlets (online & offline) that sell 'Being Human' merchandise. Image procured via Google Search Deepika Padukone- Founder Of Live, Love LaughJust being a stunning performer on the celluloid didn't satisfy her, so she chose to co-create a clothing line called 'All About You' exclusively available on Myntra. Her foundation 'Live Love Laugh' has given new dimension and opened doors to come out in the open for the ones suffering from depression. Now that's what I call a good business woman and a Good Samaritan. Image procured via Google Search Madhuri Dixit- Dance AcademyDespite stepping away from Bollywood and moving to the US with her husband, Madhuri never gave up on her passion which is dancing. Her love towards dancing made her turn this talent of hers in to a business venture and runs an online dancing class, where she has collaborated with the best choreographers from around the world. Image procured via Google Search Milind Soman- PinkathonTall, rugged, handsome, athletic Milind Soman has the power to make women faint by just looking at him. Milind Soman's enthusiasm towards sports made him win a National award in swimming championship. In 1988, he set a record in Limca Books of Record for running 1,500 km in 30 days time. He is also the brand ambassador of Greenathon and Pinkathon, India biggest 'women only' marathon platform. Mr Soman has also been awarded with a title in the Ironman Challenge in 2015 in Traithlon by completing Shah Rukh Khan- Owner Of Red Chillies Pvt. LtdRed Chillies Pvt. Ltd and Kolkata Knight Riders has given 'King Khan' the title of a successful entrepreneur. Thank god for unlike the Bachchans' ABCL, Red Chillies did not prove to be a failed venture and got SRK the much deserved funds. Moreover, he also has a share in Indian franchise of KidZania which is an international chain of family entertainment centres. Image procured via Google Search Lara Dutta- Owns Bheegi Basanti ProductionsAfter an unsuccessful Bollywood stint, Lara Dutta chose to try her hands on entrepreneurship. The model-turned-actress recently started her own production company, Bheegi Basanti, and has also launched her sari collection. She also has brought out a fitness DVD on prenatal Yoga. Image procured via Google Search Shilpa Shetty Kundra- Launched PerfumeShilpa Shetty Kundra didn't have such a great stint at Bollywood, but won hearts and popularity after she won the reality show 'Big Brother'. This success made her step into the world of business and she launched her perfume S2. Not just that but Shilpa invested in the Iosis Spa to become its co-owner and launched fitness DVDs. Image procured via Google Search Suneil Shetty- GymsAn actor who has aged gracefully and given older men whole new fitness goals, Suniel Shetty is a successful entrepreneur who has several feathers on his cap. He runs a number of gyms across India and also owns a restaurant chain and a production company called Popcorn entertainment. He also owns Mischief, a boutique chain spread across Mumbai. In addition to that, he has also ventured into luxury real estate projects via his business venture S2 Realty. Image procured via Google Search Gul Panag- Founder Tech Start-UpOne of the most outspoken and boldest personalities we have in our country, Gul Panag is one celebrity that everyone adores, be it a man or a woman. An avid traveller and a fitness enthusiast, Gul even had her own travel show where she drove to Ladakh in a customized SUV. Her fondness towards fitness has culminated into starting a tech start-up that makes fitness apps. Image procured via Google Search Preity Zinta- Co-Founder Kings XI PunjabThis dimpled beauty of Bollywood has won many hearts and in fact recently broke hearts when she tied the knot with her long time boyfriend Gene Goodenough. Holding a degree in Criminal Psychology, this talented actress is a columnist, an activist and also co-founder of the IPL team Kings XI Punjab! Image procured via Google Search

DON'T MISS 814 SHARES 140 SHARES 512 SHARES 240 SHARES 4.9 K SHARES 140 SHARES 4.5 K SHARES"
"Barcelona Attack: Spanish Police Gun Down Five Terror Suspects, Foiled 'Bomb Plot'","The Spanish security agencies have gunned down five terror suspects after a terror attack in the busy walkway in central Barcelona. Thirteen people were killed and 100 were injured, 15 of them seriously, in what authorities called a terror attack.

afp

""It was clearly a terror attack, intended to kill as many people as possible,"" Josep Lluis Trapero, a senior police official for Spain's Catalonia region told reporters late Thursday.

The Islamic State group claimed responsibility, saying in a statement on its Aamaq news agency that the attack was carried out by ""soldiers of the Islamic State"" in response to the extremist group's calls for followers to target countries participating in the coalition trying to drive it from Syria and Iraq.

afp

According to AP report, Catalan police said they shot and killed five suspects in a seaside resort town south of Barcelona in response to a terrorist attack. They also said six civilians were injured in Cambrils but didn't immediately say how. The force is working on the theory that the Cambrils suspects are linked to the Barcelona attack, as well as to a Wednesday night explosion in the town of Alcanar in which one person was killed.

afp

After the afternoon attack, Las Ramblas went into lockdown. Swarms of officers brandishing hand guns and automatic weapons launched a manhunt in the downtown district, ordering stores and cafes and public transport to shut down.

Inputs From AP

Don't Miss 734 SHARES 11.5 K SHARES 41.5 K SHARES 25 K SHARES 14.8 K SHARES 15.1 K SHARES 20.1 K SHARES 10 K SHARES 4.1 K SHARES"
