Title,Article
"Wounds remain unhealed, lessons unlearnt","70 YEARS LATER…

Harish Khare

As the memory of those horrible days and years fades away, we are itching to reopen some of the settled questions about our collective existence. Perhaps after seventy years it is time, once again, to revisit those blood-stained days and recall Partition’s sobering lessons…

Harish Khare

With rare exceptions, the world has simply not known how to divide a nation amicably and peacefully. The division of India in 1947 to carve out a new state of Pakistan inevitably produced its own ghastly share of violence, dislocation and disruption.

Admittedly, the British decision to grant India independence was principally driven by the simple fact that the four-year-long World War II had totally exhausted the imperial will to rule; in fact, the British desire to hold on to India had already been tested morally and ethically by the Indian National Congress, which under the Mahatma’s leadership had waged a unique peaceful freedom struggle. The British middle classes, with their pretensions to liberal values, had no answer to the Mahatma’s saintly leadership. The Union Jack had to be lowered from Red Fort, sooner than later.

But by the time the British came to the conclusion that they could no longer stay in India, they had already instigated mischief among the Indian leadership. The colonial rulers had cynically worked on the Indian society’s religious fault lines, encouraged and cultivated sectarian agendas which ultimately coalesced into the demand for a separate nation.

The Muslim League, under Mohammed Ali Jinnah, had already legitimised use of violence in pursuit of its demands. The League’s call for ‘Direct Action’ was an invitation to chaos and the mobs. Once a society develops a taste for violence, its leaders are rarely able to calibrate and control the streets. By the time August 15, 1947, came the Muslim League’s leadership skills were already over-extended even in what came to be known as East Pakistan and West Pakistan. In India, the Congress leadership was barely able to push the mobs back.

Still, a monumental tragedy was destined to take place. The sheer scale of the number of Hindus and Sikhs, who found themselves forced to migrate out to India and of the Muslims in India who had to leave for Pakistan, was maddeningly benumbing. Grand statistics simply cannot convey the trauma and the tragedy that engulfed this part of the world soon after August 1947.

A sympathetic American reporter and an eye-witness described the post-Partition days as “one of the great convulsions of modern history.” On December 12, 1947, he tried to convey the nature of disaster that overtook the two nascent nations: “Consider what has happened. In an orgy of religious-communal madness, some 10 million citizens of the north-western provinces had been routed from their homes. An unknown total, probably between 2,00,000 and 5,00,000 (compared to 2,95,000 American war-dead in World War II), had been put to sword, machine-gunned, or roasted alive. The splintered Punjab administrations were quickly swamped and there even appeared danger that the infant central governments of India and Pakistan Dominions might succumb.” Phillips Talbot (An American Witness to India’s Partition).

The frenzy in the East was no less violent, no less gory, no less bloody than it was in the West. The Hindus, the Muslims and the Sikhs joyfully discovered their capacity for inflicting violence and death on their erstwhile neighbours as well as total strangers. The massacres, the mayhem and the madness outpaced humanity and all known civic-minded virtues; the trauma and tragedy touched nearly every home, every life. No one was unaffected; no one could remain emotionally unmolested by this continental turbulence.

After a few months the mobs could be rolled back and blood could be washed off the streets, but the memory of Partition-centric violence was now etched on the soul of an entire generation on both sides. The two successive states had entrenched habits and protocols of acrimony and suspicion and political leaders and sectarian interests saw to it that India and Pakistan would not settle down to a peaceful co-existence.

The raw memories of Partition also impacted on how the two states went about the business of creating an internal political order. Once Jinnah was gone, Pakistan hastily abandoned his ideas of an inclusive society and nation. In India, the Mahatma was assassinated. The murder was planned by those who wanted to make India a Hindu State and they thought the Old Man was an obstacle. Ironically, the assassination settled, once for all, how India would grant equal protection and equal citizenship to all its minorities.

Perhaps some in India would argue that Partition’s unfinished agenda still remains unattended. May be, after 70 years, we should simply revisit those horrible, horrible days of chaos and disorder before we embark on another self-defeating journey…"
"Dengue, chikungunya threat set to bite again","Punjab was among worst-hit states in last 2 years

Tribune News Service

Chandigarh, August 17

The state is facing a threat of outbreak of vector-borne diseases — dengue and chikungunya. Around 2,000 suspected and 127 confirmed cases of dengue have so far been reported in the state. Besides, 750 clinically suspected and 17 confirmed cases of chikungunya have also been reported. A look at the data of previous years reveal that this year the situation is not much better than the previous year when more than 10,000 dengue cases were reported. Last year, by mid-August around 170 cases of dengue were reported. “Though the number this year is a little less, the real challenge is the next three months,” said Dr Gagandeep Singh, nodal officer, Integrated Disease Surveillance Programme. He said though the Health Department was issuing almost 10 times more challans to defaulters providing a conducive atmosphere for vector breeding, dengue prevention needed strong participation of public, which unfortunately was not happening. Last year, Mohali was the worst affected district in the state with more than 2,000 cases. According to the Health Department, this year too Mohali has been badly hit by dengue. Chikungunya threat is too looming large over the state. It was last year that the first indigenous case of the disease was reported in Punjab and the number later crossed 2,000. The biggest worry for health officials is that over the last three years, despite having small population share, Punjab figured among the worst affected states. Last year with over 10,000 cases of vector-borne diseases, Punjab was the worst-affected state after West Bengal and Uttar Pradesh. In 2015, with more than 14,000 cases, Punjab was second after Delhi."
The Tribune-Sunday Special,"INDEPTH

The arrest of separatists and the charges against them go far beyond managing security. The hints are clear: the Centre won't concede any political ground to hardliners, and, any talk of talks would come later

[ + read story ]

ON July 24, seven Kashmiri separatist leaders were arrested by the National Investigation Agency (NIA) for allegedly funding militancy and unrest in Kashmir. It marked a shift in government’s policy to deal with secessionism in Kashmir. It is defined by iron fist with no valet glove.

The arrests followed a series of raids by the NIA that continued for over a month. Apart from active separatist workers, a battery of businessmen is also under scanner within and outside Kashmir, making the crackdown more target-oriented. Only this week the Enforcement Directorate raided a prominent business man of Kashmir.

Such crackdowns — conducted in the past too — related to alleged unlawful activities, in which cases were formally registered for follow-up investigations. But these yielded no results. The general belief among security agencies is that the hawala money has been pumped through cash, trade and funding through Middle East, but nothing has been established conclusively. The NIA probe, however, appears aimed at fixing the separatists and their alleged links to hawala channels.

The police, state intelligence and Central agencies maintain that hawala money has been used to fund street protests, subversive activities, violence and militancy in the state. According to the J&K government, 173 cases of funding have been registered in the state since 2001 till last year.

“Charge-sheets were issued in 90 cases, 45 were under investigation and 23 are awaiting sanction. Nine cases were untraced and six not admitted,” says a senior official. The police require the state home department’s sanction to proceed in the cases under various laws. Some of the cases were:

2011: Ghulam Mohammad Bhat, a key aide of hardline Hurriyat chairman Syed Ali Shah Geelani was arrested along with three others with alleged hawala money of Rs 21 lakh. The case was later handed to the NIA.

2002: J&K Liberation Front chief Yasin Malik was arrested after his aide was held on way to Srinagar from Nepal along with $100,000. A charge-sheet followed.

2006: Delhi Police slapped charges of funding separatist organizations on a Dubai-based Kashmiri businessman close to Hurriyat chairman Mirwaiz Umar Farooq.

These cases have only dragged on. The separatists have called the seizures and arrests as “a campaign of vilification”. Their denial lent some weight when last year Chief Minister Mehbooba Mufti, in a written response to a question in the state Assembly, denied having received any report about separatist leaders receiving hawala money.

What’s different now?

While the security situation on the ground remains fluid, the NIA has extended its role in targeting the entire separatist spectrum. “The operation is to basically explore a co-relation between funding from Pakistan and Hurriyat as well as militants,” an official privy to NIA investigations said. “The state police have been treating individuals of terrorist organizations invoking section 18 & 20 of UA(P) (Unlawful Activities Prevention) Act and the NIA is targeting organizations as a whole, including their hierarchy (section 38 UA(P) Act,” the officer said.

This is perhaps the first time section 38 UA(P) has been invoked in the state.

Hot on the money trail in Srinagar, Jammu, Haryana and Delhi, the NIA has tightened its noose and arrested seven Kashmiri separatist leaders for allegedly funding militancy.

The arrested separatists included Altaf Ahmad Shah alias Altaf Funtoosh (Geelani’s son-in-law and in-charge of legal cell in Hurriyat), Ayaz Akbar (Hurriyat spokesman), Raja Mehrajuddin Kalwal (district president of Srinagar for Geelani-led Tehreek-e-Hurriyat), Peer Saifullah (Geelani’s aide), Aftab Hilali Shah alias Shahid-ul-Islam (spokesman for Mirwaiz-led Hurriyat), Nayeem Khan (National Front chairman) and Farooq Ahmad Dar alias Bitta Karate (head of a JKLF faction). The sleuths have summoned at least over two dozen people for questioning, including Geelani’s sons.

The separatists were arrested in connection with the terror funding case under sections 120B (criminal conspiracy), 121 (waging war against Republic of India), 121A (conspiring to commit certain offences against the state) of IPC and sections 13 ( punishment for unlawful activities), 16 (punishment for terrorist act), 17 (punishment for raising funds for terrorist act), 18 (punishment for conspirac), 20 (punishment for being a member of terrorist gang or organization), 38 (offence relating to membership of terrorist organization), 39 (offence relating to support given to terrorist organization), 40 (offence of raising funds of Unlawful for a terrorist organization) of Unlawful Activities (Prevention) Act, 1967.

‘War against India’

The investigations began in the follow-up of a television expose that found Nayeem Khan, Karate and Javed Baba conceding that they received funding from Pakistan to perpetuate secessionist activities in Kashmir. The NIA later registered a case on May 30, against the separatist and secessionist leaders, including the members and cadres of the Hurriyat Conference, who have been acting in connivance with active militants of proscribed organizations Hizbul Mujahideen (HM), Dukhtarane Millat, Lashkar-e-Toiba (LeT) and other militant organizations. These outfits allegedly raised, received and collected funds through various illegal means, including hawala. Some of the charges relate to funding separatist and terrorist activities, including throwing stones on security forces, burning schools, damaging public property and waging war against India.

J&K former Director General of Police K Rajendra Kumar says NIA is a professional organization and the investigation will definitely have impact on the ground. “They (NIA officials) have all the data and are immune to interference from any quarter. You need to cut the oxygen of funding. Once that is done, you will see an impact on the situation,” he says. “The investigation of funding is a specialist job. The NIA has the logistics to investigate such cases.”

Separatists, who have termed the crackdown aimed at “defaming them and their movement”, have roped in Kashmiri lawyers to defend their case. While the lawyers may question the jurisdiction of NIA in J&K, the separatist have a tough road ahead. Their shutdown call against the NIA crackdown did not evoke an effective response from the people.

“The NIA crackdown may trouble us, but in the end New Delhi will be a loser. Any further delay in resolving the Kashmir issue will only harm the government,” says a separatist leader.

The crackdown: No one spared, hardliners or moderates"
DISABLED,"As Devendra Jhajharia gets set to be the first Paralympian to receive the Khel Ratna Award, he becomes a ray of hope for many

Sabi Hussain

Devendra Jhajharia’s phone hasn’t stopped ringing ever since his name was recommended for the Rajiv Gandhi Khel Ratna Award. While there is a deluge of congratulatory messages on his Twitter and Facebook accounts, his native home in Rajasthan is being frequented by politicians and bureaucrats. The award has suddenly brought the focus on this two-time Paralympics gold medalist. “It’s been a surreal few days,” said an elated Jhajharia over the phone from his village Jhajharian ki Dhani in Churu district. “It’s like a dream come true. I waited 12 years for this honour, since winning the gold at 2004 Athens Paralympics. The award has given a ray of hope to other para athletes in the country,” said the javelin thrower and Rio Paralympics gold medalist. August 29 would, indeed be, a watershed moment in para-athletics, as Jhajharia will become the first Paralympian to receive the Khel Ratna Award at the Rashtrapati Bhavan. Each day a new fight For para-athletes, such moments of joy during their professional career are far and few between. Instead, they have an everyday fight on their hand for recognition, equality and, more importantly, against bureaucratic red-tapism. Last month, para-swimmer Kanchanmala Pande was forced to beg in Berlin, Germany, after she apparently ran out of money to meet her expenses while competing in a week-long tournament. Recently, a 62-member Indian contingent of hearing-impaired athletes, returning after its best-ever performance at the Deaf Olympic Games in Turkey, protested when no official from the Sports Ministry or the Sports Authority of India came to receive them at the Delhi International Airport. “Time and again, we have been failed by the system,” said Haryana’s Paralympian and Arjuna awardee discus thrower Amit Saroha.

Spurred by taunts

Recalling his struggle, Saroha said the fight was not about coming out of the hospital following a horrific car accident in 2007 but being able to find acceptance in the society. “I wanted encouragement, not sympathy. I wanted the Tri-colour wrapped around my body, not a consoling hand on my shoulder,” said Saroha, a gold medallist at the 2014 Incheon Asian Para Games and a silver medalist at 2015 and 2017 editions of the World Championships. “My lower body had become paralysed after the accident. I didn’t want to sit idle at home. Since I had been a National-level hockey player until 2003, I decided to participate in throw ball and discus throw events. But, the Paralympic Committee of Haryana (PCH) refused to accept my candidature,” said Saroha. “The accident had left me quadriplegic (with paralysis of all four limbs). The PCH officials were convinced that my upper body wouldn’t be able to generate the strength required to throw the discus. I had to run from pillar-to-post for my selection in the Indian team. It was only when I won my first international medal (a silver in discus throw) at the 2010 Guangzhou Asian Para Games that the attitude of people changed,” added the 32-year-old from Sonepat. Jhajharia had his own poignant tale to share. “Since childhood, I was considered physically weak. My classmates would make fun of my thin frame. To become physically stronger, I started participating in sports. But things took a turn for the worse. At eight, while climbing a tree, I was electrocuted after accidently touching a live wire. This led to the amputation of my left arm. I would be taunted with comments like “tundla ho gaya hai” (his hand has become disabled). It was a nightmare.” “In 1995, I participated in a district-level championship for students. All other participants were able-bodied. I became district champion after winning the tournament. That was the turning point of my life. Later, when I won gold medal at the Far East and South Pacific Games for the Disabled (FESPIC) in 2002 and at the Athens Paralympic Games in 2004, I shut the mouth of all those who had told my parents that I wouldn’t be able to do anything in my life,” added the 36-year-old.

What keeps them going

“Simple, to see the Tricolour rise and hear the National Anthem during the medal ceremony. People who have never experienced it won’t understand. You can’t describe the feeling of pride in words,” said high-jumper Sharad Kumar, who won a silver medal at the recent World Para-athletics in London. “It’s also our way of living with dignity. We para-athletes feel ignored and discriminated. But, we have found solace in sports. I only have problem with my leg but the able-bodied have problem with their mind and heart. They are more disabled than us,” added the 2014 Incheon Para Asian Games gold medalist, who suffered paralysis of his left leg after being administered wrong medicine for polio at the age of two. Tragedy struck Sundar Singh Gurjar when he lost his left hand in a car accident in 2015. He created history by becoming the first Indian to win gold in men’s javelin throw event at the Worlds recently. “I had been competing as a javelin thrower till that fateful evening. But, before anybody could point a finger at me, I made sure to continue pursuing my sports career. I didn’t want people to make fun of my disability.” The gold at the Worlds was a redemption for Gurjar, who missed an announcement call for his name at the Rio Paralympics as he failed to understand the accent of the announcer. He reached the arena a minute late to find that he’d been disqualified. “This shows the indifferent attitude of the Paralympics Committee of India (PCI). What exactly was the official attached to our contingent doing when my name was called? The PCI official should have ensured my participation. I was left to fend for myself,” Gurjar said. Giving back to the game In spite of the hardships faced by them, these shining lights of para-athletics are a role model for other differently abled athletes. Saroha spends his entire salary of Rs 40,000 per month — which he earns as a coach at the SAI’s Sonepat centre — on providing training and arranging for exposure trips abroad of some of his protégés like Dharambir Nain, Amit Balwan, Sunil, Rampal Chahar, Rinku Hooda and Ekta, among others. At present, Saroha is funding 17 para-athletes. “If I’ll help others, only then God will help me,” said Saroha. “Whatever cash award I receive from the Haryana government, I spend the amount on funding my trainees. I don’t want other para-athletes to go through the same struggle I was subjected to.” Both Jhajharia and Deepa Malik, Rio Paralympics silver medallists from Haryana, have written to their respective state governments to provide them land to open a sports academy for para-athletes in Jaipur and Gurugram, respectively."
Martyr cremated with military honours,"Tribune News Service

Dehradun, August 17

The mortal remains of martyr Hawaldar Narendra Singh Bisht, who attained martyrdom in a Pakistani ceasefire violation in the Uri Sector of Jammu and Kashmir, were consigned to flames in Haridwar today. The last rites were conducted with full military honours and in presence of a large gathering. Earlier, Uttarakhand Chief Minister Trivendra Rawat himself visited Selaqui residence of the martyr in Dehradun and laid a floral wreath on his body. The Chief Minister was accompanied by Vikasnagar MLA Munna Singh Chauhan, Sahaspur MLA Sahdev Singh Pundir and other BJP leaders. Uttarakhand Congress president Pritam Singh too reached the martyr’s residence and offered his tributes. Bisht, who sustained bullet injuries in the ceasefire violation in the Uri Sector on August 7, was undergoing treatment at the Jammu Military Hospital, where he succumbed to injuries yesterday. Martyr Narendra Singh Bisht was to retire next year and had only come to his house on a 10 day leave in July. Bisht leaves behind his wife Asha and two daughters Neha and Nikita, who were in a state of shock. Bisht belongs to Chamoli Garhwal."
First US crude oil shipment to reach India next month,"Washington, August 17

The first shipment of American crude oil worth $100 million will reach India next month, with US President Donald Trump promising to be a “reliable, long-term supplier” of energy to India’s development needs. The shipment of crude oil to India comes nearly two years after the then US president Barack Obama lifted the 40-year-old ban on its exports. During their maiden meeting on June 26, Prime Minister Narendra Modi and US President Donald Trump agreed to deepen the engagement in the energy sector. Soon, Indian companies started purchasing crude from the US. Two Indian oil giants, Indian Oil Corporation and Bharat Petroleum, placed orders for over four million barrels. With this India, the world’s third-largest oil importer, joins Asian countries like South Korea, Japan and China to buy American crude after production cuts by the Organisation of the Petroleum Exporting Countries drove up prices of Middle-East heavy-sour crude, or grades with a high sulphur content. “New breakthroughs! oil shipments from US to India has started,” the Indian Embassy in Washington tweeted yesterday after Indian Ambassador to the US Navtej Sarna handed over papers for the shipment to Texas Governor Greg Abbott. The first lot of two million barrels costs $100 million, but given the volume being contemplated by Indian companies, this new development is expected to boost the bilateral oil trade to $2 billion. “Opening New Vistas in India US cooperation,” tweeted the Indian Embassy which also posted several pictures and a video of the event. Consignments of American crude oil left the US shores between August 6 and August 14 and are likely to reach Paradip (Odisha) in the last week of September. — PTI"
