Title,Article
"The Tribune, Chandigarh, India","With rare exceptions, the world has simply not known how to divide a nation amicably and peacefully. The division of India in 1947 to carve out a new state of Pakistan inevitably produced its own ghastly share of violence, dislocation and disruption.

As the memory of those horrible days and years fades away, we are itching to reopen some of the settled questions about our collective existence. Perhaps after seventy years it is time, once again, to revisit those blood-stained days and recall Partition’s sobering lessons…

Harish Khare

With rare exceptions, the world has simply not known how to divide a nation amicably and peacefully. The division of India in 1947 to carve out a new state of Pakistan inevitably produced its own ghastly share of violence, dislocation and disruption.

Admittedly, the British decision to grant India independence was principally driven by the simple fact that the four-year-long World War II had totally exhausted the imperial will to rule; in fact, the British desire to hold on to India had already been tested morally and ethically by the Indian National Congress, which under the Mahatma’s leadership had waged a unique peaceful freedom struggle. The British middle classes, with their pretensions to liberal values, had no answer to the Mahatma’s saintly leadership. The Union Jack had to be lowered from Red Fort, sooner than later.

But by the time the British came to the conclusion that they could no longer stay in India, they had already instigated mischief among the Indian leadership. The colonial rulers had cynically worked on the Indian society’s religious fault lines, encouraged and cultivated sectarian agendas which ultimately coalesced into the demand for a separate nation.

The Muslim League, under Mohammed Ali Jinnah, had already legitimised use of violence in pursuit of its demands. The League’s call for ‘Direct Action’ was an invitation to chaos and the mobs. Once a society develops a taste for violence, its leaders are rarely able to calibrate and control the streets. By the time August 15, 1947, came the Muslim League’s leadership skills were already over-extended even in what came to be known as East Pakistan and West Pakistan. In India, the Congress leadership was barely able to push the mobs back.

Still, a monumental tragedy was destined to take place. The sheer scale of the number of Hindus and Sikhs, who found themselves forced to migrate out to India and of the Muslims in India who had to leave for Pakistan, was maddeningly benumbing. Grand statistics simply cannot convey the trauma and the tragedy that engulfed this part of the world soon after August 1947.

A sympathetic American reporter and an eye-witness described the post-Partition days as “one of the great convulsions of modern history.” On December 12, 1947, he tried to convey the nature of disaster that overtook the two nascent nations: “Consider what has happened. In an orgy of religious-communal madness, some 10 million citizens of the north-western provinces had been routed from their homes. An unknown total, probably between 2,00,000 and 5,00,000 (compared to 2,95,000 American war-dead in World War II), had been put to sword, machine-gunned, or roasted alive. The splintered Punjab administrations were quickly swamped and there even appeared danger that the infant central governments of India and Pakistan Dominions might succumb.” Phillips Talbot (An American Witness to India’s Partition).

The frenzy in the East was no less violent, no less gory, no less bloody than it was in the West. The Hindus, the Muslims and the Sikhs joyfully discovered their capacity for inflicting violence and death on their erstwhile neighbours as well as total strangers. The massacres, the mayhem and the madness outpaced humanity and all known civic-minded virtues; the trauma and tragedy touched nearly every home, every life. No one was unaffected; no one could remain emotionally unmolested by this continental turbulence.

After a few months the mobs could be rolled back and blood could be washed off the streets, but the memory of Partition-centric violence was now etched on the soul of an entire generation on both sides. The two successive states had entrenched habits and protocols of acrimony and suspicion and political leaders and sectarian interests saw to it that India and Pakistan would not settle down to a peaceful co-existence.

The raw memories of Partition also impacted on how the two states went about the business of creating an internal political order. Once Jinnah was gone, Pakistan hastily abandoned his ideas of an inclusive society and nation. In India, the Mahatma was assassinated. The murder was planned by those who wanted to make India a Hindu State and they thought the Old Man was an obstacle. Ironically, the assassination settled, once for all, how India would grant equal protection and equal citizenship to all its minorities.

Perhaps some in India would argue that Partition’s unfinished agenda still remains unattended. May be, after 70 years, we should simply revisit those horrible, horrible days of chaos and disorder before we embark on another self-defeating journey…"
Bhatinda,"To check the records of various development works undertaken during the SAD-BJP regime

18 Aug 2017 | 12:58 AM

BATHINDA: To check the records of various developmental works undertaken during the SAD-BJP government, a three-member team from the Local Bodies Department, Chandigarh, today reached the office of the Municipal Corporation, Bathinda.

[ + read story ]

Nikhila Pant Dhawan

Tribune News Service

Bathinda, August 17

To check the records of various developmental works undertaken during the SAD-BJP government, a three-member team from the Local Bodies Department, Chandigarh, today reached the office of the Municipal Corporation, Bathinda.

The team led by superintendent Jaspal Singh began their day by holding a meeting with Municipal Commissioner Sanyam Aggarwal.

Thereafter, the officials started inspecting and scrutinising the records of the MCB.

The team members reasoned that the Local Bodies Department was initiating a probe into the proper documentation and record of bills for the projects undertaken by the corporations.

In case any of the corporations are found to be lacking on that front, action will be taken against them by the department, they said.

Meanwhile, sources in the MCB claimed that the real motive of the inspection was to ascertain the embezzlement of funds in the name of development projects.

Sources said such a detailed inquiry into the records of all the branches of the corporation pointed to the government’s intention to unearth cases of fraud and scams.

On the first day, the team focused on checking the records of the building branch and general works branch of the MCB.

The team also sought records of the proposals sent by the MCB for the works undertaken during the SAD-BJP term in the state.

The team members collected information about the original proposals sent by the MCB, rectifications done at later stages, response given by the government, funds released and the utilisation of the funds.

The building branch officials were made to make available records of the maps submitted with the branch and the approvals which were granted.

The team also looked into the details of utilisation of grants, which were released by the former state government and the Central Government.

The account branch records were also checked to collect details about the revenue and expenditure of the MCB.

This is possibly the first time that a special team has been constituted to look into the records of the MCB.

Before this, such scrutiny was conducted by the Local Bodies Department through CAG or the Audit Department.

The team will continue to check the records of the MCB tomorrow as well and submit a report to the department by September 15."
6 injured as part of under-construction tunnel collapses,"Jammu, August 18

Six labourers were injured when a part of an under-construction tunnel of Parnai Hydel Power project collapsed in Jammu and Kashmir’s Poonch district on Friday. The 37.5 MW Parnai Hydel Power project is expected to be completed by January end next year. Police said a part of the tunnel collapsed at Surankote belt and six labourers came under the debris. While two critically injured labourers were shifted to the Government Medical College hospital in Jammu, the rest have been admitted in hospital there. The Rs 604-crore hydro electric project (HEP) has been conceived as a multi-purpose one, keeping in mind its potential to cater to both power and irrigation-related needs of the district. The work on the Parnai project, a run-of-the-river (RoR) scheme with an installed capacity of 37.5 MW, began in April 2014. It is expected to irrigate vast tracts of agricultural land once it is completed. PTI"
The Tribune: Jobs and Careers,"Devendra Jhajharia’s phone hasn’t stopped ringing ever since his name was recommended for the Rajiv Gandhi Khel Ratna Award. While there is a deluge of congratulatory messages on his Twitter and Facebook accounts, his native home in Rajasthan is being frequented by politicians and bureaucrats.

Wounds remain unhealed, lessons unlearnt With rare exceptions, the world has simply not known how to divide a nation amicably and peacefully. The division of India in 1947 to carve out a new state of Pakistan inevitably produced its own ghastly share of violence, dislocation and disruption.

Reporting turbulent times The Tribune, ever the chronicler of the people and events of Punjab, found itself in an unusual situation of becoming the subject of news reports."
Chopper service to Manimahesh begins,"Balkrishan Prashar

Chamba, August 17

Fare, other details

Helicopter fare from Bharmour to Gauri Kund and back was Rs 2,980

The one-way fare was Rs 1,490.

The flights will continue between 6 am and 7 pm.

One helicopter ferries six passengers, including the pilot, per trip

One way flight takes six minutes.

Fifty per cent seats have been allocated online, while the rest can be booked offline at ticket counters of the heli-taxi service at Bharmour.

For the ongoing Manimahesh pilgrimage, two helicopter operators - Aryan Aviation Pvt Ltd and UTair India Pvt Ltd – today started flights between Bharmour township and Gauri Kund, nearly three km short of Manimahesh lake in the mountainous terrain of Bharmour in Chamba district. The flights would continue till August 29, the final bath day of the pilgrimage on the occasion of Radhashtami. Fifty per cent seats have been allocated online, while the rest can be booked offline at ticket counters of the heli-taxi service at Bharmour. Giving this information here today, Deputy Commissioner of Chamba Sudesh Mokhta said over phone that the pilgrims could avail the chopper facility from Bharmour to Gauri Kund. Helicopter fare from Bharmour to Gauri Kund and back was Rs 2,980 and the one-way fare was Rs 1,490. “The flights will continue between 6 am and 7 pm. One helicopter ferries six passengers, including the pilot, per trip,” Mokhta said. One way flight takes six minutes. Mokhta said that ADM Bharmour, who is chairperson of Manimahesh Trust, is the mela Officer to supervise the Manimahesh Yatra arrangements along with staff strength of 140 officials. As many as 13 rescue teams and 11 medical teams had been formed for the benefit of the pilgrims. Provision of 67 langars has also been permitted en route the pilgrimage route. “So far over one lakh tourists have taken holy bath in the Manimahesh Lake. Keeping in view the huge influxes of pilgrims, more than 5 lakh pilgrims are expected to visit Manimahesh this year”, Mokhta said. The itinerary of Manimahesh had been divided into 13 sectors from the safety, security and regulation of traffic point of view, he said adding that 700 security personnel had been deployed for the purpose. There was complete ban on animal sacrifice, Mokhta stated, adding that upholding the sanctity of the pilgrimage was a priority. The fortnight-long pilgrimage to Manimahesh in Chamba district had begun from August 15 on the eve of Sri Krishna Janamashtami which would culminate on the occasion of Sri Radhashtami on August 29 with religious fervor. The holy Manimahesh Lake is situated at an altitude of 13,500 feet while the Kailash Mount is at an altitude of 18,000 feet. Set in the Bharmour mountainous valley of Chamba district, Manimahesh Lake is about 216 km away from Pathankot railhead, via Chamba."
"The Tribune, Personal finance news","KG Krishnamoorthy Rao

Climate change is not merely a much talked about subject anymore. It has started manifesting itself rather cruelly. Unseasonal heavy rains and floods are no longer abnormal. Every year, several parts of the country face unprecedented rain that causes mayhem in peoples’ lives. The constant lash of rain causes floods in several regions of India causing numerous deaths, health hazards, damage to automobiles and property.

Be prepared

While natural calamities are unpredictable and unavoidable, it is imperative that we keep ourselves prepared for such eventualities with effective loss-minimisation measures. However, there could still be financial losses due to damage to property which cannot be avoided altogether. Insurance provides effective solution in terms of mitigating such losses by providing adequate compensation.

Property, motor insurance

While life and health insurance covers are vital for every human being, it is essential to include property and motor insurance as an integral component of your financial planning.

Few things in life matter as much to us, as our home does. Any damage to this can cause financial as well as emotional setback. While emotional setback is in the realm of the mind, only an appropriate insurance for property can safeguard one from financial setback. Apart from the building itself, the contents and other valuables in the house can also be protected through a home insurance cover. Usually, property insurance provides coverage against natural calamities such as fire, explosion and implosion, earthquake, lightning, storm, cyclone, tempest, tornado, hurricane, flood and inundation, subsidence, landslides and rockslides.

Property/home insurance policies are not solutions for natural calamities alone. They offer compensation for losses arising out of a number of other eventualities. They provide coverage against fire, burglary/housebreaking and natural calamities, losses or damages to domestic and electronic appliances and portable equipment, such as laptops, liabilities like tenants’ legal liability, domestic workers compensation and public liability.

During floods, automobiles are partially or completely submerged in water and citizens struggle with ways to recover their vehicle.

Innovative solutions

People in flood-prone areas find it difficult to get their cars towed away and delivered to workshops and dealers. Additionally, they are also charged higher parking fee by dealers (approx. Rs 11,000) and even higher by recovery van dealers just to get their cars towed away to a garage or workshop.

These are times when insurers stretch themselves to offer timely and innovative solutions to mitigate the miseries of the customer. Insurers not only provide financial support for repairing your car but also can help you with valuable tips to avoid further aggravation of the loss or damage to the car.

Add-on covers

What is important is that you should not delay reporting your vehicle to the nearest workshop. The list of workshops can be availed from your insurer itself. It is advisable to purchase additional protection by way of add-on insurance covers, which can be added to your current policy at minimal cost. Add-on covers like engine protector/hydrostatic lock cover will cover you against losses to engine due to water ingression.

Right insurance cover

To buy the right insurance policies to cover your property and vehicle, especially during natural calamities, you need to evaluate various policies available in the market before signing on the dotted line. Gather all information on the policy and the insurer to understand their reputation in the market, particularly the speed of claim settlement. Be aware of the inclusions and exclusions of the policy so that you can have an appropriate mix of all that you require. Inexpensive covers may leave out some key coverage that is crucial for full protection. Look for available insurance riders. The insurance company that you approach may be able to offer you extra coverage especially for valuable items like jewellery.

Time to take a call

Timing, too, is important when it comes to disaster insurance. It is important that you may not be given a cover against a natural disaster when one is in the offing. Always remember to read the contents of the insurance policy. Do ensure that you purchase the policy from an insurer with a good claim settlement record. Think about the security and amity that the insurance protection will offer.

The writer is Managing Director and Chief Executive Officer, Future Generali India Insurance Company Limited. The views expressed in this article are his own"
"The Tribune, Chandigarh, India","27 Dec 2014 | 11:54 PM

With the bulldozing fury of an iconoclast, Modi dramatically altered the Indian political landscape, flattening in the process the Grand Old Party and adding to our lexicon phrases such as Tsu-Namo and India Modi-fied

[ + read story ]

Modi! Modi! Modi! Rarely is an Indian Prime Minister accorded such a rapturous reception by audiences wherever he speaks, whether at the numerous political rallies or gatherings at Madison Square Garden in New York or the Allphones Arena in Sydney. Seldom does a single individual make such an impact that an entire year is defined by what he says, does or wants, as Narendra Modi did in 2014.

So if The Tribune has declared 2014 as the Year of Modi, it is not because of his oratorical skills (his opponents, in fact, accuse him of spending most of his time speechifying). Or for the rock-star persona that he has acquired in the past year. It is because Modi, with the bulldozing fury of an iconoclast, dramatically altered the Indian political landscape, flattening in the process the Grand Old Party and adding to our lexicon phrases such as Tsu-Namo and India Modi-fied. In doing so, he achieved Mission Impossible: Winning a clear majority for the BJP in the General Election and forming the first government in 25 years that doesn’t have to depend on coalition partners.

In a country as vast and vibrant as India, it may not be wise to take a monochromatic view of developments that shaped us in 2014. There was terror constantly lurking, both within and without, that dominated the discourse. In the past month, we were witness to three such dastardly acts: In Uri, suicide bombers stormed into an Army camp and mowed down 11 soldiers and policemen; in Peshawar, AK-47 toting Islamic militants barged into an Army School and let loose a murderous fusillade that killed 150 persons, mostly students; Sydney saw a lone wolf hold hostage customers at a café, killing two of them before being gunned down by the security forces. In Syria and Iraq, a new form of Islamic extremism took root with brutal consequences.

The year saw crime and culpability apart from shame and scandal. The nation was shocked and rocked again when in Delhi a young working woman was raped by a taxi driver whom she had hired to take her home at night. In the region, self-styled godmen made news for the wrong reasons. In Haryana, one of them defied court orders for his arrest, forcing the police to engage in a pitched battle with his supporters to nab him. Another, who was charged with castrating some of his followers, unabashedly acted in a film that portrayed him in a divine light. The followers of a guru in Punjab refused to cremate his body after his death claiming that he would soon ‘return’ from his astral journey.

The year had many bright spots too. Indian space scientists took a stellar leap when a craft they built and launched successfully orbited Mars, earning them the distinction of being the first to get it right the first time. In Jammu and Kashmir, voters preferred the ballot over the bullet by turning out in record numbers in the recent Assembly elections. Germany defeated Argentina 1-0 to lift the football World Cup. And Rohit Sharma smashed 264 runs in an ODI to notch up a record.

If there were cheers, there were tears too, in plenty. Srinagar was inundated with unprecedented floods that turned the tourist paradise into a watery hell. In Himachal, 24 engineering students from Hyderabad, on an educational tour, were drowned when the water levels rose while they were frolicking in the Beas. A fire aboard the submarine INS Sindhuratna resulted in the death of two Navy personnel and triggered the resignation of Admiral DK Joshi — the first such on moral grounds. Internationally, the tragic shooting down of a Malaysian Airlines flight by Ukrainian rebels saw 298 passengers perish.

Yet, for India, 2014 truly belonged to Modi, who chalked out a masterly election campaign, complete with 3-D effects, to wow audiences across the country with his development mantra. Fed up of the indecisive and effete Congress-led UPA II, voters put their faith in Modi to bring about a decisive government that would deliver on its promises. Modi began well by inviting the region’s leaders, including Pakistan’s Prime Minister, for his swearing-in ceremony and then announced a slew of programmes, including ‘Make in India’ and ‘Swachh Bharat’ that fired the imagination of the public and sent stock markets soaring. Luck helped too with world petroleum prices dropping, pushing down inflation in India to near zero and shoring up the flagging economy.

The Opposition though felt that Modi was just a showman with little to show and mocked that the “achche din” he promised had yet to materialise. It didn’t help Modi one bit when the saffron brigade shifted the focus to issues such as conversion and love jihad. Yet, by the year-end, Modi seemed to be on an extended honeymoon with voters in Haryana, Maharashtra and now Jharkhand endorsing his brand of politics. It put the BJP in the driver’s seat in these states, unlike in J&K where the party made impressive gains but fell far short of a majority. In 2014, the Modi juggernaut seemed unstoppable. The New Year beckons!"
The cross of debt,"Satyawan Malik

Satyawan Malik

NOTHING irked my father as much as smoking, lies and unscrupulous loans. A headmaster in the 1970s, he would quote Pt Lakhmi Chand’s verse: ‘Le ke dede kar ke khale, us tae kon jabbar ho se; Nugra manas aankh badal ja, samajhdar ki maer ho se’ (If you work hard and honestly pay back what you borrow from others, no one can be stronger than you. If an ungrateful liar turns hostile, it will be a tough time for the sane). My father, a postgraduate in maths from Panjab University, read a lot, wrote a lot, taught a lot, and yet loved agriculture work. I wonder if the days were longer or life was slower, or both — such was his efficacy in whatever he undertook. One Sunday afternoon we were returning home from our fields, when we saw our neighbour in the village riding a punctured bicycle with unusual speed. He was panting hard, making it difficult for him to tell us what was the matter. ‘Jeep’ is all he managed to utter and dashed away. My father, giving me ‘walk the sum’, began his algorithms about the neighbour, Mr M. ‘Half of the eight acres have already been pledged, at no rates, to pay off only the interest to one of three moneylenders. Total pendency is nightmarish. Still the hubristic drunkard defies penitence. The eldest son has gone awry...the anaemic wife is never short of breath in wanting him to mend his ways. They have two young daughters to marry off. His land-and-house distribution dispute with the elder brother knows no resolution. The fields have been left unattended...no books for the youngest son... the house is crumbling. Yet he thinks no one wiser...no compunction, no scruples.’ My father would add that studies and agriculture demanded austerity and discipline. Soon we found a bank jeep stopping near Mr M’s house. Four bank officials were holding loan-ledgers; accompanying them were two policemen. But the jeep would bring no surprise to Mrs M, who didn’t know how to hold her tongue. The bank men stood no chance against her. When they proposed the auctioning of a buffalo and a cow, she pounced on them, warning:‘Gau ko haath mat laga dena, mere bhai ne di thi!’ The eldest son, when asked about his father, defiantly retorted that he was away for a week. It didn’t work as my father’s over-simplistic view of the truth came out. The son and the mother instantly coalesced into a laconic grudge: ‘Aap to sarkari naukri mein ho, aap kya jaano garibi ki maar’ (You have a government job, so you cannot know the curse of poverty). Unimaginably, some people have suffered so much hunger, depression, defeat and the burden of debt that it is hard to live without succumbing to the temptation of becoming a fugitive. Wouldn’t the Shakespeare of Haryana, Pt Lakhmi Chand, choke on the elegy written on the fight, plight and flight of the not-so-simplistic agro-sociologists?"
